company_name,contact_name,position,tel,mobile,fax,address,zip_code,country,province,city,website,ali_website
Shenzhen DWG Watch & Clock Company Limited,Ms. Janie jiao,Sales Manager,86-755-27472184,13570835626,86-755-27563886,"A Room,5/F, A Bldg, QiYu Industrial Park, Tiezai Street,Gonele Village, Xixiang Town, Bao'an District,Shenzhen",518102,China,Guangdong,Shenzhen,http://www.dwgwatch.com,http://zosiyo.en.alibaba.com/contactinfo.html
"Contec Medical Systems Co., Ltd.",Ms. Echo Qu,Manager,86-335-8015556,86-15032385021,,"No.112 Qinhuang West Avenue,Economic and Technology Development Zone",066004,China,Hebei,Qinhuangdao,http://www.contecmed.com,http://contec.en.alibaba.com/contactinfo.html
"Shenzhen Colin Electronic Technology Co., Ltd.",Mr. Denny Lee,Sales Manager,86-0755-21087346,86 13902615054,,601 6th Floor Yousong Business Building No.48 Minqing Road Fukang Community Longhua Subdistrict Longhua District,,China,Guangdong,Shenzhen,http://www.colinelec.com,http://szcolin.en.alibaba.com/contactinfo.html
"Dongguan City Angle Wood Art Co., Ltd.",Mr. Kell xiao,,86-0755-23061914,13760296050,,7 Kanda San Road,,China,Guangdong,dongguang,http://www.ovewood.com,http://ovewood.en.alibaba.com/contactinfo.html
"Shenzhen Paladin Technology Co., Ltd.",Ms. Cici Yu,CEO,0086-0755-61852368,,,shajing,,China,Guangdong,shenzhen,,http://packaginghot.en.alibaba.com/contactinfo.html
"Shenzhen Iezway Technology Co., Ltd.",Ms. Ann Lee,Sales Manager,0086-755-83718852,13715314066,,"No. 20, Yangmei Rd., Yangmei Village, Bantian Street,LongGang Distrct,ShenZhen,China",518129,China,Guangdong,Shenzhen,http://www.iezway.com,http://iezway.en.alibaba.com/contactinfo.html
"Guangzhou Skmei Watch Co., Ltd.",Mr. Bento Lin,Sales Manager,86-20-35754138,18578785254,86-20-35754128,"Tangge Village , Shijing Town, Baiyun District",510450,China,Guangdong,Guangzhou,http://www.skmei.com,http://skmeismart.en.alibaba.com/contactinfo.html
"Hangzhou Hangkai Technology Co., Ltd.",Mr. Robin Xu,General Manager,86-152-68129943,15268129943,86-571-88992818,"Room 517, 4th Building, Xixi Feng Shang, 499 Wen San West Rd., West Lake District",,China,Zhejiang,Hangzhou,http://www.hzhkkj.com,http://hzhkkj.en.alibaba.com/contactinfo.html
"Dongguan City Angle Wood Art Co., Ltd.",Mr. Kell xiao,,86-0755-23061914,13760296050,,7 Kanda San Road,,China,Guangdong,dongguang,http://www.ovewood.com,http://ovewood.en.alibaba.com/contactinfo.html
"Zhejiang Lianhe Electronics Co., Ltd.",Ms. Andrea jin,Sales assistant,86-0577-62383212,8618968808388,86-0577-62382566,"Houyu Village, Shifan Town",325600,China,Zhejiang,Yueqing,http://www.lhecn.com,http://lhe.en.alibaba.com/contactinfo.html
"Ningbo Suntour Commodity Co., Ltd.",Ms. Trista hu,,0086-574-86567717,,,No.1 Xiyun Road Xiepu Development Zone Zhenhai District,315204,China,Zhejiang,Ningbo,http://www.ctpdrybay.com/,http://suntournb.en.alibaba.com/contactinfo.html
"Shenzhen Lworld Electronic Co., Ltd.",Mr. Geo szlworld,Manager,86-755-32816587,13715039836,86-755-36973422,"Shenha.B., Wanzhong Shenghuo Village, MZ Street, Longhua New Dist.",518131,China,Guangdong,Shenzhen,,http://lworld.en.alibaba.com/contactinfo.html
"Shanghai Xuanfeng Trading Co., Ltd.",,,,,,,,China,,,http://smaelwatch.com,http://smael.en.alibaba.com/contactinfo.html
"Shenzhen Ogya Technology Co., Ltd.",Mr. Picro Peng,CEO,86-0755-13554926367,13554926367,,longgang zhangbei road,518000,China,Guangdong,Shenzhen,,http://ogya.en.alibaba.com/contactinfo.html
"Guangzhou Juanjuan Electronic Technology Co., Ltd.",Ms. april tang,,86-020-13145896507,,,baiyun,,China,Guangdong,guangzhou,https://www.aliexpress.com/store/408984,http://juanjuan.en.alibaba.com/contactinfo.html
"Shenzhen Yaqi Watches Co., Limited",Ms. Jennifer Liu,,86-0755-29519791,13823109501,86-0755-23057306,"Floor 6, 105 Reservoir Road, Phoenix Gang Community, Xixiang Street, Baoan District",518000,China,Guangdong,ShenZhen,http://gradywatch.com,http://grady.en.alibaba.com/contactinfo.html
"Ningbo Topeast Electronic Technology Co., Ltd.",Mr. Peter Tong,Sales Manager,86-574-87117437,13306633660,86-574-56877009,"3404,Building 56,#13 XingxingDushi,jiangbei area",315032,China,Zhejiang,ningbo,http://topeast.cc,http://topeasts.en.alibaba.com/contactinfo.html
"Hangzhou Lena Fitness Equipment Co., Ltd.",Ms. lina lv,Genaral manager,0086-571-86775017,008618958170902,0086-571-86775017,"2nd floor F building, No.2, xiyuan 8th road,west lake area",310030,China,Zhejiang,hangzhou,http://www.lenafitness.net,http://hzlena.en.alibaba.com/contactinfo.html
Shenzhen DWG Watch & Clock Company Limited,Ms. Janie jiao,Sales Manager,86-755-27472184,13570835626,86-755-27563886,"A Room,5/F, A Bldg, QiYu Industrial Park, Tiezai Street,Gonele Village, Xixiang Town, Bao'an District,Shenzhen",518102,China,Guangdong,Shenzhen,http://www.dwgwatch.com,http://zosiyo.en.alibaba.com/contactinfo.html
"Shenzhen Yimimai Electronic Commerce Co., Ltd.",,,,,,,,China,,,,http://yimimai.en.alibaba.com/contactinfo.html
"Zhejiang Zhengna Technology Co., Ltd.",Mr. Richard Dai,GM,86-577-61315877,,86-577-61315998,"No. D-7, West Industrial Zone, Hongqiao Town, Yueqing City, Zhejiang Province. China",325608,China,Zhejiang,Yueqing,http://www.zenatc.com,http://zdspring.en.alibaba.com/contactinfo.html
"Anhui Aerospace&PMA Health Technology Co., Ltd.",Ms. Carol Wong,,86-551-65633848,13655697032,,"PMA Building, No.1201 Huguang Rd, Shushan District,",230088,China,Anhui,Hefei,http://www.pmagroup.com.cn,http://pmagroup.en.alibaba.com/contactinfo.html
Zhejiang Manrun Technology Co.ltd,,,,,,,,China,,,,http://zjmairui.en.alibaba.com/contactinfo.html
"Shenzhen Fitcare Electronics Co., Ltd.",Mr. Jason Yang,Manager,0086-755-23729876,13480716862,086-755-23729876,"6th Floor(south), Building A, Dingxin Science Park, 67 District, Baoan, shenzhen",518202,China,,Shenzhen,http://fitcare.com,http://fitcare.en.alibaba.com/contactinfo.html
"Shenzhen Zhongzhe Industrial Co., Ltd.",Mr. Daniel Qiu,,86-0755-13802574165,,,"1002 SEG Plaza, Futian District",,China,Guangdong,Shenzhen,http://www.zhongzhecn.com,http://cnzhongzhe.en.alibaba.com/contactinfo.html
"Shenzhen City Jintuo Electronics Parts Co., Limited",Ms. angel huang,,0086-0755-13510857003,,,luohu,518000,China,Guangdong,shenzhen,http://www.ktopparts.com/,http://ktopparts.en.alibaba.com/contactinfo.html
"Kangpu (Fujian) Fitness Equipment Co., Ltd.",,,,,,,,China,,,,http://fjkp.en.alibaba.com/contactinfo.html
"Suzhou Victory Electric Technology Co., Ltd.",Mr. Jacky Chen,Manager,0086-557-8118086,15256004456,,"6th Building,E-commerce Industrial Park,Gaoxin District",234000,China,Anhui,Suzhou,http://www.chinavct.com,http://vctelectric.en.alibaba.com/contactinfo.html
"Shenzhen Xinkeying Digital Co., Limited",Mr. Jayden Chan,,86-0755-83551339,18898791135,,"Shenzhen futian huaqiang square block A,17I",,China,Guangdong,Shenzhen,http://www.dtone.cc,http://dtno1.en.alibaba.com/contactinfo.html
"Haining Tianyi Imp&Exp Co., Ltd.",Mr. Kami Wang,general manager,86-573-80703706,13306730365,86-573-80703709,"619,NO.1 of Tangnan street,Haizhou street",314400,China,Zhejiang,Haining,http://tyite.com,http://hkwhm.en.alibaba.com/contactinfo.html
"Xuzhou Guohong Packaging Co., Ltd.",Mr. Jemmy Wen,Sales,86-0571-56073892,,,"No. 370, Zhuangli Road, Xiaojiang Town, Pingyang County",311200,China,Zhejiang,Hangzhou,,http://xzpack.en.alibaba.com/contactinfo.html
"Shenzhen Well Armor High-Tech Co., Ltd.",Ms. Molly Wu,sales manager,86-0755-27449959,86-15017942977,86-0755-27449979,"18-2, Yuchang Road, Yulv, Gongming, Guang Ming Industrial Zone, Shenzhen City, China",518132,China,Guangdong,Shenzhen,http://wellpack.en.alibaba.com,http://wellpack.en.alibaba.com/contactinfo.html
"Shenzhen Shengye Technology Co., Ltd.",Mr. Kemp Lin,Sales Manager,86-755-28248520,008613410607309,,"Room B11, Second Floor, Longtang Business Center, Longgang Avenue, Longgang District",518113,China,Guangdong,shenzhen,https://syuptech.en.alibaba.com/,http://syuptech.en.alibaba.com/contactinfo.html
"Yueqing Binrong Electric Co., Ltd.",Mr. bob pan,Manager,86-577-27878016,13626524856,86-577-27878016,"No.327,Longjing Rd,Liushi Town,Yueqing",325604,China,Zhejiang,Wenzhou,http://binrong.en.alibaba.com,http://binrong.en.alibaba.com/contactinfo.html
"Yiwu Helloyee Imp And Exp Co., Ltd.",Mr. Victor Yu,Director,86-579-85059396,17857186543,86-579-85059397,"Room 512, No. 907, Gongren North Road, Futian Steet",322000,China,Zhejiang,Yiwu,http://www.helloyee.en.alibaba.com,http://helloyee.en.alibaba.com/contactinfo.html
"Shenzhen Centurylux Technology Co., Ltd.",Mr. Michael Zeng,,86-755-21380387,86-159 8944 0432,,Gongming,,China,Guangdong,Shenzhen,http://www.centurylux.com/,http://szcenturylux.en.alibaba.com/contactinfo.html
"Yiwu Bien Import & Export Co., Ltd.",Ms. cathy Lewis,,86-0579-85564200,14757969278,,"Unit 201, Unit 1, Building 1, District, Mache Village, Futian Street, Yiwu City",322000,China,Zhejiang,Jinhua City,,http://ywmidi-cn.en.alibaba.com/contactinfo.html
"Bangteng Hardware Electronics (Dongguan) Co., Ltd.",,,,,,,,China,,,http://dgbangteng.com,http://dgbangteng.en.alibaba.com/contactinfo.html
"Ruian E-Cozy Electronic Technology Co., Ltd.",Ms. Megan Meng,General manager,86-0577-66077788,15968767285,,shidairoad168,,China,Zhejiang,WenZhou,,http://e-cozy.en.alibaba.com/contactinfo.html
"Shenzhen X-Rain Bridge Industrial Co., Ltd.",Mr. wayne zhang,Director,86-0755-13631614991,13631614991,,"1813, Haiyun Bldg., Minzhi Rd., Longhua New Area, Shenzhen, Guangdong, China",,China,Guangdong,shenzhen,,http://x-rainbridge.en.alibaba.com/contactinfo.html
"Dongguan Aideng Watch Technology Co., Ltd.",Ms. Bubble Tang,,86-0769-83907880,15625157696,,"No.8 Zhangwu Street,Changping Town",523586,China,Guangdong,Dongguan,http://aideng-watch.com,http://aidwatch.en.alibaba.com/contactinfo.html
"Henan Xinyongtai Medical Technology Co., Ltd.",Mr. Xinyongtai Henan,Manager,86-0371-53318852,,,"Huiji District, Yingcai Street",250000,China,Henan,Zhengzhou City,http://www.mqhealthcare.com,http://hnxytyy.en.alibaba.com/contactinfo.html
"Wellmien (Suzhou) Imp. & Exp. Co., Ltd.",Ms. Grace Liu,Manager,"0086-512-65953508, 65953528,65953568",,0086-512-65953928,"18-1508, Building B, Wanda Square, No. 3188 Renmin Rd",215000,China,Jiangsu,Suzhou,http://www.wellmien.com,http://wellmien.en.alibaba.com/contactinfo.html
"Shenzhen Hangrong Technology Co., Ltd.",Ms. Olive Wang,Manager,86-755-28887961,15999568587,,"104, Dafen Painting Plaza, Busha Road,Buji Town,Longgang,Shenzhen,Guangdong,China",,China,Guangdong,Shenzhen,,http://hyperionsz.en.alibaba.com/contactinfo.html
"Shenzhen Kingwear Intelligent Technology Co., Ltd.",Ms. Zoe Chen,Marketing Director,86-0755-23576886,15919490502,,"The 21st Floor, Building C, Block 9, Baoneng Hi-Tech Industial Park, Qingxing Road, Longhua New District",518109,China,Guangdong,Shenzhen,http://www.king-wear.com/,http://king-world.en.alibaba.com/contactinfo.html
"Hebei Kouxuan Technology Co., Ltd.",Ms. alisa zhang,,86-311-17734412628,17734412625,,jianan,,China,Hebei,shijiazhuang,,http://kouxuan.en.alibaba.com/contactinfo.html
"Shenzhen Belen Electronic Technology Co., Ltd.",Ms. Eva Tian,General Manager,86-755-13266841046,13266841046,,longhua road,518131,China,Guangdong,shenzhen,https://szbelen.en.alibaba.com,http://gdbelen.en.alibaba.com/contactinfo.html
"Shenzhen Jiayi Technology Co., Ltd.",Ms. oliver wang,general manager,86-0755-29595784,13823598790,86-0755-23063602,"6th floor ,building B,yuxing industrial park,nanchang new villiage ,gushu ,xixiang,baoan",510450,China,Guangdong,shenzhen,http://preview.alibaba.com/,http://timestory.en.alibaba.com/contactinfo.html
"Shenzhen AOStar Technology Co., Ltd.",Ms. LISA LUO,manager,86-0755-21017057,008615220287812,,hualian building Donghuan One Road Longhua Town,518109,China,Guangdong,Shenzhen,http://www.aostar-tech.com,http://aostar-tech.en.alibaba.com/contactinfo.html
Shenzhen New Shinee Technology Company Ltd.,Ms. Lynn Lee,,0086-0755-18820215582,18820215582,,Futian district,518129,China,Guangdong,Shenzhen,https://www.alibaba.com/,http://newshinetech.en.alibaba.com/contactinfo.html
"Shenzhen IU Technology Co., Ltd.",Ms. Lynn long,manager,86-0755-7834493,13040848979,,"Building D521, Zhaoye Creative Park, No. 172, Hguan Middle Road, Guanlan Street, Longhua",518110,China,Guangdong,Shenzhen,http://www.aiyutechnology.com,http://aiyusmart.en.alibaba.com/contactinfo.html
"Dragon Medical Equipment (ZJG) Co., Ltd.",Mr. Axe Dazzle,Sales Manager,0086-512-88831198,0086-15250486691,0086-512-58672811,"Chenlong Building,NO1,Jingang Road,Yangshe Town",215600,China,Jiangsu,Zhangjiagang,http://www.dragon-iec.com,http://dragoniec.en.alibaba.com/contactinfo.html
"Shenzhen Ihmade Electronic Technology Co., Ltd.",Mr. Conley Wang,CEO,0086-0755-13652336612,,,"201-210 Hengfu Building,Xinhe Road,Shajing town,Baoan District,Shenzhen,China",518100,China,Guangdong,Shenzhen,,http://ibukhoor.en.alibaba.com/contactinfo.html
"Shenzhen Hoguda Technology Co., Ltd.",Ms. Anna Li,Sales Manager,0086-755-29192927,0086-15002058373,0086-755-29192937,"YuanFen Industrial Park, LongHua",518000,China,Guangdong,Shenzhen,http://www.hoguda.com,http://hoguda.en.alibaba.com/contactinfo.html
"Shenzhen Paladin Technology Co., Ltd.",Ms. Mickey Yu,sales manager,86-755-23721731,,,"11F,Tianyue Bldg., Zhongxin Road, Shajing Street, Baoan District",518102,China,Guangdong,Shenzhen,http://paladintech.en.alibaba.com/,http://paladintech.en.alibaba.com/contactinfo.html
"Shenzhen HQS Technology Co., Ltd.",Ms. Julia Zhong,Sales Director,86-755-83974630,008613428938396,86-755-83972702,"3rd Floor, Workshop 1, Industrial Zone 1, Shangjing Village, Longdong Community, Baolong Street, Longgang District,",518115,China,Guangdong,Shenzhen,http://www.hqstec.com,http://szhqs.en.alibaba.com/contactinfo.html
Shenzhen DWG Watch & Clock Company Limited,Ms. Joney Jiao,Manager,086-0755-27472184,13570835626,086-0755-27563886,"5 Floor 1 Building, Qi Yu Industrial, Gongle Village, Xixiang Street, Bao'an District, Shenzhen city, Guangdong.China",518100,China,Guangdong,shenzhen,http://www.dwgwatch.com,http://dwgwatch.en.alibaba.com/contactinfo.html
"Shenzhen Hao Yang New Energy Co., Ltd.",Mr. Rick Wang,Export Manager,0086-755-84564485,136 9168 5610,0086-755-84641565,"No. 25-8 Shapo Road, Biling Community, Pingshan",518118,China,Guangdong,Shenzhen,http://www.haoyangsz.com,http://haoyangbattery.en.alibaba.com/contactinfo.html
"Daily Yoga Culture Technology Co., Ltd.",Ms. Yogi Zhao,Sales Manager,400-688-1103,86-15091446709,,High-tech Zone,,China,Shaanxi,Xian,https://dailyyoga.en.alibaba.com/,http://dailyyoga.en.alibaba.com/contactinfo.html
"Yiwu Haiyun Watch Industry Co., Ltd.",Ms. Chan Liu,Sales manager,86-0579-85546160,8618655118931,,"4th Floor, 67478, 5th District, Yiwu International Trade City",322000,China,Zhejiang,Jinhua city,https://zer4008067478.1688.com/?spm=a262a.3051513.0.0.73f13e518dOXUC,http://haiyunwatch.en.alibaba.com/contactinfo.html
"Shijiazhuang Aofeite Medical Device Co., Ltd.",Ms. Wendy Li,manager,0086-311-66765185,008613785838184,86-311-80979823,No.398 xiangjiang road,050000,China,Hebei,shijiazhuang,http://www.aofit.com,http://cnxuda.en.alibaba.com/contactinfo.html
"Tianjin Konbest Technology Co., Ltd.",Mr. David Zhao,,86-22-27988661,,,Lanyun Road,300300,China,Tianjin,tianjin,http://www.kangbantech.com,http://tjkonbest.en.alibaba.com/contactinfo.html
"Shenzhen Inin Watch Technology Co., Ltd.",Ms. Jessie Ding,Manager,86-755-23069960,13823361919,86-755-83220769,"Rm.620,6/F, Xusheng Bldg., Bao'an Avenue, Yintian, Xixiang, Bao'an Dist., Shenzhen",518101,China,Guangdong,Shenzhen,http://www.intimes-watch.com,http://ininwatch.en.alibaba.com/contactinfo.html
"Suzhou Betters Electronic Technology Co., Ltd.",Ms. Irene Niu,Sales manager,86-0512-13279178881,13279178881,,"No.9, Zhoujia Bridge, Chenxin Village, Zhangjiagang City, Suzhou City, Jiangsu Province",215600,China,Jiangsu,zhangjiagang,,http://cnbest-tech.en.alibaba.com/contactinfo.html
"Shenzhen Inlins Technology Co., Ltd.",Ms. Felecia Qiu,salesman,86-755-23200112,18926435161,86-755-23283360,"2F Xinchao Industrial Park , Guanlan Street , Longhua District, Shenzhen",518110,China,Guangdong,ShenZhen,http://www.inlins.com,http://inlins.en.alibaba.com/contactinfo.html
Guangzhou Baiyun Tonghe Raymons Firm,Ms. Catherine Ku,Manager,0086-20-3225 0365,13926005420,,"RM 201,Building 7,Tianjian ID city ,No.283,Tongsha Road,Tonghe Street,Baiyun district,Guangzhou,China",510405,China,Guangdong,Guangzhou,http://www.raymons.com.cn,http://raymons.en.alibaba.com/contactinfo.html
"Shenzhen Oshibo Technology Co., Ltd.",Mr. Kris Y,,86-0755-27207906,8618923489872,86-755-23349503,"4F, xinhe building, zhongxin Rd, Shajin town, Bao'an",518125,China,Guangdong,Shenzhen,https://osbtech.en.alibaba.com,http://osbtech.en.alibaba.com/contactinfo.html
"Yongkang Xiayuan Industry & Trade Co., Ltd.",Ms. Alice Wang,Sales Manager,86-579-87367613,18657973205,86-579-87362693,"Dayuandong Village, Gushan Town, Yongkang City",321300,China,Zhejiang,Jinhua,http://www.xy4fitness.com,http://bodyrich.en.alibaba.com/contactinfo.html
"Shenzhen Motto Electronics Co., Ltd.",Mr. James Lee,General Manager,86-0755-27673867,8618126253563,86-0755-29082109,"2nd Floor,Building D,Funing Hi-tech industry park,No71 of xintian Road",518101,China,Guangdong,shenzhen,http://www.motto4u.com,http://motto4u.en.alibaba.com/contactinfo.html
"Shenzhen Lig Technology Co., Ltd.",Ms. Melody Chan,Manager,86-755-23209861,13424271096,,"Room 308,Jinhai Building, No. 109, Guangshen Highway Section,107 National Highway",518102,China,Guangdong,Shenzhen,http://lightingreen.com,http://lig.en.alibaba.com/contactinfo.html
"Shenzhen Dce Technology Co., Ltd.",Ms. Annie Cai,,0086-0755-17875826865,,,Seg Market,,China,Guangdong,Shenzhen,,http://dcetop.en.alibaba.com/contactinfo.html
"Simple Art Technology Co., Limited",Mr. Mark Tan,Project Manager,86-0769-38809228-853,13751332184,86-0769-38809227,"No. 4, Dayuan Street, Southwestern Ind. Zone, Shijie Town",523290,China,Guangdong,Dongguan,http://simpleartwatch.en.alibaba.com,http://simpleartwatch.en.alibaba.com/contactinfo.html
"Jinhua Miaorun Trading Co., Ltd.",Ms. Sam Zheng,Manager,86-0579-18057920253,8613735685771,,Jinpan road,321000,China,Zhejiang,Jinhua,,http://zsooq.en.alibaba.com/contactinfo.html
"Shenzhen WAP-Health Technology Co., Ltd.",Ms. Mandy Wang,Sales Manager,86-755-27449959,13510219927,86-755-27449979,"Area A, Floor 1, No.7 Dayang 1st Road, The Seond Industrial Zone, Yulv, Gongming, Guangming New District, Shenzhen, Guangdong, China (Mainland)",518000,China,Guangdong,Shenzhen,http://www.aed-supermarket.com,http://wap.en.alibaba.com/contactinfo.html
"Shenzhen San He Xing Ye Technology Co., Ltd.",Ms. Sunshine Shao,,86-755-84295892,15807690510,,longgang,518116,China,Guangdong,shenzhen,http://www.shxsilicon.en.alibaba.com,http://shsanhe.en.alibaba.com/contactinfo.html
"Dongguan Mushang Future Cosmetics Co., Ltd.",Mr. Alvin Long,Sales Manager,86-0769-23329259,0086 13556705066,,"3rd floor, Huiyuanjia Park, No.38, Luxi 2nd RD, Xixi,Liaobu Town,Dongguan,Guangdong,China",523808,China,Guangdong,Dongguan,http://musslane03.en.alibaba.com,http://musslane03.en.alibaba.com/contactinfo.html
"Suzhou Beatles New Material Co., Ltd.",Ms. Lois Zhou,,86-0512-56777689,13962271265,,"N0.18 Tangshi Zhengzhong Road, Yangshe Towm",215600,China,Jiangsu,Zhangjiagang,http://www.beatles-steel.com,http://beatlestech.en.alibaba.com/contactinfo.html
Winait Technologies Ltd.,Ms. Anna Gong,Manager,"0086-755-83742303, 83743303",0086-13714029296,0086-755-83296035,"Room806, 8F, Qiche Building, Zhenhua Road, Futian District, Shenzhen City, Guangdong Province. China",518031,China,Guangdong,Shenzhen,http://www.winait.com,http://winait.en.alibaba.com/contactinfo.html
"Yiwu Saiyang Imp.& Exp. Co., Ltd.",Mr. Tony Cai,Manager,0086-0579-85157195,0086 15857921137,0086-0579-85157195,"NO.A9909,Park Of Haike,Yiwu Zhejiang, China",322000,China,Zhejiang,Yiwu,http://ywsaiyang.en.alibaba.cn,http://ywsaiyang.en.alibaba.com/contactinfo.html
"Dongguan City Guan Yi Ke Qun Electronic Co., Ltd.",,,,18666401228,,,,China,,,http://www.1st.com.hk,http://1staatech.en.alibaba.com/contactinfo.html
"Shenzhen Lig Technology Co., Ltd.",Ms. Melody Chan,Manager,86-755-23209861,13424271096,,"Room 308,Jinhai Building, No. 109, Guangshen Highway Section,107 National Highway",518102,China,Guangdong,Shenzhen,http://lightingreen.com,http://lig.en.alibaba.com/contactinfo.html
"Shenzhen Inlins Technology Co., Ltd.",Ms. Felecia Qiu,salesman,86-755-23200112,18926435161,86-755-23283360,"2F Xinchao Industrial Park , Guanlan Street , Longhua District, Shenzhen",518110,China,Guangdong,ShenZhen,http://www.inlins.com,http://inlins.en.alibaba.com/contactinfo.html
"Shenzhen Motto Electronics Co., Ltd.",Mr. James Lee,General Manager,86-0755-27673867,8618126253563,86-0755-29082109,"2nd Floor,Building D,Funing Hi-tech industry park,No71 of xintian Road",518101,China,Guangdong,shenzhen,http://www.motto4u.com,http://motto4u.en.alibaba.com/contactinfo.html
"Jinhua Miaorun Trading Co., Ltd.",Ms. Sam Zheng,Manager,86-0579-18057920253,8613735685771,,Jinpan road,321000,China,Zhejiang,Jinhua,,http://zsooq.en.alibaba.com/contactinfo.html
"Shenzhen WAP-Health Technology Co., Ltd.",Ms. Mandy Wang,Sales Manager,86-755-27449959,13510219927,86-755-27449979,"Area A, Floor 1, No.7 Dayang 1st Road, The Seond Industrial Zone, Yulv, Gongming, Guangming New District, Shenzhen, Guangdong, China (Mainland)",518000,China,Guangdong,Shenzhen,http://www.aed-supermarket.com,http://wap.en.alibaba.com/contactinfo.html
Winait Technologies Ltd.,Ms. Anna Gong,Manager,"0086-755-83742303, 83743303",0086-13714029296,0086-755-83296035,"Room806, 8F, Qiche Building, Zhenhua Road, Futian District, Shenzhen City, Guangdong Province. China",518031,China,Guangdong,Shenzhen,http://www.winait.com,http://winait.en.alibaba.com/contactinfo.html
"Dongguan Mushang Future Cosmetics Co., Ltd.",Mr. Alvin Long,Sales Manager,86-0769-23329259,0086 13556705066,,"3rd floor, Huiyuanjia Park, No.38, Luxi 2nd RD, Xixi,Liaobu Town,Dongguan,Guangdong,China",523808,China,Guangdong,Dongguan,http://musslane03.en.alibaba.com,http://musslane03.en.alibaba.com/contactinfo.html
"Yongkang Xiayuan Industry & Trade Co., Ltd.",Ms. Alice Wang,Sales Manager,86-579-87367613,18657973205,86-579-87362693,"Dayuandong Village, Gushan Town, Yongkang City",321300,China,Zhejiang,Jinhua,http://www.xy4fitness.com,http://bodyrich.en.alibaba.com/contactinfo.html
"Dongguan City Guan Yi Ke Qun Electronic Co., Ltd.",,,,18666401228,,,,China,,,http://www.1st.com.hk,http://1staatech.en.alibaba.com/contactinfo.html
"Yiwu Saiyang Imp.& Exp. Co., Ltd.",Mr. Tony Cai,Manager,0086-0579-85157195,0086 15857921137,0086-0579-85157195,"NO.A9909,Park Of Haike,Yiwu Zhejiang, China",322000,China,Zhejiang,Yiwu,http://ywsaiyang.en.alibaba.cn,http://ywsaiyang.en.alibaba.com/contactinfo.html
"Shenzhen Dce Technology Co., Ltd.",Ms. Annie Cai,,0086-0755-17875826865,,,Seg Market,,China,Guangdong,Shenzhen,,http://dcetop.en.alibaba.com/contactinfo.html
"Simple Art Technology Co., Limited",Mr. Mark Tan,Project Manager,86-0769-38809228-853,13751332184,86-0769-38809227,"No. 4, Dayuan Street, Southwestern Ind. Zone, Shijie Town",523290,China,Guangdong,Dongguan,http://simpleartwatch.en.alibaba.com,http://simpleartwatch.en.alibaba.com/contactinfo.html
"Shenzhen Wei Chen Yang Technology Co., Ltd.",Ms. Willow Yang,sales manager,86-0755-23349503,13714372850,86-0755-23349503,"6/F,A1 Building Tongfuyu Industrial Zone,Lezhujia,xixiang,Baoan District",518126,China,Guangdong,Shenzhen,http://wcytech.en.alibaba.com,http://wcytech.en.alibaba.com/contactinfo.html
"Suzhou Beatles New Material Co., Ltd.",Ms. Lois Zhou,,86-0512-56777689,13962271265,,"N0.18 Tangshi Zhengzhong Road, Yangshe Towm",215600,China,Jiangsu,Zhangjiagang,http://www.beatles-steel.com,http://beatlestech.en.alibaba.com/contactinfo.html
"Shenzhen Gfeitem Technology Co., Ltd.",Ms. Tracy Xu,Sales,86-0755-15815587450,15815587450,,"Buildind 21 ,dunbei area,dalang longhua District,Shenzhen City,China",518000,China,Guangdong,shenzhen,,http://gfeitem.en.alibaba.com/contactinfo.html
"Shenzhen Lianmaida Electric Heating Products Co., Ltd.",Ms. Sharon Huang,,0086-755-29470366,,,"2F/Block 2, Yonghua St. No.1, Pinghu Longgang,",518111,China,Guangdong,shenzhen,http://www.szlmd.com,http://szlmd.en.alibaba.com/contactinfo.html
"Shenzhen Zhiyi Technology Co., Ltd.",,,,,,,,China,,,http://meresoy.com,http://kookare.en.alibaba.com/contactinfo.html
"Million Concept Electronic (Shenzhen) Co., Ltd.",Mr. Jerry Fei,Sales Manager,86-755-33663118,13172467239,86-755-33925026,"No.98,XiashanmenRoad,SonggangTown,Bao'an District",518105,China,Guangdong,Shenzhen,http://www.isport.com.cn,http://isport-watch.en.alibaba.com/contactinfo.html
"Shenzhen Fiwell Technology Co., Ltd.",Ms. Julia Chu,sales Manager,0086-0755-15824496724,15824496724,,longhua district,518131,China,Guangdong,shenzhen city,http://fiwelltech.com,http://fiwelltech.en.alibaba.com/contactinfo.html
"Guangzhou Magic Belle Beauty Device Co., Ltd.",Mr. Magic Belle,Director,86-020-32586856,15915727046,,"Mi Zi High-Tech Business Incubator,He Tai East Road,Bai Yun District Guangzhou,China",510000,China,Guangdong,Guangzhou,http://www.magicbelle.en.alibaba.com,http://magicbelle.en.alibaba.com/contactinfo.html
"Shenzhen i365-Tech Co., Limited",Mr. Allen li,Regional Sales Manager,0086-755-23096706-807,18123980103,0086-755-23066719,"5th Floor, Building B, MingYou Industry Park, BaoYuan Road,XiXiang,Bao District",518000,China,Guangdong,shenzhen,http://www.i365-tech.com/,http://i365-tech.en.alibaba.com/contactinfo.html
"Shenzhen ruishidi Technology Co., Ltd.",Ms. Vivian Shen,sales manager,86-755-86267809,15118109065,,"Room 305, Nanfen 1th Building, Longjing Village, Taoyuan Street, NanShan District, Shenzhen, China",518055,China,Guangdong,Shenzhen,http://www.szressan.com,http://szressan.en.alibaba.com/contactinfo.html
