company_name,contact_name,position,tel,mobile,fax,address,zip_code,country,province,city,website,ali_website
"Foshan Snat Energy Electrical Technology Co., Ltd.",Ms. snadi solar,,86-0757-81816130,,,Guicheng,500000,China,Guangdong,Foshan,http://www.snadi.com.cn,http://snadisolar.en.alibaba.com/contactinfo.html
"Fujian Quanzhou MYT Electronics Co., Ltd.",Mr. Mytetra MYT,Director,86-595-26666768,15259781024,86-595,"Road #1, Optoelectronic Information Industry Base, Nanan, Quanzhou City",362302,China,Fujian,Nanan,http://www.myt123.com,http://myt123.en.alibaba.com/contactinfo.html
"Shenzhen Chenyu Technology Co., Ltd.",Mr. Tom Tang,CEO,86-755-84653850,15989538426,,"909 Renhexingye, No.24 Nanlian Road,longgang street, Longgang District,",518116,China,Guangdong,shenzhen city,,http://chenyutech.en.alibaba.com/contactinfo.html
"Shandong Senter Electronic Co., Ltd.",Ms. Anthea Liu,Export Marketing Manager,86-533-3589257,13864445371,86-533-3587522,"No.98,Wanjie Road, New&Hi-Tech Area, Zibo, Shandong, China",255086,China,Shandong,Zibo,http://www.senter.com.cn,http://senter.en.alibaba.com/contactinfo.html
Akkopower Limited,,,,,,,,China,,,http://www.akkopower.com,http://akkopower.en.alibaba.com/contactinfo.html
"Shenzhen Taida Century Technology Co., Ltd.",Mr. Bill Yuan,sales,0086-0-13928868158,13928868158,,"Room 301,1st Buliding,Shuiwei 2nd Zone,Minzhi Road, Longhua New District, Shenzhen",518131,China,Guangdong,shenzhen,http://www.aliexpress.com/store/235279,http://td-tech.en.alibaba.com/contactinfo.html
"Shenzhen Bituobi Technology Co., Ltd.",,,,,,,,China,,,,http://bituobi.en.alibaba.com/contactinfo.html
"Quanzhou Huazhan Electromechanical Co., Ltd.",Ms. Sunny Zheng,,0086-0595-2238 9530,15059770270,,"JIANXI address: Shazhouba Taiwan Business Entrepreneurship Park,",,China,Fujian,ruijin,http://www.huazhandianchi.com,http://hydcbattery.en.alibaba.com/contactinfo.html
"Fujian Quanzhou Quanshun Communication Technology Co., Ltd.",Mr. Roger Chen,Manager,86-595-86753355,15375763355,86-595-86758299,"Quanshun Bldg., Daxiamei, Nan'an",362302,China,Fujian,Quanzhou,http://www.qstx.com/en,http://qstx.en.alibaba.com/contactinfo.html
"Shenzhen Myshow Creative Technology Co., Ltd.",Ms. Victoria wu,Sales Manager,86-0752-5785693,86 18188835493,,"No.6, Zhong Xing San Lu, Da Ya Wan,Huizhou, China",516081,China,Guangdong,Huizhou,http://www.szmyshow.cn,http://myshowcreative.en.alibaba.com/contactinfo.html
"Shenzhen Hylook Electronic Co., Ltd.",Mr. Fred Luo,,086-0755-29062506,13728881715,,"Room 202,7th building,Hongrui Gardon,Nanguang Road,Nanshan",,China,Guangdong,shenzhen,http://www.hylook.com,http://hylook.en.alibaba.com/contactinfo.html
"Huizhou Markyn New Energy Co., Ltd.",Mr. Neil Zeng,Overseas Sales Manager,86-752-6688061,008618682247863,86-752-6688063,"ShangYan Road,YuanZhou Ave.,YuanZhou Town, Hui Zhou City ,GuangDong Province,P.R.C",516123,China,Guangdong,HUIZHOU,http://www.gmbattery.com,http://hzgmbattery.en.alibaba.com/contactinfo.html
"Changsha Torch Auto Parts Co., Ltd.",Mr. William Shen,Director,86-731-84830658,8613973330643,86-731-84830648,"No.8 Lujing Road, National Hi-tech Industrial Development Zone",410205,China,Hunan,Changsha,http://www.torchgroup.cn,http://torchgroup.en.alibaba.com/contactinfo.html
"Nanning Wintop International Trading Co., Ltd.",Ms. Lydia Li,,0086-0-18169625638,,,"1506, Bldg. B, Jinwangjiao CASA Int'l Mansion, Zhongyue Road, Qingxiu Dist.",530000,China,Guangxi,Nanning,https://global-wintop.en.alibaba.com/,http://global-wintop.en.alibaba.com/contactinfo.html
"Shanghai Geosupplier Surveying Instruments Co., Ltd.",Mr. Leon LU,Sales Manager,086-021-60520150,18321356992,086-021-20987208,"Room 1613 ,Building E, Lane 437 ,Nianjiabang Road,Pudong District",201318,China,Shanghai,Shanghai,http://www.geosupplier.com,http://geosupplier.en.alibaba.com/contactinfo.html
"Wuhan Dongxin Mill Imp&Exp Trade Co., Ltd.",Ms. Michelle shao,Export Manager,0086-27-50728258,008618971283311,,"Room 202,building 4-4, Oriental Modern Garden, Fuxing 1st Village, Jianghan District",430022,China,Hubei,wuhan,http://dongxinchemical.alibaba.com,http://dongxinchemical.en.alibaba.com/contactinfo.html
Shenzhen Mobai Technology Limited,Ms. Iris Yang,,86-0755-18820928997,18820928997,,"1st Floor,3rd Building,De Zhong Industrial Park, Wu He Street, Ban Tian, Long Gang District",,China,Guangdong,shenzhen,http://www.scootree.com,http://scootree.en.alibaba.com/contactinfo.html
"Bluesun Solar Co., Ltd.",Ms. Trancy Wong,,86-183-26182156,008615256079057,86-183-26182156,Wenshui Road,230031,China,Anhui,Hefei,http://www.bluesunpv.com,http://chinasolarhome.en.alibaba.com/contactinfo.html
"Shenzhen Glida Electronics Co., Ltd.",Mr. Vincent Yang,Sales Manager,86-755-36939108,86-13316500282,86-755-61640001,"Building C,Huanyu Industrial Park,No.2 Xuezi Road,Bao'an District,Shenzhen City,China Mainland",518000,China,Guangdong,Shenzhen,http://www.szglida.com,http://glida.en.alibaba.com/contactinfo.html
"Zhejiang Xupai Power Technology Co., Ltd.",Ms. Christina Chen,marketing director,86-572-6510589,008613511208810,,"No.505 Xianqiandong Street Eco DevelopmentZone,Changxing",313100,China,Zhejiang,Huzhou,http://www.xupaipower.com/cn/,http://xupaipower.en.alibaba.com/contactinfo.html
"Shenzhen Escoson Technology Co., Ltd.",Ms. Mandy Liu,,00-86-13632639604,,,"924,103 Building,Saige Kejiyuan,Huafa North Road,Futian District,Shenzhen 518000,Guangdong,China",518000,China,Guangdong,Shenzhen,,http://ysks.en.alibaba.com/contactinfo.html
"Ecoway Energy Technology Co., Ltd.",Mary Chen,,86-025-58227680-8001,15251703616,,,,China,,,http://www.ecoway-tech.com,http://ecowaytech.en.alibaba.com/contactinfo.html
"Shenzhen Huangjintai Electronics Co., Ltd.",Ms. suvpr solar,,86-0755-83520430,86-18819051596,,"7/F, BLDG 4, Hanhaida Hi-tech. Industrial Park, Baoshan RD, Tianliao, Guangming New District",5181000,China,Guangdong,shenzhezhen,http://www.suvpr.com,http://solarsuvpr.en.alibaba.com/contactinfo.html
"RuiJi Circuit Technology (Shenzhen) Co., Ltd.",Ms. Amy Zhao,,0086-755-13342945252,,,Longhua,,China,Guangdong,Shenzhen,,http://realsourcetech.en.alibaba.com/contactinfo.html
"Shenzhen Kingtu Technology Co., Ltd.",Ms. Ting Zang,sales manager,0086-755-27050256,13760308101,0086-755-27050256,"601-608, Shayi Complex Building, (No. 34, Guangjin Road) Crossing Of Shapu Rd. And Banan Rd., Songgang Street, Bao'an District",518000,China,Guangdong,shenzhen,http://kingtu.en.alibaba.com/,http://kingtu.en.alibaba.com/contactinfo.html
Shenzhen Kingsguar Electronics Company Limited,Ms. Lily Ma,,0086-0755-82557737,,,"Room 31S,Buiding B,Duhui 100 Mansion",518048,China,Guangdong,Shenzhen,http://www.kingsguar.com,http://kingsguar.en.alibaba.com/contactinfo.html
"Changzhou CNEBIKES Co., Ltd.",Ms. Wendy Wu,,86-519-85809291,13915075014,,No 3.Renmin West Road. Wujing Region,,China,Jiangsu,changzhou,http://cnebikes.com,http://cnebikes.en.alibaba.com/contactinfo.html
"Shenzhen Listman Technology Co., Limited",Ms. sunny guo,Manager,86-0755-29048796,13825245568,86-0755-29048796,"Aohua garden D0307 ,Huarong road, Dalang, Longhua New Area, Shenzhen, Guangdong, China",518000,China,Guangdong,ShenZhen,http://www.listmanpower.com,http://listman.en.alibaba.com/contactinfo.html
"Changzhou Greenpedel Co., Ltd.",Ms. Cindy Shi,Manager,86-0519-83606687,008613775297798,86-0519-83606680,"No.1,Qinyang North Road,Tianning Area,Changzhou,",213000,China,Jiangsu,Changzhou,http://www.greenpedel.com.cn,http://greenpedel.en.alibaba.com/contactinfo.html
"Ronix (Zhangjiagang Bonded Area) Trading Co., Ltd.",Mr. Jack Zhang,Sales,86-512-56770193,15395150783,86-512-56770197,"RenMing East Road,Zhangjiagang City",215600,China,Jiangsu,Suzhou City,http://ronixtools.com,http://ronix-powertools.en.alibaba.com/contactinfo.html
"Shenzhen Luchuang Energy Technology Co., Ltd.",Mr. John Wong,,0086-0755-21013175,15934806871,,"Block B, Weidonglong Business Building, Meilong Ave., Longhua Dist.",518109,China,Guangdong,shenzhen,http://www.szluxtronic.com/,http://luxtronicenergy.en.alibaba.com/contactinfo.html
"Fuzhou Super Power Electronics Co., Ltd.",,,,,,,,China,,,http://www.fjspower.com,http://suerbattery.en.alibaba.com/contactinfo.html
"Guangzhou Manlian Electric & Technology Co., Ltd.",Mr. Ocean Battery,Sales Director,86-020-22171981,008618598253825,86-020-85515573,"Lingnan Technology Center,No. 492,Daguan Middle Road",510663,China,Guangdong,Guangzhou,http://www.mlups.com,http://mlups.en.alibaba.com/contactinfo.html
"Shenzhen SaiRi Battery Co., Ltd.",Mr. Tobby Dong,Sales manager,86-755-33967993,18607555088,86-755-23062926,"Room 1023,Solar Silicon Valley Building A,Queshan Road,Dalang Street,Bao'an District,Shenzhen City,China",518109,China,Guangdong,ShenZhen,http://www.sairi-power.com,http://superbattery.en.alibaba.com/contactinfo.html
"Ningbo Hicon International Industry Co., Ltd.",Mr. Peter Feng,manager,86-574-58580677,15268404665,86-574-63302029,"No.55,4th Binhai Road,Hangzhou Bay,New Zone,Cixi",315336,China,Zhejiang,Ningbo,http://www.hicongj.cc,http://nbhicon.en.alibaba.com/contactinfo.html
"Linyi Powershiba Battery Co., Ltd.",Mr. Mr. ZHANG,Manager,86-539-8318227,8613869937885,,"Jinyi East Road,Hedong District",276000,China,Shandong,linyi,http://drybattery.en.alibaba.com,http://drybattery.en.alibaba.com/contactinfo.html
"Changzhou Niubo Power Co., Ltd.",Ms. Freya Wong,Manager,86-0519-86055585,18861242821,86-0519-86055585,NO801 Changwu Road,,China,Jiangsu,ChangZhou,http://nbpowers.com,http://niuboebike.en.alibaba.com/contactinfo.html
"Shenzhen Kunteng Co., Ltd.",Ms. Vickyy wang,Sales Manager,86-755-26755458,13925241226,86-755-26755329,"No.1 factory,Dongfang Science Park.Qizoxiang West Road.Shenzhen",518053,China,Guangdong,shenzhen,http://www.tinko.com.cn,http://tinkobattery.en.alibaba.com/contactinfo.html
"Guangzhou Golden Hongfa Electronic Trading Co., Ltd.",Ms. Nora Zou,Sales Manager,86-20-83390475,0086-13719086173,86-20-83185458,"Unit 1118-1120, No.219,Zhongshan 5th Road, Cts Center, Yuexiu District, Guangzhou, Guangdong, China",510210,China,Guangdong,Guangzhou,https://g988.en.alibaba.com/,http://g988.en.alibaba.com/contactinfo.html
Shenzhen Hili-Bat Technology Company Limited,,,,,,,,China,,,http://www.halibat.com,http://hili-bat.en.alibaba.com/contactinfo.html
"Shenzhen Hi-Max Technology Co., Ltd.",Ms. Eva Piao,President enterprise,86-0755-86969693,86-13612892091,86-0755-86969693,Oversea Chinese Hight-Tech Venture Park,518057,China,Guangdong,Shenzhen,http://www.hi-max.com.cn,http://hi-max.en.alibaba.com/contactinfo.html
"Dongguan Maicheng Electronic Technology Co., Ltd.",Michael Wong,,86-0769-56789011,13532703525,,,,China,,,http://maicheng.en.alibaba.com,http://maxway-tech.en.alibaba.com/contactinfo.html
"Shenzhen Glida Electronics Co., Ltd.",Mr. Vincent Yang,Sales Manager,86-755-36939108,86-13316500282,86-755-61640001,"Building C,Huanyu Industrial Park,No.2 Xuezi Road,Bao'an District,Shenzhen City,China Mainland",518000,China,Guangdong,Shenzhen,http://www.szglida.com,http://glida.en.alibaba.com/contactinfo.html
"Fuzhou Super Power Electronics Co., Ltd.",,,,,,,,China,,,http://www.fjspower.com,http://suerbattery.en.alibaba.com/contactinfo.html
"Shenzhen Kingtu Technology Co., Ltd.",Ms. Ting Zang,sales manager,0086-755-27050256,13760308101,0086-755-27050256,"601-608, Shayi Complex Building, (No. 34, Guangjin Road) Crossing Of Shapu Rd. And Banan Rd., Songgang Street, Bao'an District",518000,China,Guangdong,shenzhen,http://kingtu.en.alibaba.com/,http://kingtu.en.alibaba.com/contactinfo.html
"Changzhou Niubo Power Co., Ltd.",Ms. Freya Wong,Manager,86-0519-86055585,18861242821,86-0519-86055585,NO801 Changwu Road,,China,Jiangsu,ChangZhou,http://nbpowers.com,http://niuboebike.en.alibaba.com/contactinfo.html
"Binlyt Technology (Shenzhen) Co., Ltd.",Ms. Crystal Tao,,86-755-28050261,,,"/F, Building F, Innovation Industrial Park, Jingtian Street, Longhua District",518131,China,Guangdong,shenzhen,http://www.binlytenergy.com,http://binlyt.en.alibaba.com/contactinfo.html
"Eitai (Xiamen) New Energy Technology Co., Ltd.",Mr. Chris Zheng,,86-0592-7100680,,,"#1003 No.498 Xinglinwan Road,Jimei District",361021,China,Fujian,Xiamen,http://www.eitaichina.com,http://eitai.en.alibaba.com/contactinfo.html
"Shenzhen Modern Lighting Co., Ltd.",Ms. Christina Li,Sales Manager,0086-755-28505460,0086 15218706336,86-755-28505460,"No.140, Caizi Rd, Baolai Industrial Park, Pinghu Street, Longgang district, Shenzhen",518111,China,Guangdong,Shenzhen,http://www.modernledcn.com,http://modernled.en.alibaba.com/contactinfo.html
"Zhejiang Xupai Power Technology Co., Ltd.",Ms. Christina Chen,marketing director,86-572-6510589,008613511208810,,"No.505 Xianqiandong Street Eco DevelopmentZone,Changxing",313100,China,Zhejiang,Huzhou,http://www.xupaipower.com/cn/,http://xupaipower.en.alibaba.com/contactinfo.html
Shenzhen Hili-Bat Technology Company Limited,,,,,,,,China,,,http://www.halibat.com,http://hili-bat.en.alibaba.com/contactinfo.html
"Ling Li Battery Co., Ltd.",Mr. Junjie Mo,sales Supervisor,86-769-22707737,13602366739,86-769-22285445,"Youjiu Team, Wanjiang Village,WanJiang District",523039,China,Guangdong,Dongguan City,http://www.lonlifebattery.cn or www.lingli-battery.hk,http://lonlifebattery.en.alibaba.com/contactinfo.html
"Guangzhou Victor Electronic Co., Ltd.",Ms. Lisa Wang,Sales manager,86-20-84886178,86-13710392049,86-20-84885608,"405,He Ye Building,No.26-34Asian Game Avenue,Panyu District,Guangzhou,China",511400,China,Guangdong,Guangzhou,http://www.mocel-case.com,http://bestacc.en.alibaba.com/contactinfo.html
"Zhejiang Raggie Imp. & Exp. Co., Ltd.",Mr. Tyler Gong,,0086-579-85074662,008615381667553,,"Room406 ,No.937 North Gongren Road",322000,China,Zhejiang,YIWU,http://www.raggiepower.com,http://raggie.en.alibaba.com/contactinfo.html
"Shanghai Sinolift Equipment Co., Ltd.",Mr. David Deng,Manager of overseas marketing,86-21-58003681,008613817572420,86-21-68014262,"NO.2477,Dachuan Road,Nanhui Industry Park,Shanghai,China",201399,China,Shanghai,Shanghai,http://www.sinolift.us,http://sinolift.en.alibaba.com/contactinfo.html
"Ronix (Zhangjiagang Bonded Area) Trading Co., Ltd.",Mr. Jack Zhang,Sales,86-512-56770193,15395150783,86-512-56770197,"RenMing East Road,Zhangjiagang City",215600,China,Jiangsu,Suzhou City,http://ronixtools.com,http://ronix-powertools.en.alibaba.com/contactinfo.html
"Guangzhou Boorin Car Accessories Co., Ltd.",Ms. Tina He,,0086-20-22158921,18826418026,0086-20-62682665,YongFu Road,510075,China,Guangdong,GuangZhou,http://www.boorinlight.com/,http://hid-led.en.alibaba.com/contactinfo.html
"Shenzhen Gmcell Technology Co., Ltd.",Ms. Cara Xu,Marketing Manager,86-755-23114467,13691926939,86-755-23703178,Xin'an,518000,China,Guangdong,Shenzhen,http://www.gmcell.net,http://gmcell.en.alibaba.com/contactinfo.html
"Shenzhen Huaxu Yike Technology Co., Ltd.",Ms. Mark Zhou,518131,86-86-13825245568,,,"Baoshan Industrial Zone A2 Building Room 50A, Minzhi Street, Longhua District",,China,Guangdong,Shenshen,http://www.hxcell.en.alibaba.com,http://hxcell.en.alibaba.com/contactinfo.html
"Shenzhen Youke Intelligent Technology Co., Ltd.",Mr. Michael Wang,Manager,86-1382-3222930,8613823222930,,"No. 318, Building A4, Hangcheng Innovation & Entrepreneurship Park, Gushu, Xixiang Subdistrict, Bao'an District",518000,China,Guangdong,shenzhen,,http://ukor.en.alibaba.com/contactinfo.html
"Shenzhen Top Star Industry Co., Ltd.",Ms. Jane Qian,Sales Manager,86-755-82551900,18727597983,,Futian Disctrict,518000,China,Guangdong,Shenzhen,http://topstar888.en.alibaba.com,http://topstar888.en.alibaba.com/contactinfo.html
"Shenzhen Jialongxing Model Technology Co., Ltd.",Ms. Qu Lillian,Manager,,+86 13203083402,,,,China,,,http://szjialongxing.en.alibaba.com,http://szjialongxing.en.alibaba.com/contactinfo.html
"Yongkang City Shengyuan CNC Equipment Co., Ltd.",Ms. dana chen,,86-0579-87212675,15868944559,86-0579-87212675,dongchengdistrict chengdongluo334hao,321300,China,Zhejiang,jinhua yongkangshi,,http://ykshengyuan.en.alibaba.com/contactinfo.html
"Shenzhen Bituobi Technology Co., Ltd.",,,,,,,,China,,,,http://bituobi.en.alibaba.com/contactinfo.html
"Foshan Shunde Green Motor Technology Co., Ltd.",Ms. Esta ZHONG,Sales Supervisor,0086-757-27880056,86-18942412300,0086-757-27880266,"#3, Block 3, Jialiyuan Int'l Industrial Park, No.4, Xingye Road, Beijiao, Shunde, Guangdong Province",528311,China,Guangdong,Foshan,http://www.greenmotortech.cn,http://greenmotortech.en.alibaba.com/contactinfo.html
"Shenzhen Myshow Creative Technology Co., Ltd.",Ms. Victoria wu,Sales Manager,86-0752-5785693,86 18188835493,,"No.6, Zhong Xing San Lu, Da Ya Wan,Huizhou, China",516081,China,Guangdong,Huizhou,http://www.szmyshow.cn,http://myshowcreative.en.alibaba.com/contactinfo.html
"Shenzhen Jinxinhui Electronic Technology Co., Ltd.",Mr. Lucas Liu,Manager,86-755-83167159,8613923857293,86-755-83178813,"509, Building 5, Building 112, Jindi 4th Road, Jindi Industrial Zone, Shatou Street",518048,China,Guangdong,shenzhen,http://www.jxh-technology.com/,http://szjinxinhui.en.alibaba.com/contactinfo.html
"Shenzhen XYC Electronic Co., Ltd.",Ms. Holly Tse,Sales Manager,0086-712-8380338,15976894615,0086-712-8380138,"6/F,Chuangke Tower,HuanGuan South Rd,GuanLan Town,Longhua New District",518110,China,Guangdong,shenzhen,http://www.xyc-battery.com,http://xycbattery.en.alibaba.com/contactinfo.html
"Jiangsu Higee Energy Co., Ltd.",,,,,,,,China,,,http://www.ihigee.com,http://ihigee.en.alibaba.com/contactinfo.html
"Bluesun Solar Co.,Ltd",Mr. Brandon Bluesun Solar,Sales Manager,0086-158-58213997,008615858213997,0086-551-65203660,No.188 Qianshan Road,230031,China,Anhui,Hefei,http://www.bluesunpv.com,http://bluesunpv.en.alibaba.com/contactinfo.html
"Linyi Powershiba Battery Co., Ltd.",Mr. Mr. ZHANG,Manager,86-539-8318227,8613869937885,,"Jinyi East Road,Hedong District",276000,China,Shandong,linyi,http://drybattery.en.alibaba.com,http://drybattery.en.alibaba.com/contactinfo.html
"Jiaxing Tusi Trading Co., Ltd.",Ms. TUSI JX,Sales manager,86-0573-85523719,15068340580,86-0573-85523719,Hangzhouwan New Economic Development Zone,314201,China,Zhejiang,Jiaxing,http://www.jxtusi.com,http://jxtsmy.en.alibaba.com/contactinfo.html
"Shenzhen Huichuang Trade Co., Ltd.",Mr. Louis Zhang,,86-755-36823912,18566249848,,"Room 1045, Jiaxiye Plaza, Minzhi Avenue, Longhua District",518000,China,Guangdong,Shenzhen,,http://efaith.en.alibaba.com/contactinfo.html
"Foshan Snat Energy Electrical Technology Co., Ltd.",Ms. Sabrina Lau,,86-0757-81816131,18039293535,86-0757-81816130,"Hongke building, Xiadong Economic Zone, Guicheng",528251,China,Guangdong,Foshan,http://www.snadi.com.cn,http://snadi.en.alibaba.com/contactinfo.html
"Shenzhen Longood Electronics Co., Limited",Ms. Amy lee,Manager,86-755-83980757,13316857722,86-755-83986236,"1326, Jiejia Mansion, No. 3037, Shennan Road, Futian District, Shenzhen City, Guangdong Province. China",518033,China,Guangdong,Shenzhen,http://www.szlongood.com/,http://szlongood.en.alibaba.com/contactinfo.html
"Shandong AME Energy Co., Ltd.",Ms. Joy Zhang,Sales Manager,86-539-8315766,86-18053918077,86-539-8315766,No.247 Qinghe North Road Lanshan District,276000,China,Shandong,Linyi,http://www.ame-energy.com,http://ameenergy.en.alibaba.com/contactinfo.html
"Guangzhou Sansi Electronic Co., Ltd.",Ms. Kiki Lee,Sales,0086-20-15920509692,008615920509692,,Xintang,510000,China,Guangdong,GuangZhou,http://www.doolike.cn,http://doolike.en.alibaba.com/contactinfo.html
"Hefei Huanke Electric Vehicle Parts Co., Ltd.",Ms. TINA QIAN,General Manager,0086-551-66338013,13505609615,0086-551-66338013,(Sanyuan Industry Area) Weiwu Road,,China,Anhui,Hefei,http://www.hfhkpj.com,http://hfhkpj.en.alibaba.com/contactinfo.html
"Shenzhen Mastang Technology Co., Limited",Ms. Anna Ting,,86-0769-82062026,8618823125858,86-0769-82062026,"Weiye Road No.15, Lianhu 2nd Industrial, Tangxiao Town",,China,Guangdong,Dongguan,http://www.mystenergy.com,http://masitang.en.alibaba.com/contactinfo.html
"Shenzhen Fengshou Technology Development Co., Ltd.",Mr. Joson Chen,Manager,86-755-82818099,8613268303037,86-755-82815133,"Floor 3, Plant Building 9, Yintian Industrial Park, Xixiang St., Bao'an District, Shenzhen, Guangdong, China",518000,China,Guangdong,shenzhen,http://www.c-hub-easylink.com,http://fs-easylink.en.alibaba.com/contactinfo.html
"Guangzhou HZH Shipping Co., Ltd.",,,,,,,,China,,,http://www.hzhmarine.com,http://hzhmarine.en.alibaba.com/contactinfo.html
"Shenzhen Dvaus Technology Co., Ltd.",Ms. Jordan Chow,Sales Manager,0086-0755-27770677,15111315034,,"A4 Building,Huangtian Industry Park",518000,China,Guangdong,Shenzhen,http://www.dvaus.com,http://dvaus.en.alibaba.com/contactinfo.html
"Shenzhen HSTD Import And Export Trade Co., Ltd.",Ms. Belle Liu,CEO,86-0751-3655633,13651459271,,"109 Block 7, OCT Lizhi Plaza, Nanshan district",518053,China,Guangdong,Shenzhen,,http://hstdtrade.en.alibaba.com/contactinfo.html
"Shenzhen Lepower Electronic Co., Ltd.",Mr. Mars Huang,Manager,86-0755-85277150,13978806684,,"5th Floor, C Section, the Second Industrial of TaoXia Village,GaoFeng Community, Dalang Street, LongHua New District,ShenZhen China",518109,China,Guangdong,shenzhen,http://iszlepower.en.alibaba.com,http://iszlepower.en.alibaba.com/contactinfo.html
"Shenzhen Zhongxi Electronical Co., Ltd.",Ms. zhong xi,Sales Manager,86-755-23773953,15196549634,86-755-23773953,606 Zhanrun Building Longhua Distrtrict,518109,China,Guangdong,Shenzhen,http://www.zxnpt.com,http://szzxdz.en.alibaba.com/contactinfo.html
"Mario Ebike Co., Ltd.",Ms. Jacey Peng,Sales Manager,0086-519-85807656,13813668300,0086-519-85807656,MingHuang,213000,China,Jiangsu,Changzhou,http://www.marioebike.com,http://marioebike.en.alibaba.com/contactinfo.html
"Dongguan XUQY Technology Co., Ltd.",Mr. David Xu,CEO,86-0769-88038955,15013791277,,508 Jian Ke Building HouJie,523960,China,Guangdong,Dongguan,http://www.cargo-global.com,http://xuqy.en.alibaba.com/contactinfo.html
"Shenzhen Wanhong Technology Co., Ltd",Mr. Paul Guo,Sales Manager,86-755-89360956,15913258973,86-755-84864766,"409, Longhua Industry and Research Base of Xiamen University, Huaning Road, dalang Street,Longhua District, Shenzhen, China",518109,China,Guangdong,Shenzhen,http://www.whepower.com/,http://whepower.en.alibaba.com/contactinfo.html
"Shenzhen ZLPOWER Electronics Co., Ltd.",Ms. Winnie Dai,General manager,86-755-29105850,13686492863,86-755-29105851,"Building 2, Shiyan, Baoan, Shenzhen, China",518101,China,Guangdong,Shenzhen,http://www.zlpower.com,http://zlpower.en.alibaba.com/contactinfo.html
"Guangzhou Grand Auto Parts Co., Ltd.",Ms. Sally Xie,Sales Manager,0086-020-37087335,0086-13929573801,,"No 5-2 Kemulang South Rd,Tianhe District",510650,China,Guangdong,Guangzhou,http://www.gzgrand.com/en/,http://gzgrandbus.en.alibaba.com/contactinfo.html
"Suzhou Cosuper Energy Technology Co., Ltd.",Mr. Aron Pai,,86-512-68638910,13912629695,,"No.211, Building 17th, No.99 Gangtian Road, Suzhou Industrial Park",215121,China,Jiangsu,Suzhou,http://www.cosuper.com,http://cosuper.en.alibaba.com/contactinfo.html
"Sichuan Guanghan Fugui Vehicle Industry Co., Ltd.",Mr. Fugui Vehicle,,86-0838-5280352,,,"Group 4, Tongshan Village, Xinfeng Town,Guanghan ,",,China,Sichuan,"Deyang,",,http://fgcy.en.alibaba.com/contactinfo.html
"Shenzhen Genixgreen Technology Co., Ltd.",Mr. Victor Chow,Sales Director,0086-0755-61579556,008613714096556,0086-0755-86093971,"zhuangcun Industrial park,shajing town,Baoan district,",518014,China,Guangdong,SZ,http://genixgreen.en.alibaba.com,http://genixgreen.en.alibaba.com/contactinfo.html
"Shenzhen Huayi Technology Co., Ltd.",Ms. kate YU,Manager,86-0755-28692939,008618665820616,,longgang distric,518000,China,Guangdong,shenzhen,,http://shenzhenhuayi.en.alibaba.com/contactinfo.html
"Shenzhen Lixiang Energy Co., Ltd.",Ms. June Qiu,,0086-0769-83282316,15018549165,0086-0769-83282326,"6 Floor, Building A2, Songshan Lake Intelligent Valley, Liaobu Town",523430,China,Guangdong,Dongguan,http://www.szideapower.com,http://ideapower.en.alibaba.com/contactinfo.html
"Yangzhou Zhongdian Solar Technology Development Co., Ltd.",Ms. Xiaolan Guan,,86-514-84528111,18052552611,86-514-82932099,"Industrial Concentration Area, Guoji Town",,China,Jiangsu,Yangzhou,http://www.jszdtingsolar.com,http://zhongdian.en.alibaba.com/contactinfo.html
"Shenzhen HPY Electronic Technology Co., Ltd.",Ms. Jessica J,Sales Manager,0086-755-89610132,,,"Hengyu Industry Park, Longgang District",518116,China,Guangdong,Shenzhen,http://www.haopinwin.com,http://hpwin.en.alibaba.com/contactinfo.html
"Shenzhen iParts Electronic Co., Ltd.",Mr. James Zhang,Manager,86-755-18676739713,18676739713,,"Huaqiangbei Street,Futian District",518000,China,Guangdong,Shenzhen,http://www.ipartsmall.com,http://iparts.en.alibaba.com/contactinfo.html
"Shenzhen Xinglong Electronics Co., Ltd.",,,,13610418001,,,,China,,,http://xlalibaba.en.alibaba.com,http://xlalibaba.en.alibaba.com/contactinfo.html
"Ningbo Klinsmann Intelligent Technology Co., Ltd.",Ms. Jerry wu,Manager,"86-574-83033371,83032548",86 18968259950,86-574-83033372,"No.377,Yayuan South Road,Shiqi Street,Yinzhou Ningbo. China.",315100,China,Zhejiang,Ningbo,http://www.klinsmann.cc,http://klinsmann.en.alibaba.com/contactinfo.html
"Shenzhen Dali Technology Co., Ltd.",Ms. Joan Hou,Sales Manager,86-150-19244069,86 15019244069,86-150-19244069,"No1608-No1609 the source of the headquarters of the economic building,Xixiang Town, Baoan District,Shenzhen,Guangdong",518000,China,Guangdong,shenzhen,http://www.dali-batterycell.com/,http://dalibattery.en.alibaba.com/contactinfo.html
"Shenzhen King Pigeon Communication Co., Ltd.",Ms. Lily luo,Manager,86-755-29063895-804,86-13266598658,86-755-29451836-805,"Floor 2,A Building 14, Fuqiao Third Industrial Zone,Qiaotou Community Fuyong Town Bao'an District",518126,China,Guangdong,Shenzhen,http://www.GPRS-M2M.COM,http://gsmalarmsystem.en.alibaba.com/contactinfo.html
