company_name,contact_name,position,tel,mobile,fax,address,zip_code,country,province,city,website,ali_website
"Zhejiang Junfeng Fitness Equipment Co., Ltd.",Ms. Jenny Zheng,manager,86-570-2973123,0086 18969463616,,"No.25 Fengshan Sec.Road,Hangbu Industry Zone",324014,China,Zhejiang,Quzhou,http://www.chinahomegym.com,http://chinazjjf.en.alibaba.com/contactinfo.html
"Ewdeco Technology (Shenzhen) Co., Ltd.",Mr. Roger Li,Sales Director,86-755-83186629,,,"No 8, Pingshan Road, Longcheng Community, Longgang District",518112,China,Guangdong,Shenzhen,http://www.ewdeco.com,http://ewdeco.en.alibaba.com/contactinfo.html
"Shenzhen Qfine Industrial And Trade Co., Ltd.",Ms. Karry Fang,,086-0755-36626585,,,longgang,,China,Guangdong,shenzhen,,http://qfinefurniture.en.alibaba.com/contactinfo.html
"Shenzhen Xiangheng Technology Co., Ltd.",Mr. Allen Chan,,0086-0755-13650955385,,,"13th Floor, Segem Plaza, Huaqiang North Street",,China,Guangdong,Shenzhen,,http://xshine.en.alibaba.com/contactinfo.html
"Zhejiang Kaimin Electric Co., Ltd.",Ms. Lyn Lin,,86-577-68657555,,,"No.9-10,Building 12,Yibang Industry Park,Longgang ,Cangnan",325802,China,Zhejiang,Wenzhou,http://www.cnkaimin.com/english,http://cnkaimin.en.alibaba.com/contactinfo.html
"Zhengzhou Limeiqi Play Equipment Co., Ltd.",Ms. cassie wang,General Manager,86-371-87553303,13598026538,86-371-87553303,"North to Shangjie Industry estate , Zhengzhou city, Henan province, China",450000,China,Henan,ZHENGZHOU,http://www.limeiqi.com.cn,http://hnlmq.en.alibaba.com/contactinfo.html
"Xiamen 9sun Solar Technology Co., Ltd.",,,86-592-5507880,86-18659210098,86-592-5507887,,,China,,,http://biqxdc.r22.35.com/,http://9sunsolar.en.alibaba.com/contactinfo.html
"Shenzhen Mexda Electronic Technology Co., Ltd.",TONY chan,,86-0755-23288997,13380304875,,,,China,,,http://www.mexda.com,http://szmexda.en.alibaba.com/contactinfo.html
"Shenzhen Chuhuayuan Technology Co., Ltd.",,,,+8613266877561,,,,China,,,,http://chuhuayuan.en.alibaba.com/contactinfo.html
"Shenzhen Youmeijia Packing Co., Limited",Ms. Lydia Chen,Manager,86-755-36923673,8613823277752,86-755-36923673,dapeng new district,518120,China,Guangdong,Shenzhen,http://www.package-top.com,http://package-top.en.alibaba.com/contactinfo.html
"Zhenjiang Cheng Chen Plastic Co., Ltd.",Ms. Doris Wei,Sales Manager,0086-0511-18913413850,8618913413850,0086-0511-89884142,"No.886-7 ,Industrial Area,Da Lu Town,New District,ZhenJiang",212133,China,Jiangsu,ZhenJiang,http://zjccsl.en.alibaba.com,http://zjccsl.en.alibaba.com/contactinfo.html
"Zhejiang Shangneng New Energy Technology Co., Ltd.",Mr. Frank Lin,,0086-0523-13585627916,,,"Zone A, Building 1, No. 21, Zhenjiang Road, Huangwan Town,",314400,China,Zhejiang,haining,,http://jzshangneng.en.alibaba.com/contactinfo.html
"Zhenjiang Cheng Chen Plastic Co., Ltd.",Ms. Doris Wei,Sales Manager,0086-0511-18913413850,8618913413850,0086-0511-89884142,"No.886-7 ,Industrial Area,Da Lu Town,New District,ZhenJiang",212133,China,Jiangsu,ZhenJiang,http://zjccsl.en.alibaba.com,http://zjccsl.en.alibaba.com/contactinfo.html
"Shenzhen Caboren Trading Co., Ltd.",Ms. Tina l,,86-158-15062705,86 15815062705,,Agile Uptown International,511449,China,Guangdong,Guangzhou,https://caboren.en.alibaba.com/?spm=a2700.wholesale.cordpanyb.3.1364559cI3oinn,http://caboren.en.alibaba.com/contactinfo.html
"Shenzhen Shijiqiao Technology Co., Ltd.",Mr. Aaron Tao,,86-755-2919 6613,13510862592,,"No.1-3, A4 Building, 1st Industry Zone, FuYong Street, BaoAn District",518103,China,Guangdong,Shenzhen,http://www.cenbridge.net,http://cenbridge.en.alibaba.com/contactinfo.html
"Nanjing Maxv Led Display Technology Co., Ltd.",Ms. Lana Yin,Manager,86-025-84933618,,,#105 Gaohu Roadm Jiangniang District,211106,China,Jiangsu,Nanjing,http://www.maxv.me,http://maxv.en.alibaba.com/contactinfo.html
"Zhejiang Innuovo Rehabilitation Devices Co., Ltd.",Ms. Rita Yue,Sales,86-0579-13780037298,13780037298,,"Zhejiang Innuovo Rehabilitation Devices Co.,Ltd. No.196 Industry Road,Hengdian Movie Zone, Dongyang",322118,China,Zhejiang,Jinhua,http://kf-innuovo.en.alibaba.com,http://kf-innuovo.en.alibaba.com/contactinfo.html
"Yiwu Donghui Solar Technology Co., Ltd.",Mr. jiang zhiwen,,86-0579-82401322,13566954726,,"China Zhejiang yiwu 7/F, Yuye Building, 877 Chengbei Road, Futian Street",322000,China,Zhejiang,yiwu,https://ywdonghui1.en.alibaba.com/?spm=a2700.details.cordpanyb.1.2eec6285STJFDF,http://ywdonghui1.en.alibaba.com/contactinfo.html
"Dongguan Zhuorui Technology Co., Ltd.",,,,,,,,China,,,,http://dgzhuorui.en.alibaba.com/contactinfo.html
"Dongguan Yewang Technology Co., Ltd.",,,,,,,,China,,,https://andersen.aliexpress.com,http://megaorei.en.alibaba.com/contactinfo.html
"Taian Bowins Garment Co., Ltd.",Mr. peter shi,Manager of Operation Department,86-538-6292016,18653888531,86-538-6292020,"Zhengfang Technology Zone,West Chuangye Street,High and New Technology Industrial Development Zone, Tai'an, Shandong, China",271000,China,Shandong,City,http://www.bowins.net,http://bowins.en.alibaba.com/contactinfo.html
"Shandong Handsome Fitness Equipment Co., Ltd.",Ms. Emma Cheng,manager,0086-010-60294080,17710815905,,"Room 408, Building No.1 , Jia Yue Square, Xihongmen Township,Daxing District",102600,China,Beijing,Beijing,http://www.hansomefitness.com,http://hansomefitness.en.alibaba.com/contactinfo.html
"Shenzhen Laputa Technology Co., Limited",Mr. Henry Wu,Sales Manager,0086-0755-13048889280,13048889280,,"No.A3-808, E internet era building ,the east side of Zhongxing road in Ma 'an hall, Bantian street ,Longgang District, Shenzhen, China",,China,Guangdong,Shenzhen,http://www.bluetoothspeakersuppliers.com,http://szlaputa.en.alibaba.com/contactinfo.html
Panyu minfu speaker factory,Mr. Max Tse,Manager,86-750-3320223,008613322887671,86-750-3320223,129 Shengli Road,529000,China,Guangdong,Jiangmen,http://www.mf-speaker.com,http://www.alibaba.com/member/xmax/contactinfo.html
Ninghai Qiangjiao Jingyi Hardware Factory,Ms. Nancy Wu,Manager,86-0574-65190385,86 13586794712,86-0574-65190385,"No.392 SHANGPU, QIANGJIAO TOWN NINGHAI COUNTY",315612,China,Zhejiang,Ningbo,http://nhjingyi.en.alibaba.com,http://nhjingyi.en.alibaba.com/contactinfo.html
"Cixi Hamer Electric Appliance Co., Ltd.",Ms. Jane Ni,saler,86-574-63312299,86-18868921562,86-574-63312299,Zhouxiang Town,315324,China,Zhejiang,CIxi,http://cnham.en.alibaba.com/,http://cnham.en.alibaba.com/contactinfo.html
Hangzhou Xinbiao Electric Appliance Factory,Mr. tommy huang,manager,86-571-86606670,0086-18661221386,86-571-86600223,Binjiang District Changhe Town Tangziyan Village,,China,Zhejiang,hangzhou,http://www.lead-industrial.com/index.asp,http://xbhz.en.alibaba.com/contactinfo.html
"Shenzhen Aiks Machinery Co., Ltd.",Ms. Wendy Wong,manager,86-755-27961006,008618026943582,86-755-27961006,"Floor 3, No. 12, East 8th Lane, Xinhe Community, Fuhai Street",518103,China,Guangdong,Shenzhen,,http://szxbeauty.en.alibaba.com/contactinfo.html
Shenzhen EUD Digital Electronics Limited,Ms. Kelly Tian,Sales manager,86-755-28324851,13510956965,86-755-83986210,"3rd Floor,the third industrial park,Bantian,Longgang",518129,China,Guangdong,shenzhen,http://www.szeud.com,http://eudpowerbank.en.alibaba.com/contactinfo.html
"Luzhou Jiumei Import And Export Trade Co., Ltd.",Mr. Michael Jiang,Marketing Director,0086-830-4699019,13922836819,,"No.231, Cuixi Street, Dadukou Town, Naxi District",646329,China,Sichuan,Luzhou,http://lzjm.en.alibaba.com,http://lzjm.en.alibaba.com/contactinfo.html
"Shenzhen Unique Scales Co., Ltd.",Ms. Ada Hu,Sales Manager,86-0755-89603382,,,"3&6/F, Building A, Huafeng Green Energy Innovate Centre, No. 22, Longteng Road, Pingdi Street, Longguang District",518008,China,Guangdong,Shenzhen,http://www.familyscale.com,http://uniquescale.en.alibaba.com/contactinfo.html
"Shenzhen Senshao Technology Co., Ltd.",Ms. coco huang,De Rong building,86-0755-83187331,13662635757,,"1st Floor, 10 Building ChangGuang Industrial Park, Aobei Second Village, HengGang Stree, LongGang District, Shenzhen",518000,China,Guangdong,Shenzhen,http://www.szsenshao.com,http://senshao.en.alibaba.com/contactinfo.html
"Guangzhou Erkea Solar Technology Co., Ltd.",Mr. Gavin Wang,Sale Manager,86-020-29053738,0086-15918598566,,"202,No.36 Qiaolexincun,Shatainan Road,Tianhe District",510000,China,Guangdong,Guangzhou,,http://sunnysolar.en.alibaba.com/contactinfo.html
"Shenzhen Zhenyuan Electrical Co., Ltd.",Mr. Depower Shenzhen,Manager,86-0755-33185798,13556898737,,"7th floor,Block A,Xin Weirun Hi-Tech industry area,no.36th pinggang RD,Jiangshi Gongming town,Guangming new dis.,Shenzhen",518000,China,Guangdong,Shenzhen,http://www.szdepower.com,http://depowersupply.en.alibaba.com/contactinfo.html
"Shenzhen Xingqite Technology Co., Ltd.",Ms. Coco huang,,86-86-13662635757,,,"1st Floor, 10 Building ChangGuang Industrial Park, Aobei Second Village, HengGang Stree, LongGang District",518000,China,Guangdong,shenzhen,http://www.szsenshao.com,http://szxqt.en.alibaba.com/contactinfo.html
"Shenzhen Subai Electronic Technology Co., Ltd.",Ms. simone wang,,86-020-13560068092,,,gz,510000,China,Guangdong,gz,,http://somiis.en.alibaba.com/contactinfo.html
"Nantong Kimpo Sports Co., Ltd.",Gong Judy,,,,,,,China,,,,http://kimposport.en.alibaba.com/contactinfo.html
"Beijing Aprilbrother Technology Co., Ltd.",Ms. Julia Zheng,Sales Administrator,86-010-13661293819,13661293819,,"B2-12S Chengming building, No.2 south street of Xizhimen, Xicheng district",,China,Beijing,BEIJING,https://www.aprbrother.com/en/index.htm,http://aprbrother.en.alibaba.com/contactinfo.html
"Shandong Jinhong New Energy Co., Ltd.",Ms. Shandong Jinhong,,86-0538-8660362,,,Guhe East Branch Road,,China,Shandong,Taian,,http://sdjhenergy.en.alibaba.com/contactinfo.html
"Taizhou Luqiao Huayou Machinery Co., Ltd.",,,,,,,,China,,,http://tzhuayou.en.alibaba.com,http://tzhuayou.en.alibaba.com/contactinfo.html
"Mantall Heavy Industry Co., Ltd.",,,,,,,,China,,,http://www.mantall.com,http://mantall.en.alibaba.com/contactinfo.html
"Hero Electronics Co., Limited",Ms. Joy Wei,Sales Manager,86-755-82710580,8618665805998,,"4F,Shuisong Bldg,Tairan 8th Road, Futian",518040,China,Guangdong,Shezhen,http://www.ihome-digital.com,http://aoergift.en.alibaba.com/contactinfo.html
Shen Zhen Bizoe Electronic Technology Limited,Ms. Lucy Zhong,Sales Manager,86-0755-23713580,18682340859,,Xixiang,518126,China,Guangdong,Shenzhen,http://szbizoe.com,http://szbizoepower.en.alibaba.com/contactinfo.html
"Dalian Thrive Mining Co., Ltd.",Ms. Doris Zhou,Manager,86-411-84357743,86-13504952036,86-411-84342356,"NO.228 GAOERJI ROAD, XIGANG DIST. DALIAN CHINA",116021,China,Liaoning,DALIAN,http://www.duramaterials.com/,http://thrive-metal.en.alibaba.com/contactinfo.html
"Qingdao Shengkairuite New Energy Technology Co., Ltd.",Ms. Wendy Tie,,86-0532-86995203,13963939850,,"North Building of YinXingHui Business Street, No.1382, EMeiShan Road, Huangdao District, Qingdao City, China.",266555,China,Shandong,Qingdao,,http://skgreat-fitness.en.alibaba.com/contactinfo.html
Beijing Beautemax Technology Limited,Ms. Monica Liu,,0086-010-57302234,008613363160664,0086-010-57302234,Tongzhou,065201,China,Beijing,Beijing,http://www.winkonlaser.com/,http://winkonlaser-beauty.en.alibaba.com/contactinfo.html
"Heyuan Top Kitchen Equipment Co., Ltd.",Ms. Jessie Ji,Sales manager,00-86-13553252486,008613553252486,,"105 National Road side Development Zone,Longjie Town,Lianping County",517149,China,Guangdong,Heyuan,https://topkitchencn.onesite.alibaba.com,http://topkitchencn.en.alibaba.com/contactinfo.html
"Shenzhen Fashion Luminous Technology Co., Ltd.",Mr. Tom Tang,MANAGER,86-755-89397759,13925262440,86-755-89397788,bantian,518129,China,Guangdong,shenzhen,http://www.luminous-clothing.com,http://luminousclothing.en.alibaba.com/contactinfo.html
"Shenzhen Faziyu Biotechnology Co., Ltd.",Ms. Rose wang,,0755-8412-0858,,,kengzi,518122,China,Guangdong,shenzhen,https://szfzy.en.alibaba.com,http://szfzy.en.alibaba.com/contactinfo.html
"Henan Huachuang Communication Equipment Co.,ltd.",Ms. Emily Li,Sales Manager,86-371-66635816,8615038210020,86-371-63636999,"7 / f, block G, building 1, east innovation park, Henan national university science and technology park, high-tech zone",450000,China,Henan,Zhengzhou City,http://www.hcoce.com,http://hcfiberoptic.en.alibaba.com/contactinfo.html
"Ningbo Vimdo Sports Co., Ltd.",Mr. Raymond Cho,Sales Manager,86-0574-88888888,15888181305,,"Zhangqi Industrial Zone,Yinzhou",315100,China,Zhejiang,Ningbo,http://www.vimdosports.com,http://vimdosports.en.alibaba.com/contactinfo.html
"Shenzhen Krier Electronics Co., Limited",Mr. Rison Lu,Sales Manager,86-755-23228690,15013766781,,"6C/6F,Tangquan Building,Zhongxin Rd,Shajing Town,Bao'an District",518125,China,Guangdong,Shenzhen,http://szkrier.en.alibaba.com,http://szkrier.en.alibaba.com/contactinfo.html
"Shenzhen Sopray Solar Energy Technology Co., Ltd.",Mr. Jerry Tang,Sales director,86-0755-23217726,13662665783,86-0755-23217726,"East 13th F.Bldg. A1,Zhongtai Info. Tech. Industrial Park,Shiyan St. Baoan Dist.",518100,China,Guangdong,shenzhen,http://www.sopraysolargroup.com,http://sopraysolargroup.en.alibaba.com/contactinfo.html
"Dongguan Kaidi Adhesive Technology Co., Ltd.",Mr. KAIDI PACK,sales manager,0086-769-87918262,86 13360663762,0086-769-87918262,"No.12,Tanglian 3rd street, 1st Industrial zone, Tangxia Town",523710,China,Guangdong,Dongguan City,http://www.kaidipack.net,http://kaidipack.en.alibaba.com/contactinfo.html
"Guangdong Liyuan Pump Co., Ltd.",Ms. Scarlett Tu,Manager,86-750-3818558,8613422501007,,Jiaobei second industrial estate,,China,Guangdong,Jiangmen,http://www.liyuan-pump.com,http://liyuan-pump.en.alibaba.com/contactinfo.html
"Shenzhen Kastar Timepieces Co., Ltd.",Ms. Orange Huang,G.M,0086-755-23728850,0086-13714113149,,"5F, B7 Building, Fenghuanggang Industrial Zone, Xixiang, Bao'an",518102,China,Guangdong,Shenzhen,http://www.kstwatch.com,http://kstwatch.en.alibaba.com/contactinfo.html
"Dongguan Xinxiang Packing Co., Ltd.",Mr. Brian Lee,Sales Manager,,13751256133,,"Room 102, No. 1, Zhongwuwei Bustiness Street 2,Dongcheng",523000,China,Guangdong,Dongguan,,http://prosperpacking.en.alibaba.com/contactinfo.html
"Guangzhou Renlang Electronic Technology Co., Ltd.",Ms. Jenny Renlang,Sales Manager,86-20-22929583,008613826474063,86-20-22929583,"Room 306, New Thinking Creative Industrial Park,147 Xinshi Lu,Junhe Avenue Baiyun District, Guangzhou China",,China,Guangdong,Guangzhou,http://www.renlangkeji.en.alibaba.com,http://renlangkeji.en.alibaba.com/contactinfo.html
"Guangzhou Bosally Watch Co., Ltd.",Mr. Jerry Peng,Manager,86-0579-13580996086,13580996086,,"No. 2, Tangditian Road, Pingshatang, Junhe Street, Baiyun Dist.",510000,China,Guangdong,Guangzhou,http://bosallywatch.en.alibaba.com,http://bosallywatch.en.alibaba.com/contactinfo.html
"Shuangying Watch Technologies (Shenzhen) Co., Ltd.",Ms. Hebe Zhang,sales,86-755-29238735,,,"9th Floor,JieChang building ,HongXing Industrial, SongGang,BaoAn",518105,China,Guangdong,shenzhen,http://www.2winwatches.com.hk,http://2winwatches.en.alibaba.com/contactinfo.html
"Yantai Goldsun Solar Energy Tech. Co., Ltd.",Mao Sunny,,,,,,,China,,,http://www.baodigoldsun.net,http://goldsunsolar.en.alibaba.com/contactinfo.html
"Xiamen Sweet Power Tech. Co., Ltd.",Mr. Kevin Lee,General Manager,86-592-18059873669,,,"Rm.710, No.466, Xinglin Bay Rd, Jimei District",361000,China,Fujian,Xiamen,http://swt-power.com,http://swt-power.en.alibaba.com/contactinfo.html
"Dongguan Nicejune Net Tech Co., Ltd.",Mr. Nedved Wang,Sales Manager,86-769-81550187,13712897162,,Nancheng,,China,Guangdong,DongGuan,http://nicejunehomewares.en.alibaba.com,http://nicejunehomewares.en.alibaba.com/contactinfo.html
"CiCi Pack Guangzhou Co., Ltd.",Mr. tony lai,manager,0086-020-22097226,008613822124882,0086-020-22097226,"NO.42,10 street,lingnan international electromic commer, xiajiao ,Panyu District",511400,China,Guangdong,guangzhou,http://www.cicipack.com,http://cicipack.en.alibaba.com/contactinfo.html
"Ningbo Kylin Household Co., Ltd.",Ms. Kathy Shu,Manager,0086-574-81075068,13968338019,0086-574-88206148,"Hebang buliding NO. 933 of the north Tiantong road, Yinzhou district, Ningbo City",,China,Zhejiang,Ningbo,http://www.nbkylin.com,http://kylin68.en.alibaba.com/contactinfo.html
"Shenzhen Si Hai Xin Zhou Technology Co., Ltd.",Ms. Molly Kang,,86-0755-85201155,13266707409,86-0755-85201155,"Floor 4th, Building A, Qidi Technology Park, No.2, Jianmin Road, Nanwan Street, Longgang District",518000,China,Guangdong,Shenzhen,http://www.diymore.cn,http://diymore.en.alibaba.com/contactinfo.html
"Xiamen Lio Tech Co., Ltd.",Mr. Dany Huang,,0086-592-7311160,,,XIANG'AN HUOJU INDUSTRY,361101,China,Fujian,XIAMEN,http://www.amoytob.com,http://liotech.en.alibaba.com/contactinfo.html
"Chongqing Foreseen Optics Instrument Co., Ltd.",Mr. Michael Young,sale manager,86-023-86032289,86 13618349087,86032289,Beiwenquan Street,400700,China,Chongqing,Chongqing,http://foreseelove.alibaba.com,http://foreseelove.en.alibaba.com/contactinfo.html
Shenzhen Nendnenpow Industry Company Limited,Mr. Harry Wang,Manager,86-0755-88999844,13632935244,,"Longhua District,Da Lang Street",518000,China,Guangdong,Shenzhen,,http://nendnenpow.en.alibaba.com/contactinfo.html
"Zhengzhou Yueton Amusement Equipment Co., Ltd.",Ms. Abby Yang,Manager,86-371-55699559,008615639085024,,No.3. Youai Road,450000,China,Henan,Zhengzhou,http://www.yuetonride.com,http://yueton.en.alibaba.com/contactinfo.html
"Zhongshan Saloy Electronic Technology Co., Ltd.",Ms. Emma Yi,SALES MANAGER,0086-760-89862966,13557543352,,"No.118, Chang An North Road, Henglan Town",528478,China,Guangdong,ZHONGSHAN CITY,http://www.saloy-scale.com,http://saloyscale.en.alibaba.com/contactinfo.html
"Shenzhen Junbobeauty Technology Co., Ltd.",Mr. Alex Xu,Sales Manager,0086-0755-33514402,17665318870,,"Room 512, Huameiju Building, Shajing Street, Baoan",518104,China,Guangdong,Shenzhen,,http://jbmtech.en.alibaba.com/contactinfo.html
"Shenzhen Someg Electronic Technology Co., Ltd.",Mr. yeming wang,sales manager,86-00-13560068092,13560068092,86-00-13560068092,"2 flour Buliding D zhuangbian indutrial park,nanchang road,hangcheng road,xixiang,,baoan",510000,China,Guangdong,shenzhen,http://someg.en.alibaba.com,http://someg.en.alibaba.com/contactinfo.html
"Shenzhen VTD Technology Co., Ltd.",Ms. Vanessa Zhou,Sales Manager,86-755-28309550,0086 13590455924,,"Nankeng, Bantian, Longgang",518110,China,Guangdong,Shenzhen,http://www.promotionsusb.com,http://vtdpromo.en.alibaba.com/contactinfo.html
"Shenzhen Hopehong Technology Co., Ltd.",Mr. Jammy Lee,sales manager,86-183-19031378,18319031378,,Guangming New District,518000,China,Guangdong,Shenzhen,,http://hopesolar.en.alibaba.com/contactinfo.html
"Henan Huachuang Communication Equipment Co.,ltd.",Ms. Emily Li,Sales Manager,86-371-66635816,8615038210020,86-371-63636999,"7 / f, block G, building 1, east innovation park, Henan national university science and technology park, high-tech zone",450000,China,Henan,Zhengzhou City,http://www.hcoce.com,http://hcfiberoptic.en.alibaba.com/contactinfo.html
"Dongguan Win-Win Electrical Co., Ltd.",Mr. Wayne Zhang,CEO,86-0769-87021025,8618002686780,86-0769-87021025,No. 208 Shangyuan Road Qingxi Town,523660,China,Guangdong,Dongguan,http://www.connectorchina.cn,http://connectorchina.en.alibaba.com/contactinfo.html
"Ningbo Resoon Import And Export Co., Ltd.",Mr. Sean luo,,86-0574-17757838008,,,daqi,,China,Zhejiang,ningbo,http://www.resoon.com,http://sesoon.en.alibaba.com/contactinfo.html
"Shanghai Changen Printing Co., Ltd.",David Zhang K,,,,,,,China,,,http://www.changenprinting.com,http://dropcolour.en.alibaba.com/contactinfo.html
"Kunyang Zhicheng Optical Co., Ltd.",Mr. joe yang,general manager,86-0871-67892532,8613987671951,,"South door,Kunyang Town,Jinning County,Kunming City,Yunnan Province",650600,China,Yunnan,kunming,http://www.kunyangoptics.cn,http://kunyangoptical.en.alibaba.com/contactinfo.html
"Jinan Glorious Machinery Co., Ltd.",Mr. Jackie Zhang,Sales Manger,86-0531-69929617,15168802272,,"Tianshun industrial park, logistics avenue, huaiyin district, jinan city, shandong province",250000,China,Shandong,Jinan,http://www.chnmachines.com/,http://gloriousmachinery.en.alibaba.com/contactinfo.html
"Dongguan Andu Electronic Co., Ltd.",Ms. Kathie Xie,,86-00-15521389768,15521389768,,"5 Shaling West Road, Xiakou, Dongguan City, Guangdong Province",523000,China,Guangdong,Dongguan,http://www.autoido.com,http://autoido.en.alibaba.com/contactinfo.html
"Shenzhen Svet Opto Electronics Co., Ltd.",Mr. Kevin Lee,Manager,0086-755-23765358,18098992068,,"Room 216, Longsheng Times Bulding, Gongye Road, Longhua New district, Shenzhen, China",518109,China,Guangdong,Shenzhen,http://www.svetledsz.com,http://svetled.en.alibaba.com/contactinfo.html
"Shenzhen Whynot Technology Co., Ltd.",Mr. Larry Ma,sales,86-0755-61309770,18617161513,,,,China,,,http://www.orientpowertech.com/,http://whynot.en.alibaba.com/contactinfo.html
"Linyi Nanyue Auto Parts Sales Co., Ltd.",Mr. Allen Yu,Manager,0086-539-8290727,15563393305,,"No. B560, Bldg. 11, B Area, Auto & Motorcycle Parts Mall, Lanshan Dist.",276000,China,Shandong,Linyi,http://www.lynyautoparts.com,http://lynyqp.en.alibaba.com/contactinfo.html
"Dongguan Rain Industry Co., Ltd.",Mr. Kevin Fang,Manager,86-0769-8963 3730,137 2828 0307,86-0769-8182 8165,"No.36 Yanwo Avenue, Shipai Town",,China,Guangdong,DongGuan,http://www.qwmetal.com,http://rainmetal.en.alibaba.com/contactinfo.html
"Jiangsu Baixue Electric Appliances Co., Ltd.",Mr. David Chen,Vice President,86-512-52781261,,86-512-52845275,Baixue Road,215500,China,Jiangsu,Changshu,http://www.baixue-international.com,http://chinabaixue.en.alibaba.com/contactinfo.html
"Dongguan YingFeng Metal & Plastic Products Co., Ltd.",Ms. Sunny Weng,,86-21-68866882,15601699836,,Baoshan,200949,China,Shanghai,Shanghai,http://www.maxconcept.com.hk,http://maxconcept.en.alibaba.com/contactinfo.html
"Shenzhen SuKu Technology Co., Ltd.",Ms. Amber Lin,sales manager,86-755-13590170434,86 13590170434,,"Building B, Guanghong center, PingXin north road 163,Pinghu, Longgang",,China,Guangdong,ShenZhen,,http://sktechnology.en.alibaba.com/contactinfo.html
"Shenzhen Sungzu Technology Co., Ltd.",Ms. Jocelyn Luo,Sales,0086-0755-29952902,0086-18929349937,0086-0755-29952903,"3rd Floor, Block 1, Jiuhua Tech Park, Xingwei Rd, Bao'an District",518102,China,Guangdong,Shenzhen,http://www.sungzu.com,http://sungzua.en.alibaba.com/contactinfo.html
"Shenzhen Kewo Electric Technology Co., Ltd.",Ms. Kristy Huang,Sales Director,86-0755-23283620,86-13725501611,86-0755-23283620,"3 Floor,Block 8,St George Industrial Park,Xinyu Road,Sha Jing,Bao'an",518133,China,Guangdong,Shenzhen,http://www.kewodrive.com,http://kewo-drino.en.alibaba.com/contactinfo.html
"Shenzhen You-San Technology Co., Limited",Ms. Linda Ouyang,,86-0755-29091712,,,"Building A,The West Area inXueziwei Industrial Zone of HoutingVillage,Shajing town,Baoan District,Shenzhen,China",518104,China,Guangdong,Shenzhen,http://www.yousantape.com,http://vhbtape.en.alibaba.com/contactinfo.html
Huizhou Dingli Packaging Products Company Limited,Ms. Winnie Wong,Sales Manager,0086-752-3748855,15989573235,,"Floor 2, Bldg. 5, Junyuan Ind. Zone, Baishi, Qiuchang Town, Huiyang Dist.",516221,China,Guangdong,HuiZhou,http://www.toppackcn.com/,http://toppackcn.en.alibaba.com/contactinfo.html
"Guangzhou Skmei Watch Co., Ltd.",Mr. Lay Lee,manager,0086- 185-65070924,008618565070924,,"6th Floor, A Building, No.1 Community Industrial Park, No.28th Longtang Road, Tangge Village , Shijing Town, Baiyun District",,China,Guangdong,Guangzhou,,http://skmei2088.en.alibaba.com/contactinfo.html
"Sus Advancing Technology Co., Ltd Guangzhou",Ms. Cherry Luo,Marketing Director,86-20-36055787,86-18666097337,86-20-36055906,"A3 Building, 63 Zhenzhong North Road, Shenshan, Jianggao, Baiyun,",510460,China,Guangdong,Guangzhou,http://www.suslaser.com,http://suslaser.en.alibaba.com/contactinfo.html
"Zhejiang Fortune Energy Co., Ltd.",,,,,,,,China,,,http://www.m-cells.net,http://m-cells.en.alibaba.com/contactinfo.html
"Shenzhen Embrace Technology Co., Limited",Mr. Michael Cheng,Director,0086-0755-83017564,13760199605,0086-0755-83971830,"1418 Yongjingxuan Buliding , Huasheng Rd , Dalang , LongHua District",518031,China,Guangdong,Shenzhen,https://hkeverwin.en.alibaba.com,http://hkeverwin.en.alibaba.com/contactinfo.html
PIOTR WANG POWER TRADING,Ms. Xin Wang,Marketing,86-18617163669,48 717905466,,"MinZhi,BaoAn,ShenZhen,CN",514000,Poland,"CHINA,EU","ShenZhen,Warszawa,Wroclaw",http://pl1048675637.trustpass.alibaba.com,http://www.alibaba.com/member/pl1048675637/contactinfo.html
"Yiwu Chernliy Trade Co., Ltd.",Ms. Casie Chen,General Manager,0086-0579-15757925780,15757925780,,"Room 202,No 5-6 Annex,Block B,Binwang Plaza,Jiangdong Street",322000,China,Zhejiang,Yiwu,http://chernliytrade.en.alibaba.com,http://chernliytrade.en.alibaba.com/contactinfo.html
"Shenzhen Chenghan Technology Co., Ltd.",Mr. Yaphet Chin,Manager,0086-755-26726986,0086-13316540574,86-755-26726986,"Floor 3, #5220 Longgang Rd.",518116,China,Guangdong,Shenzhen,http://www.chenghan.tech,http://chenghan.en.alibaba.com/contactinfo.html
"Wenzhou Maijing Health Technology Co., Ltd.",Ms. helen hong,sales manager,86-577-63780009,86 13566231258,86-577-63780009,"Wanquan Industrial Zone, Pingyang County",325000,China,Zhejiang,Wenzhou,https://wzmaijing.en.alibaba.com,http://wzmaijing.en.alibaba.com/contactinfo.html
"Fuqing Honghai Blister Products Co., Ltd.",Mr. Garrishon Li,,86-182-50833563,18250833563,,"3rd Road, Hongkuan Industrial District",,China,Fujian,Fuqing,http://packhall.com,http://honghaixisu.en.alibaba.com/contactinfo.html
"Jiangsu Meca Optoelectronic Technology Co., Ltd.",,,,,,,,China,,,http://www.mega-light.cn,http://jsmjgd.en.alibaba.com/contactinfo.html
"Quzhou Holly Electronic Co., Ltd.",Mr. leo LIU,Manager,86-570-2931444,,86-570-8056371,NO.26-8 Nanshan Road Qujiang District,324022,China,Zhejiang,Quzhou,http://www.holly-electronic.com/,http://zjholly.en.alibaba.com/contactinfo.html
