company_name,contact_name,position,tel,mobile,fax,address,zip_code,country,province,city,website,ali_website
"Wenling Whachinebrothers Machinery Co., Ltd.",Mr. WeiPing Wang,CEO,0086-576-81688988,15957688222,86-576-81622728,RuoHeng Town,317500,China,Zhejiang,Wenling City,http://www.wbsgear.com,https://whachine.en.alibaba.com
"Dongguan Nanbo Motion Machinery Co., Ltd.",Ms. angela shang,Sales Manager,86-769-13794904861,86-13537111289,86-769-33218682,"No. 139 D, Guanghui Road, Xincun Industrial Zone, Wanjiang District",523053,China,Guangdong,Dongguan City,http://nbmotion.en.alibaba.com,https://nbmotion.en.alibaba.com
"Dongguan YingFeng Metal & Plastic Products Co., Ltd.",Ms. Sunny Weng,,86-21-68866882,15601699836,,Baoshan,200949,China,Shanghai,Shanghai,http://www.maxconcept.com.hk,https://maxconcept.en.alibaba.com
"Shenzhen Slinya Electronics Co., Ltd.",Mr. Roy Shen,Sales Manager,0086-0755-83955510,0086-13713706687,0086-0755-22718989,"Room 701A, 7th Floor, West of 4th Building, SEG Science & Tech Park, Huaqiang Road, Futian District",518000,China,Guangdong,Shenzhen,http://www.slinya.com,https://slinya.en.alibaba.com
"Wuhan Yili Electronics Co., Ltd.",Mr. Nicky Zhou,Sales Manager,0086-27-18186229257,0086 18186229257,,"Building 6th,Optical vally electronic industial park 2nd Phase",430200,China,Hubei,WUHAN,http://www.yilijet.com,https://xenons.en.alibaba.com
"Zhuozhou Summer Star Technologies Co., Ltd.",Mr. Lynn Gao,Manage,86-0312-3658587,8613693100103,,"Hongkong Heights , Fanyang West Street",072750,China,Hebei,Zhuozhou,http://www.sumstars.com,https://sumstarslaser.en.alibaba.com
"Shenzhen Yongshengwang Mechanical Equipment Co., Ltd.",Mr. QIAN XING,,86-0755-27134397,17512003070,860-755-23270783,,,China,,,http://www.yswcn.cn,https://yswcn.en.alibaba.com
"Shenzhen Polymer Battery Co., Ltd.",Ms. kaya lee,,86-0755-36631197,,,Guanlan,518110,China,Guangdong,Shenzhen,http://www.plmen.cn,https://plmbatterys.en.alibaba.com
"Chongqing Fortus Electronic Technology Co., Ltd.",Ms. sandy ling,,86-023-4560,18680871807,,Yubei district,401120,China,Chongqing,Chongqing,,
"Dongguan Shi Yi Hardware Products Co., Ltd.",Mr. Huang Bruce,Sales Manager,86-0769-85702818,86 13600292724,,No.18 Xinfeng Quartet Industrial Park Humen Town,523926,China,Guangdong,Dongguan,http://www.dgshiyiwujin.com,https://dgsywj.en.alibaba.com
"Shanghai Point Computing Information Technology Co., Ltd.",Mr. Anna Xue,Sale,0086-021-50180837,8615701210221,,"Room r219, 2nd floor, Kaide Zheng Center Building, 489 Zhengli Road, Yangpu District",200433,China,Shanghai,Shanghai,http://www.91mine.com,https://hxminer.en.alibaba.com
"Shenzhen Zhongxin Electronic Technology Co., Ltd.",Mr. Shine Sun,,86-020-13533476603,,,baiyun,510000,China,Guangdong,guangzhou,https://lianmei1688.1688.com/,https://bestzx.en.alibaba.com
"Shenzhen Twosuccess Electronic Co., Ltd. (Plus)",Ms. Jane Me,sales manager,86-755-84525800,008613691668958,86-755-84525800,"Room 508,Ruida science and technology park B building ,bantian street ,longgang district ,shenzhen city ,guangdong province . China",518118,China,Guangdong,shenzhen,http://www.anynow.com,https://anynow.en.alibaba.com
"Shenzhen Sinorise Technology Co., Ltd.",Mr. Allan Chang,Sales director,86-755-27321720,,86-755-27097125,"Floor 1, Bldg. C, No. 2082, Jincheng Road, Shajing West Zone",518300,China,Guangdong,Shenzhen,http://www.sinorisemfg.com,https://sinorisemfg.en.alibaba.com
"Ningbo Winhi Electronic Co., Ltd.",Ms. Vivian Sun,sales Manager,86-574-86818895,86-13958322242,86-574-86818532,"529# West Mingzhou Rd, Beilun District,",315800,China,Zhejiang,Ningbo,http://www.china-winhi.com,https://china-winhi.en.alibaba.com
"Shenzhen Mengsheng Paper Packaging Products Co., Ltd.",Mr. Kelvin Mi,Boss,86-0755-28990332,13602672868,,"3F Builing A3 , Xiufeng Industrial Park , Buji ,Shenzhen",518114,China,Guangdong,Shenzhen,http://msprinting86.com,https://mengshengpacking.en.alibaba.com
"Xiantao Yi-Ya Protective Products Co., Ltd.",Ms. Daisy Lei,Sales Manager,86-0728-3326822,0086-18696471067,86-0728-3326822,ZhongJia Industrial,433000,China,Hubei,Xiantao,http://xiantaoyiya.en.alibaba.com/,https://xiantaoyiya.en.alibaba.com
"Shenzhen Pure Printing Products Co., Ltd.",Pure sticker,,,,,,,China,,,http://www.sz-pure.com,https://puresticker.en.alibaba.com
"Shenzhen Kingberry Electronic Technology Co., Ltd.",Ms. Stella Lu,Sales Manager,86-0755-13825260274,8613825260274,,Longhua District Donghuang Road,,China,Guangdong,shenzhen,http://www.szkingberry.com,https://kingberry.en.alibaba.com
"Xiamen Doopser Electronics Co., Ltd.",Ms. Grace Chen,Sales Manager,0086-592-6512192,13850383550,0086-592-6512192,"No.1 Mucuo Road,Huli Area,Xiamen",361009,China,Fujian,Xiamen,http://www.doopser.com,https://doopser.en.alibaba.com
"Shenzhen Rechuang Electronics Co., Ltd.",Mr. Alex Xie,General Manager,86-755-29005929,86 15986811326,86-755-23357023,"Floor 2, Building B, Xinshidai Gongrong Industrial Park, Shilong Community, Shiyan Sub-district, Baoan District",518108,China,Guangdong,Shenzhen,https://timmfg.en.alibaba.com,https://timmfg.en.alibaba.com
"Zhengzhou Leabon Machinery Equipment Co., Ltd.",Ms. Carolyn Ji,Sales Manager,86-371-87535015,008615939045080,86-371-87535381,"Room 116, Floor 22, Building 4, Zhidi Plaza, 1188 Zhongzhou Avenue, Jinshui District,",450000,China,Henan,Zhengzhou,http://www.zzleabon.com,https://zzleabon.en.alibaba.com
"Guangzhou Guanyu Machinery Co., Ltd.",Ms. Christine He,,0086-020-61196671,13928795282,,"Hebian,jiahe Street ,Baiyun District",510440,China,Guangdong,Guangzhou,http://www.gzgychina.com,https://gzguanyu.en.alibaba.com
Huizhou HKY Hardware Factory,Ms. Tina Wong,Sales Manager,86-0752- 5310171,8615113230896,,"1st Floor, A Building, Huifeng West Third Road No. 108, Chenjiang St., Zhongkai High-Tech District",516006,China,Guangdong,Huizhou,http://www.hky-hardware.com/,https://hky-hardware.en.alibaba.com
"Shenzhen FS Technology Co., Ltd.",Ms. Grace Lee,CEO,0086-755-86966026,0086 13715307049,0086-755-86966025,"Room 301-302, huasui building, building 47, xicheng industrial zone, xixiang street, baoan district",518054,China,Guangdong,ShenZhen,http://www.fs-pcba.com,https://fs-pcba.en.alibaba.com
"Henan Haochi Machinery Equipment Co., Ltd.",Mr. Jay Du,,86-0395-5766351,0086 15518172056,,renmin road,,China,Hainan,luohe,,
"Zhangjiagang Friend Machinery Co., Ltd.",Mr. Wei Yuan,Sales Manager,"86-512-58551998, 18901568633",18013292369,86-512-58551918,"No.3 Jinle Road, Jinfeng Town, Zhangjiagang City,Jiangsu Province, China",215600,China,Jiangsu,zhangjiagang,http://www.friendmachine.com.cn,https://zjgfld.en.alibaba.com
"EB-OEM Technology Co., LTD",Mr. Leo Liu,,86-0755-29978402,15013809029,,"Room 804 ,4 Building B , Tonghe phoenix garden ,Fuyong Street Bao'an district",518103,China,Guangdong,Shenzhen,http://www.eb-oem.com,https://eb-oem.en.alibaba.com
"Guangzhou Lechuang Electronic Technology Co., Ltd.",Ms. Kate Qiu,Foreign Trade manager,86-20-29866882,008613424066969,86-020-29866882,"No.894,Tianhe North Road, Guangzhou (First floor, International Science &Trade Centre , Tianhe Software Park) Guangdong Province, China.",510000,China,Guangdong,Guangzhou,http://www.vrsoon.com,https://gzlechuang.en.alibaba.com
"Ningbo Dooda Electronic Technology Co., Ltd.",Ms. Carol Hu,Sales Manager,0086-574-65218916,15888032839,0086-574-65218919,"No. 18, Jin'gong Road, Ninghai County",315600,China,Zhejiang,Ningbo,https://dooda.en.alibaba.com,https://dooda.en.alibaba.com
"Zhenjiang Voton Machinery Co., Ltd.",Ms. Serena Kang,manager,86-0511-84421918,13270323273,86-0511-84424810,"No. 6, Zone 12, Taohuawu New Village",212000,China,Jiangsu,Zhenjiang,http://www.rf-connectors.com/,https://voton.en.alibaba.com
"Dongguan City Beijia Silicone Rubber Products Co., Ltd.",Mr. Yuki Zhu,,86-769-23322669,,86-769-23327898,"Zhuanyao Industrial Zone,Dongcheng District,Dongguan City,Guangdong Province,China",523000,China,Guangdong,Dongguan,http://www.bj-silicone.com/,https://dgbeijia.en.alibaba.com
"Shenzhen Shihua Industrial Co., Ltd.",Ms. Janice Lee,General Manager,86-769-82279928,13510526446,,"Longgang district, Longgang Road",,China,Guangdong,Shenzhen,http://yiwahealthcare.com,https://yiwahealthcare.en.alibaba.com
"Jinan Maao International Trade Co., Ltd.",Ms. WenLi Wang,,86-370100-18668933377,,,"Unit 1, Building 7, Dinghao Square, Jinan High-tech Zone 2005",250000,China,,Jinan,,
Guangzhou Huang Kai Electronic Technology Company Limited,Ms. Sunny Zhang,sales manager,0086-020-81412392,,0086-020-81412392,106 RODE,510385,China,Guangdong,Guangzhou,http://www.huang-kai.com,https://huang-kai.en.alibaba.com
"Shanghai Leadworld Machinery Technology Co., Ltd.",Ms. LORA LI,Sales Manager,0086-021-67691848,18964928169,0086-21-37693309,"NO.5599 Shenzhuan Road, DongjingTown, Songjiang District, Shanghai, China",201619,China,Shanghai,Shanghai,http://www.leadworld.cn/,https://shleadworld.en.alibaba.com
"Guangzhou Veriyoung Electronic Technology Co., Ltd.",,,,,,,,China,,,http://www.infeny.com,https://veriyoung.en.alibaba.com
"Zhejiang Senling Electronic Technology Co., Ltd.",Mr. Tobey Song,,86-577-58115891,+86 18767121647,,"No. 66, Fenglian Road, Zhenglou Ind. Zone, Wanquan Town, Pingyang County",325409,China,Zhejiang,Wenzhou,http://sonkin.en.alibaba.com/,https://sonkin.en.alibaba.com
"Wuhan Yuanguang Ruikang Technology Co., Ltd.",Mr. Roy Zhang,Overseas sales director,86-27-59374335,,,"3F, Unit 1, Building 1, No. 8 Gongfang Optical Valley , Tanhu No 1 Rd, Jiangxia District",430205,China,Hubei,Wuhan,http://www.ygrk-health.com,https://ygrk.en.alibaba.com
"Shenzhen Newpro Electronics Co., Ltd.",Sandy Jiang,,86-755-85278646,18929377047,,,,China,,,http://www.newproelectronics.com,https://newproelectronics.en.alibaba.com
"Jiangxi Songcheng Technology Co., Ltd.",Ms. Alyssa Dong,,86-797-8260568,19136785301,,"616# Block A,Luoke Square,Fifth Avenue,No.3 Qinjiang Road,Zhanggong Distirct",341000,China,Jiangxi,Ganzhou,https://songcheng20192.en.alibaba.com,https://songcheng20192.en.alibaba.com
"Guangzhou Yda Game Machine Co., Ltd.",Ms. Janet Lee,sales person,86-020-39148225,18928840815,,Dalong Street,511400,China,Guangdong,Guangzhou,,
"Foshan Nanhai Fair Electronic Technology Co., Ltd.",Mr. zeno zhou,,86-0757-18578441168,8618578441168,,lishui,,China,Guangdong,guangzhou,http://fairbeauty.en.alibaba.com,https://foshanfair.en.alibaba.com
"Guangzhou Xuguang Packing Machinery Equipment Co., Ltd.",Ms. Tina Tan,manager,0086-20-28997926,13533726445,0086-20-36137009,"No.2,Yayao South Road,Yayao Town,Huadu District,Guangzhou.",510000,China,Guangdong,Guangzhou,http://www.gz-sg.com,https://gzxg.en.alibaba.com
"Guangzhou Weizheng Sheet Metal Fabrication Co., Ltd.",Mr. Pommy OuYuang,Sales Manager,86-20-39968921,0086 13822186795,86-20-39968921,Panyu district,511447,China,Guangdong,GuangZhou,http://www.8-a.cn,https://gzzxbj.en.alibaba.com
Dongguan Hehao Hardware And Plasitc Limited Corporation,Ms. Jelly Cai,,0086-769-38857999,13539061616,,"No. 101, Floor 1, Block A, No. 263, Xinma Road, Xinmalian, Dalang Community, Dalang Town",523000,China,Guangdong,Dongguan,,
"Dongguan Liujiang Automation Co., Ltd.",Mr. Andy Wang,Sales Manager,86-0769-85078920,8617520179232,,"Floor A, Xincheng Building.Fuhai Road,Changan town",523876,China,Guangdong,Dongguan,http://www.dianjiao.bid,https://ljzdh.en.alibaba.com
"Shijiazhuang Shentong Plastic Industry Co., Ltd.",Ms. aishu yuan,General Manager,86-0311-86125138,0086-13673113950,86-0311-86024536,"Beishilipu, Luancheng District, Shijiazhuang,",050000,China,Hebei,Shijiazhuang,http://www.ppr-pipe-fittings.com,https://stsy88.en.alibaba.com
"Suzhou Koofar Electronic Technology Co., Ltd.",Ms. lvy wu,,86-0512-68792957,,,"209, No. 3-2, Dongwu South Road, Wuzhong District",215000,China,Jiangsu,Suzhou,,
"Nanjing HangYu Mechanical and Electrical Technology Co., Ltd.",Ms. keke wang,,86-025-18061692820,18061692820,,hengxi street shiba road 139#,,China,Jiangsu,nanjing,,
"Henan Penghui Machinery And Equipment Co., Ltd.",Ms. Abby Zhang,Manager,0086-371-60214253,0086 15324840809,0086-371-60211231,"Room 1103, Building 5 Zhong Yang Yu Jing, Shangdu Road and Mouzhou Street, Zhengzhou City, Henan Province",450000,China,Henan,Zhengzhou,http://hnzhph.en.alibaba.com,https://hnzhph.en.alibaba.com
"Suzhou MSG Industrial Co., Ltd.",Mr. sales manager,Sales Director,86-512-62728987,,86-512-62728987,"No. 69, Qunxing 2nd Road, Loufeng Subarea, Industrial Park, Suzhou",215000,China,Jiangsu,Suzhou,http://www.procircle-industry.en.alibaba.com,https://procircle-industry.en.alibaba.com
"Guangdong Cincy Industry Co., Ltd.",Wilson Wu,,86,13926836884,,,,China,,,http://www.cincy.com.cn,https://cincycn.en.alibaba.com
"Xi'an Lasa Electronics Technology Co., Ltd.",Ms. nila sou,manager,86-29-81029084,18291426271,86-29-81029084,Tangyan South Road No.11th,710074,China,Shaanxi,Xian,http://www.lasaetpda.com,https://lasaetpda.en.alibaba.com
"Shenzhen Hengxing Electronics Technology Co., Ltd.",Mr. Andy Xu,Marketing manager,"86-755-25883986,28890110",18688718979,86-755-83036786,"5/F, Buliding 2, Dakan Yihua Industrial Park,Xili Street,Nanshan Distrit,Shenzhen ,China",518103,China,Guangdong,shenzhen,http://www.chinabatteries.com,https://chinabatteries.en.alibaba.com
"Ningbo Nicedo Pet Products Co., Ltd.",Ms. Shelley liu,Sales manager,86-574-87401635,13732110157,86-574-87371219,"No.88, Feng Qi Road,Yinzhou Distric,Ningbo",315000,China,Zhejiang,ningbo,http://www.nicedopet.com,https://nicedo.en.alibaba.com
"Shanghai Focus Industrial Co., Ltd.",Ms. Alisa Chen,Sales Engineer,0086-21-67765258,17765137581,,"8th Floor, Jianan Hongta Building, 246Sitong Road, Sijing Town, Songjiang District, Shanghai, China",201601,China,Shanghai,Songjiang District,http://www.focusdigi.com,https://focusgroup.en.alibaba.com
"Ningbo Getter Electronics Co., Ltd.",Mr. Gavin Long,manager,86-574-87257659,18867618867,86-574-89088402,"Beilun District Xiaogang Street Du tou Dong Industrial Zone, Chuang Fu Road No. 8 Building 2 floor D",315823,China,Zhejiang,ningbo,http://www.getter98.com,https://nbgetter.en.alibaba.com
"Dongguan Shengjia Hardware Products Co., Ltd.",Mr. Kenny Jiang,Sales Director,86-769-86186936,86-13612787085,86-769-86186926,"Tianliao Industrial Area,Shipai Town,",523330,China,Guangdong,Dongguan,http://www.hardware666.com,https://metal-sj.en.alibaba.com
"Hefei Yifan Printing And Packaging Co., Ltd.",Mr. Vic Wu,,86-0551-18066221395,18066221395,,Crossing Of Tianshui Road And Tianhe Road,231600,China,Anhui,HeFei,http://www.ahyfys.com/,https://yifanbz.en.alibaba.com
"Xiamen Tongchengjianhui Industry & Trade Co., Ltd.",Ms. Anna Z,Sales Manager,0086-0592-7020676,18106907116,0086-0592-5982214,"No.15-8 Tongming North Road, Tong' an District",361000,China,Fujian,Xiamen,https://xmtcjh.en.alibaba.com/,https://xmtcjh.en.alibaba.com
"Ningbo KV Adhesive Products Co., Ltd.",Mr. Alex Fu,Manager,86-574-56108301,8613586533781,86-574,No.88 Yansihou Yaqian Xiaogang Beilun,315821,China,Zhejiang,Ningbo,,
"Shenzhen Aidacom Cleantech Co., Ltd.",Ms. Juicy Liu,Marketing Department,86-755-88213573,008613760494535,86-755-88213572,No.3 Ji'antai Industrial Park Fuqiao District 1 Fuyong 518103 Bao'an Shenzhen China,518103,China,Guangdong,Shenzhen,http://www.aidacom.com.cn,https://aidacom.en.alibaba.com
Sichuan Machinery Imp. & Exp. Corp.,Ms. Cassie Yang,,86-028-18482179242,,,"Machinery Building, 2, Tongfuxiang, Xiyulong St.",610031,China,Sichuan,Chengdu,http://www.scmc.cn/,https://premiumdaily.en.alibaba.com
"Guangzhou Chunyimei Electronic Technology Co., Ltd.",,,,008613560450516,,,,China,,,https://chunyimei.en.alibaba.com/?spm=a2700.wholesale.cordpanyb.1.6e9257c2lN93Cn,https://chunyimei.en.alibaba.com
"Guangzhou Chengmei Beauty Product Co., Ltd.",Ms. cindy na,,886-020-13416323778,,,"Huijin Building , No. 146, Huangbian North Road",510440,China,Guangdong,Guangzhou,https://sunmibeauty.en.alibaba.com/,https://sunmibeauty.en.alibaba.com
"Jiangyin Beike Electronic Technology Co., Ltd.",Mr. weiming qian,,86-0510-86579677,8615335222577,,"Room 6333, Floor 9, 6 Xinyuan Rd., Jiangyin, Wuxi, Jiangsu, China",214400,China,Jiangsu,jiangyin,,
"Guangzhou Yinghe Electronic Instruments Co., Ltd.",Mr. Lucas Huang,sales executive,86-20-36772611,0086 13725228316,86-20-38055151,"1st to 5th Floor, NO.8 Building, Baimibu Xiushui Industrial Park, Renhe Town, Baiyun District, Guangzhou 510470, China (Near Airport)",510470,China,Guangdong,Guangzhou,http://www.yh114.cn,https://machineidea.en.alibaba.com
"Shenzhen Zhonghaisheng Technology Co., Ltd.",Mr. Jess Guo,sales,86-0755-83328812,13570414596,,"N4C338, 4th Floor, New Asia Phase II, Zhonghang Road, Huaqiang North Street, Futian Dist.",518000,China,Guangdong,shenzhen,http://www.zhschip.com,https://zhonghaisheng.en.alibaba.com
"Shenzhen Songya Industry Co., Ltd. Dongguan Branch",Mr. Alan Lee,Manager,86-0769-13794916040,13794916040,,"Yonghui Road, Yongsheng Industrial, Qishi Town, Dongguan City, China",523000,China,Guangdong,Dongguan,http://www.zeuya.com,https://zeuya-industry.en.alibaba.com
"Shenzhen 3NH Technology Co., Ltd.",Ms. Melorae Huang,Sales Manager,86-755-26508999,86-13925280965,86-755-26078633,"4/F, Building 8, Nangang Second Industry Zone, Xili, Nanshan District",518054,China,Guangdong,Shenzhen,http://www.3nhcolor.com,https://3nh.en.alibaba.com
"Hunan Qihang Technology Co., Ltd.",Mr. Allen Liu,Manager,86-0730-8137077,18173009983,,Baiyun District,510000,China,Guangdong,Guangzhou,,
"Shanghai Pumei Electronics Co., Ltd.",Mr. qiang kuang,GM,86-021-37722416,17621663827,,"Room1515,Angli Building,No.697 Guangfulin Rd.Songjiang District",201600,China,Shanghai,Shanghai,http://www.pumeimachinery.com,https://pume.en.alibaba.com
"Beijing Sincoheren Science And Technology Development Co., Ltd.",Ms. Tina Wei,General Manager,86-10-62211447,0086-18513068521,86-10-57734969,"A-4th floor, Sinotrans Plaza, 43# Xizhimenbei Street, Beijing, China",100044,China,Beijing,Beijing,http://www.sincoheren.com,https://sincoheren.en.alibaba.com
"Xiamen High Top Electronic Technology Co., Ltd.",Ms. Megan Yang,,0086-592-7305758,15396187912,,"NO.586 TONGMING RD, HULI DISTRICT, TONG'AN INDUSTRIAL ZONE, XIAMEN, CHINA",361100,China,Fujian,xiamen,http://www.xmhightop.com,https://xmhightop.en.alibaba.com
Shenzhen L-Domas Technology Ltd.,Ms. Vivi Chen,Manager,86-0755-26423625,19923302213,,"303, Zhongrun Building, Nanshan District",518052,China,Guangdong,Shenzhen,http://www.hqxdomas.com,https://domas.en.alibaba.com
"Suzhou Xiangrui Light Manufacturing Product Co., Ltd.",Mr. Mike Zhang,Manager,086-0512-65436380,13405014882,086-0512-65435377,"Taiping Industrial Park,Xiangcheng District,Suzhou",,China,Jiangsu,suzhou,,
"Shenzhen Quan & Heng Weighing Scale Co., Ltd.",Mr. Alvin Liang,Sales Manager,86-755-84571467,18138858442,86-755-84571467,"3F, Building 3, Jiuxiangling Industrial Area, Xili Town,",518055,China,Guangdong,Shenzhen,http://www.szqhhq.com,https://szqhhq.en.alibaba.com
"Guangzhou Lead Beauty Electronic Co., Ltd.",Mr. Andrew Zhong,Sales Director,86-020-66808111,13288225900,,"Room 302,Self-owned Plant B Building,Tuming Baihua Industrial Area,Wangcungan No17 District,Jiahe Street,Baiyun District,Guangzhou",510060,China,Guangdong,Guangzhou,http://lmbeautyequipment.en.alibaba.com,https://lmbeautyequipment.en.alibaba.com
"Guangzhou Sibo Electronic Technology Co., Ltd.",Ms. Amy Liu,Manager,86-20-39996683,13711335861,86-20-39996858,"196 Donghuan Road, Panyu District",511400,China,Guangdong,Guangzhou,http://www.siboelectronic.com,https://gzsibo.en.alibaba.com
"Brightwin Packaging Machinery (Shanghai) Co., Ltd.",Ms. Tina Lei,mananger,86-21-60493386,17317130369,,"RoomC,No.3building, No.628 Zhangyang Rd,Pudong District ,Shanghai ,China .",201206,China,Shanghai,Shanghai,http://brightwinpackaging.en.alibaba.com/,https://brightwinpackaging.en.alibaba.com
"Shenzhen ASL Electronic Technology Co., Ltd.",Mr. Stephen zhu,Sales manager,86-139-18845610,13918845610,,"8A, Block 2, Guimiao Garden, Nanguang Road, Nanshan District, Shenzhen",,China,Guangdong,Shezhen,,
"Shenzhen Trangjan-Tech Co., Ltd.",Ms. Betty Tang,,86-0769-82260001,13528699137,,Huangjiang Town,523767,China,Guangdong,Dongguan,http://www.trangjan.com,https://dgtrangjan.en.alibaba.com
"IDP Electronics Co., Ltd.",Ms. Mary Liu,Sales Director,+86-755-82555852,+8615019409730,+86-755-28063712,"Block H, the Sixth Industrial Park,Xi Tian, Gongming Town, Guangming District",518000,China,Guangdong,Shenzhen,http://www.szidp.com,https://szidp.en.alibaba.com
"Shenzhen Jiarunye Printing Co., Ltd.",Mr. Robin Lo,Sales Manager,86-755-28165652,86-13828815210,86-755-28028135,"2nd Floor, #26 Building, Santu Industrial Park, Fuming Industrial Area, Pinghu Street, Longgang District",518111,China,Guangdong,Shenzhen,http://www.jryprint.com,https://jryprint.en.alibaba.com
"Beijing Long Shan Brothers Commerce & Trading Co., Ltd.",,,,,,,,China,,,https://rdmould.1688.com/,https://longshanbrothers.en.alibaba.com
"Dongguan City Qianding Hardware Products Co., Ltd.",Ms. sunny liu,Manager,0086-0769-86380875,13559774901,0086-0769-86331567,"3F A Building Zongxin Science Park No.4 Beiwang Road,Hengjiao Village,Shijie Town",523290,China,Guangdong,Dongguan City,http://czj2012.en.made-in-china.com,https://qdhardware.en.alibaba.com
"Shenzhen Yunfanli Electronic Technology Co., Ltd.",,,,,,,,China,,,http://www.yfinetech.com/,https://yfinetech.en.alibaba.com
"Shenzhen Leervo Technology Co., Ltd.",Mr. Jinya Nie,,86-755-27807625,,,"1910A,Building 1,Cultural&Sports Center Business Building,Bogang Avenue,Bogang Community,Shajing Subdistrict,Baoan District",518000,China,Guangdong,Shenzhen,,
"Taicang Yuyu Plastic Products Co., Ltd.",Mr. Manjun Zhao,Manager,86-512-53412888,13902480274,86-512-53416082,"No.23 Yingchun Road,Xinhu Town ,Shuangfeng Township,Taicang District,Suzhou City,Jiangsu Province",215300,China,Jiangsu,Taicang District,http://www.tcyysj.com,https://tcyuyu.en.alibaba.com
"Shenzhen OMOBO Technology Co., Ltd.",Mr. Ray Li,manmager,86-755-33146887,18923702425,86-755-82055780,"601 No.8 district one, seaside village,Gushu street,Xixiang Baoan District",518000,China,Guangdong,Shenzhen,http://www.omobo.co,https://omobo.en.alibaba.com
"Jiangyin Yongchang Medicine Machinery Co., Ltd.",Mr. Yongchang Machine,General Manager,86-0510-86380522,86-13921247918,86-86380522,"No 28, Zhuwen Road, Zhutang Town",214415,China,Jiangsu,Jiangyin City,https://yaohuajixie.1688.com/?spm=a2615.2177701.0.0.uLHlDG,https://jiangyinyc.en.alibaba.com
Shenzhen Moko Technology Ltd.,Mr. Mike Ke,Sales,86-755-23573370,13530608634,86-755-23573370,"4F,Building2,Guanghui Technology Park,MinQing Rd,Longhua",518109,China,Guangdong,Shenzhen,http://mokosmart.com,https://mokosmart.en.alibaba.com
"Taizhou Fengye Metal Products Co., Ltd.",Ms. Letitia Zhu,sales manager,86-523-86336500,0086-18115985557,86-523-86336501,"NO.232 JiChuan East Rd, Hailing District, Taizhou City, Jiangsu Province, China.",225300,China,Jiangsu,Tiazhou,http://www.fyhandware.com,https://tzfengye.en.alibaba.com
"Shenzhen Maoye Electronics Co., Ltd.",Ms. Camily Li,Sales Manager,86-755-23602767,15902017645,86-755-23602767,"Room 3502,Block A,Building no.4,jiazhaoye city square Bantian Street,Longgang district,ShenZhen,GuangDong,China",518129,China,Guangdong,ShenZhen,http://www.more-suns.com/,https://moresuns.en.alibaba.com
"Henan Belyoo Machinery Co., Ltd.",Ms. Moly Chao,Sales Manager,0086-0371-68888352,008618137140921,,Dong Feng South Road,450000,China,Henan,Zhengzhou,http://www.belyoo.com,https://belyoo.en.alibaba.com
"Liuzhou ShuangFei Auto Electric Appliances Manufacturing Co., Ltd.",Mr. Nicholas Yao,Sales Manager,86-772-7507268,15878299152,86-772-7507278,Xinxing Industry Zone Chuangye Road,545112,China,Guangxi,Liuzhou,http://www.lzsfdq.com,https://lzsfdq.en.alibaba.com
"Guangzhou Wangdong Electronics Technology Co., Ltd.",Ms. Suzy Chen,Manager,86-020-22103540,18589292519,,"No.501, Science and Technology Park, Zhukeng Village, Panyu District, Guangzhou, China",511430,China,Guangdong,Guangzhou,http://gzwangdong.en.alibaba.com,https://gzwangdong.en.alibaba.com
"Tianjin Haoyang Commercial Co., Ltd.",Ms. Lucy Lucy,Sales,0086---13821195472,008615222871953,,Xiqing,300384,China,Tianjin,Tianjin Xiqing,http://www.amazon-hy.cn,https://cn-conveyorbelt.en.alibaba.com
"Shanghai Shenglongpan Electric Co., Ltd.",Mr. Michael Scofield,General Manager,0086-21-58010397,0086-13761847748,,"Hunan Road , Huinan district,shanghai",2013,China,Shanghai,Shanghai,http://www.shenglongpan.com,https://shenglongpan.en.alibaba.com
"Shenzhen Youhong Technology Co., Ltd.",Ms. Kathy Zhao,Sales Manager,86-755-33180892,18680390477,86-755-33180893,"Floor 1-3, Building 4, Building 6, Huafeng Technology Park, Guangtian Road, Luotian, Songgang, Bao'an",518125,China,Guangdong,Shenzhen,http://www.jointchinese.com,https://jointcorp.en.alibaba.com
"Xi'an Heaven Abundant Mine Equipment Co., Ltd.",Ms. Smile ding,manger,086-029-88894370-604,18681857863,,Num. 11 electron san road Yanta district Xi'an,710065,China,Shaanxi,Xi'an,http://www.xatyqy.com,https://xatyqy.en.alibaba.com
"Guangzhou Luke Trading Ltd., Co.",Ms. Cisha W,Manager,86-00-17601320277,8617601320277,,"Rm. 812, Jinzhong Bldg., Huanghuagang Street",510030,China,Guizhou,Yuexiu,,
"Foshan Chuang Mei Da Rubber Plastic Hardware Products Co., Ltd.",Ms. Wency zhang,Sales,86-0757-86637688-813,0086-13902857965,,"No 8 , Keyun North Road , Shi shan Technology Industrial ,shishan Town, Naihai District.",528000,China,Guangdong,Foshan,http://fscmd.en.alibaba.com,https://fscmd.en.alibaba.com
"Guangzhou Tusunny Home Products Co., Ltd.",Ms. Alice Shao,Sales Manager,0086-20-39272722,15820297415,0086-20-39272626,"NO.6 ,5 STREET,ZHENNAN ROAD,DAGANG TOWN,NANSHAN DISTRICT",511470,China,Guangdong,Guangzhou,http://www.cntusunny.com,https://gztusunny.en.alibaba.com
"Dongguan Dinglong Electrical Machinery Co., Ltd.",Mr. Albert Zhou,General Manager,86-0769-88920276,13922934549,86-0769-88920277,"90# Chenfeng road, village Chen industrial park, Humen town",523923,China,Guangdong,Dongguan,http://www.dinglongjx.com/English/,https://dgdinglong.en.alibaba.com
