company_name,contact_name,position,tel,mobile,fax,address,zip_code,country,province,city,website,ali_website
"Dongguan Kingmo Metal Products Co., Ltd.",Mr. Aaron Lee,General Manager,86-769-81259066,13631621853,,"No 5, Yinlong street, Yaole industrial district, Liaobu Town",523040,China,Guangdong,Dongguan City,http://www.dgkingmo.com,https://kingmo.en.alibaba.com
"Qingdao Meijialong Packaging Machinery Co., Ltd.",Mr. Zhao Jack,BOSS,86-0532-13964275537,13964275537,,XIAZHUANG STREET,,China,Shandong,"CHENGYANG,QINGDAO",http://www.qdmjl.com,https://qdmjl.en.alibaba.com
"Beijing Miracle Beauty Sci & Tech Co., Ltd.",Ms. Sophie Xiao,Manager,0086-10-64839101,008618911555886,,Room 508 Kehua Buisiness Tower,100101,China,Beijing,Chaoyang District,http://miraclelaser.en.alibaba.com,https://miraclelaser.en.alibaba.com
"Yijie(Fujian)Electronics Technology Co., Ltd.",Ms. Sarah Chang,,86-0593-6396288,15160583468,,No.102 Xingda Road Banzhong Industrial Area Fuan Fujian China,355000,China,Fujian,FUAN,http://www.fjyijie.com,https://yijiecn.en.alibaba.com
"Shenzhen Gobay Electronics Co., Ltd.",Ms. Haddie Tse,Sales department,86-755-88860121,13510998166,86-755-61673678,"13A21, 14F, Baoyuan Huafeng Headquarters Economic Bldg., No.288, Xixiang Road, Bao'an",518000,China,Guangdong,Shenzhen,http://www.hishell.com,https://gobay.en.alibaba.com
"Mianchi County Yishu Hair Products Co., Ltd.",Mr. Pan Deng,,00-86-13693995720,008613693995720,,huimeng road,472400,China,Henan,sanmenxia,http://hnysjf.hnrich.net/,https://yishuhair.en.alibaba.com
"Shanghai Honggang Machinery Manufacturing Co., Ltd.",Mr. Alan Liu,General Manager,86-21-13585968029,13585968029,,NO.68 Guanghua Road,201100,China,Shanghai,Shanghai,http://www.havemachine.com,https://havemachine.en.alibaba.com
"Xi'an Chance Technology Co., Ltd.",Mr. Hui Yu,Sales Manager,86-29-87368950-8814,18918100333,,"No.99 Gangwu Road,Xi'an International Trade and Logistics Park",710038,China,Shaanxi,xi'an,http://www.xianchance.com/website/,https://cxxian.en.alibaba.com
"Dongguan Qiaolian Machine Co., Ltd.",Mr. Ronie Yang,Marketing Director,86-186-80075371,8618680075371,86-769-86096885,"Xiamiao Industrial Zone, Humen Town",523700,China,Guangdong,Dongguan City,http://www.qiao-lian.com,https://qiaolian.en.alibaba.com
"Guangzhou Skalet Mechanical And Electrical Equipment Co., Ltd.",Mr. Skalet Man,,0086-020-32586856,0086-18675713669,,huangbian,510000,China,Guangdong,guangzhou,http://www.skalet.en.alibaba.com,https://skalet.en.alibaba.com
"Gaspu Gas Tech Co., Ltd.",Mr. Wu Andy,sales manager,"86-512-66610166,",8613812770303,86-512-68088636,No161 Zhongfeng Street SND Suzhou Jiangsu P.R.C,,China,Jiangsu,Suzhou,http://www.gaspusystem.com,https://gaspu.en.alibaba.com
"Shenzhen AVBAD Technology Co., Ltd.",Mr. avbad jun,Manager,861-0755-15820466668,15820466668,,Fuyong Town,518103,China,Guangdong,Shenzhen,http://www.ivtoptech.com,https://ivtopvape.en.alibaba.com
"Jiaozuo Zhoufeng Machinery Co., Ltd.",Ms. Kelly Wang,Manager,0086-391-3385528,0086-18739193590,,"Building No.2, room 2410,Xinan Road ,Jiaozuo City,Henan Province,China",,China,Henan,Jiaozuo,http://www.jzhoufeng.com,https://zfjx.en.alibaba.com
"Xinchang Weilite Textile Machinery Co., Ltd.",Ms. WLT Sales,Foreign sales manager,86-575-86120599,+86-13221509188,86-575-86120919,No.210 Taitan road,312500,China,Zhejiang,Xinchang,http://www.weilitemachinery.com/cn/index.php,https://wltmachine.en.alibaba.com
"Wuhan Hasary Equipment Co., Ltd.",Ms. Ella Zhang,General Manager,86-27-83341455,0086-18702715855,86-27-83364186,"No.319, 2nd Floor, Innovation Service Center, No.7 Jiangxing Road, Jianghan District, Wuhan, China",430023,China,Hubei,wuhan,http://www.hasary.com,https://haichangrui.en.alibaba.com
"Qingdao Coloreeze Eco-Protection Technologies Co., Ltd.",Ms. Heidy Liu,Director,0086-532-88963638,18866629256,0086-532-88963638,"1211room, Packson Building , No.44 ,Zhongshan Road, Shinan Distract ,Qingdao city ,Shandong province",266100,China,Shandong,Qingdao,http://www.coloreeze.com,https://coloreeze.en.alibaba.com
Shenzhen Yuzi Beauty Technology Company Limited,Mr. Mike lee,,0086---13539887853,0086-13539887853,,east Guang zhou road,,China,Guangdong,guangzhou,http://yuzibeauty.en.alibaba.com/,https://yuzibeauty.en.alibaba.com
"Dongguan Dadi Electronic Technology Co., Ltd.",Ms. Yan lucy,,86-0769-81108586,13713346108,86-0769-81144755,"Zone B, 3/ F, No.7 Sanjiang Industrial Area, Hengli Town",523460,China,Guangdong,Dongwan,http://www.dgdadi.com,https://dadisick.en.alibaba.com
"Shenzhen Honger Machine Equipment Co., Ltd.",Ms. HE MACHINE,General Manager,86-755-28372363,86-18600590563,86-755-28372353,"F1601-02, A4 Bldg Zhujiang Plaza,No.9009 Longxiang Blvd,Longgang,SZ,518172,CN",518172,China,Guangdong,Shenzhen City,http://www.hongerjixie.com,https://hongerchina.en.alibaba.com
Luen Cheong Printing Equipment Ltd.,Mr. Michael AO,Sales Director,86-769-85375030,13038884492,86-769-85375060,"Tinggang Village,Pengwu,Areas,Dongken,Town",523845,China,Guangdong,Dongguan city,http://www.cn-print.com,https://chinapadprinter.en.alibaba.com
"Wuhan Xinyatai Import&Export Co., Ltd.",Ms. Lily Liu,,86-027-85899666,18802718035,,Dongxuhu district Dongwu Road Xincheng14 Road,430040,China,Hubei,Wuhan,http://www.xinyatai.com,https://whxyt.en.alibaba.com
"Dongguan Feita Electronics Co., Limited",Ms. Anna Chen,Sales,0086-769-82110359,15302550426,0086-769-82110319,"Building 6#, 13th Lane, Guangchang Road, Xuzhen Community , Zhangmutou Town",523617,China,Guangdong,Dongguan,http://www.feita.ltd,https://feita-beauty.en.alibaba.com
"Dongguan Kingmo Metal Products Co., Ltd.",Mr. Aaron Lee,General Manager,86-769-81259066,13631621853,,"No 5, Yinlong street, Yaole industrial district, Liaobu Town",523040,China,Guangdong,Dongguan City,http://www.dgkingmo.com,https://kingmo.en.alibaba.com
"Qingdao Meijialong Packaging Machinery Co., Ltd.",Mr. Zhao Jack,BOSS,86-0532-13964275537,13964275537,,XIAZHUANG STREET,,China,Shandong,"CHENGYANG,QINGDAO",http://www.qdmjl.com,https://qdmjl.en.alibaba.com
"Beijing Miracle Beauty Sci & Tech Co., Ltd.",Ms. Sophie Xiao,Manager,0086-10-64839101,008618911555886,,Room 508 Kehua Buisiness Tower,100101,China,Beijing,Chaoyang District,http://miraclelaser.en.alibaba.com,https://miraclelaser.en.alibaba.com
"Yijie(Fujian)Electronics Technology Co., Ltd.",Ms. Sarah Chang,,86-0593-6396288,15160583468,,No.102 Xingda Road Banzhong Industrial Area Fuan Fujian China,355000,China,Fujian,FUAN,http://www.fjyijie.com,https://yijiecn.en.alibaba.com
"Shenzhen Gobay Electronics Co., Ltd.",Ms. Haddie Tse,Sales department,86-755-88860121,13510998166,86-755-61673678,"13A21, 14F, Baoyuan Huafeng Headquarters Economic Bldg., No.288, Xixiang Road, Bao'an",518000,China,Guangdong,Shenzhen,http://www.hishell.com,https://gobay.en.alibaba.com
"Mianchi County Yishu Hair Products Co., Ltd.",Mr. Pan Deng,,00-86-13693995720,008613693995720,,huimeng road,472400,China,Henan,sanmenxia,http://hnysjf.hnrich.net/,https://yishuhair.en.alibaba.com
"Shanghai Honggang Machinery Manufacturing Co., Ltd.",Mr. Alan Liu,General Manager,86-21-13585968029,13585968029,,NO.68 Guanghua Road,201100,China,Shanghai,Shanghai,http://www.havemachine.com,https://havemachine.en.alibaba.com
"Xi'an Chance Technology Co., Ltd.",Mr. Hui Yu,Sales Manager,86-29-87368950-8814,18918100333,,"No.99 Gangwu Road,Xi'an International Trade and Logistics Park",710038,China,Shaanxi,xi'an,http://www.xianchance.com/website/,https://cxxian.en.alibaba.com
"Dongguan Qiaolian Machine Co., Ltd.",Mr. Ronie Yang,Marketing Director,86-186-80075371,8618680075371,86-769-86096885,"Xiamiao Industrial Zone, Humen Town",523700,China,Guangdong,Dongguan City,http://www.qiao-lian.com,https://qiaolian.en.alibaba.com
"Guangzhou Skalet Mechanical And Electrical Equipment Co., Ltd.",Mr. Skalet Man,,0086-020-32586856,0086-18675713669,,huangbian,510000,China,Guangdong,guangzhou,http://www.skalet.en.alibaba.com,https://skalet.en.alibaba.com
"Gaspu Gas Tech Co., Ltd.",Mr. Wu Andy,sales manager,"86-512-66610166,",8613812770303,86-512-68088636,No161 Zhongfeng Street SND Suzhou Jiangsu P.R.C,,China,Jiangsu,Suzhou,http://www.gaspusystem.com,https://gaspu.en.alibaba.com
"Shenzhen AVBAD Technology Co., Ltd.",Mr. avbad jun,Manager,861-0755-15820466668,15820466668,,Fuyong Town,518103,China,Guangdong,Shenzhen,http://www.ivtoptech.com,https://ivtopvape.en.alibaba.com
"Jiaozuo Zhoufeng Machinery Co., Ltd.",Ms. Kelly Wang,Manager,0086-391-3385528,0086-18739193590,,"Building No.2, room 2410,Xinan Road ,Jiaozuo City,Henan Province,China",,China,Henan,Jiaozuo,http://www.jzhoufeng.com,https://zfjx.en.alibaba.com
"Xinchang Weilite Textile Machinery Co., Ltd.",Ms. WLT Sales,Foreign sales manager,86-575-86120599,+86-13221509188,86-575-86120919,No.210 Taitan road,312500,China,Zhejiang,Xinchang,http://www.weilitemachinery.com/cn/index.php,https://wltmachine.en.alibaba.com
"Changzhou Welldone Electronic Materials Co., Ltd.",Ms. guofeng yan,,0086-0519-88998927,,,"No.5,GouNan West road,HuTang Town,Wujin District",,China,Jiangsu,Changzhou City,,
"Wujiang Dinglong Medical Instrument Co., Ltd.",Mr. Wenjie Ling,,86-0512-63130468,,,Tongli,215216,China,Jiangsu,Suzhou,http://www.dinglongtattoo.com,https://dinglongtattoo.en.alibaba.com
"Zhaoqing Zhuoying Electronic Technology Co., Ltd.",,,,,,,,China,,,http://zhuoyingdianzi.com,https://zhuoyingntc.en.alibaba.com
"Guangdong Super Captain Technology Co., Ltd.",Ms. Apple Feng,Sales Manager,0086-020-37759303,008618144840277,,Xing Nan Road,,China,Guangdong,Guangzhou City Panyu District,http://www.supercaptainvr.com/,https://supercaptain.en.alibaba.com
"Huizhou DaHai Electronic Co., Ltd.",Mr. YK Guo,,86-752-15815351839,86 15815351839,,zhongkai,516229,China,Guangdong,hui zhou,http://dahai.com,https://dahaio.en.alibaba.com
"Guangzhou Merican Optoelectronic Technology Co., Ltd.",Ms. Jenny kwan-lan Li,Sales Director,86-020-36762655-8006,0086-13798059311,86-020-28819702-36088,"No38,Gaoming Road, Renhe Town,Baiyun District, Guangzhou, China",510470,China,Guangdong,Guangzhou,http://www.merican.com.cn/,https://cn-ss.en.alibaba.com
"Huizhou Weihua Technology Co., Ltd.",Ms. Julia Zeng,International sales manager,0086-0752-5319901,15018615778,,"Weihua Technology Industrial Park,NO.1 Xingjuxi Road,Dongjiang Hi-tech Park,Shuikou Town,Huicheng District",516005,China,Guangdong,huizhou,http://www.chinamark.com.cn/index.php/index/index/g/e.html,https://hzchinamark.en.alibaba.com
"Zhengzhou Canmax Machinery & Equipment Co., Ltd.",Mr. Elvis Cheng,Sales Director,0086-371-55361586,18538207955,0086-371-55361588,"98 Longhai Road, Guancheng District, Zhengzhou, Henan, China (Mainland)",450000,China,Henan,Zhengzhou,http://www.cn-canmax.com,https://cn-canmax.en.alibaba.com
"Beijing Yinhe Jinyuan Science&Technology Co., Ltd.",Mr. Edward Liu,Sales Manager,86-10-60240439,15810810559,,"3-1104, Aoyu Science Building, Jinxing Road, Daxing",102726,China,Beijing,Beijing,https://yinhejinyuan.en.alibaba.com,https://yinhejinyuan.en.alibaba.com
"Guangzhou Wangwei Metal Products Co., Ltd.",Ms. Shun GH,Director,86-20-34837050,,86-20-34837053,"No.15, Xinghuan Industrial Park, Xingqiao, Panyu, Guangzhou, China",511486,China,Guangdong,Guangzhou,,
"Jinan Ocean-Link Equipment Technology Co., Ltd.",Mr. ash wang,sales director,0086-531-69904300,0086-15098896071,0086-531-69904293,Jingshi Road,250799,China,Shandong,Jinan,http://www.oltcnc.com,https://oltcnc.en.alibaba.com
"Shenzhen Ruised Technology Co., Ltd.",Mr. Dennis Hong,,85-0755-82774332,15999696312,,"Block A 10E, Huaqiang Building, Huaqiang Road,Futian District",518031,China,Guangdong,Shezhen,http://ruised.en.alibaba.com,https://ruised.en.alibaba.com
"Nanjing Huadong Electronics Group Medical Equipment Co., Ltd.",Mr. David Huang,manger,86-25-85323239,,86-25-85309548,"NO.19 HENGTONG AVENUE ECONOMIC DEVELOPMENT ZONE,NANJING",,China,Jiangsu,nanjing,https://hdmedical.en.alibaba.com/,https://hdmedical.en.alibaba.com
"Wuxi Kenuo Environmental Protection Equipement Co., Ltd.",Mr. Henry Zh,Manager,86-0510-83569858,008615888178040,,Luoshe Town Yangshi New industry,214154,China,Jiangsu,wuxi,http://www.kenuotechnologies.com,https://jskenuo.en.alibaba.com
"Guangzhou Skalet Mechanical And Electrical Equipment Co., Ltd.",Mr. Skalet Man,,0086-020-32586856,0086-18675713669,,huangbian,510000,China,Guangdong,guangzhou,http://www.skalet.en.alibaba.com,https://skalet.en.alibaba.com
"Gaspu Gas Tech Co., Ltd.",Mr. Wu Andy,sales manager,"86-512-66610166,",8613812770303,86-512-68088636,No161 Zhongfeng Street SND Suzhou Jiangsu P.R.C,,China,Jiangsu,Suzhou,http://www.gaspusystem.com,https://gaspu.en.alibaba.com
"Shenzhen AVBAD Technology Co., Ltd.",Mr. avbad jun,Manager,861-0755-15820466668,15820466668,,Fuyong Town,518103,China,Guangdong,Shenzhen,http://www.ivtoptech.com,https://ivtopvape.en.alibaba.com
"Jiaozuo Zhoufeng Machinery Co., Ltd.",Ms. Kelly Wang,Manager,0086-391-3385528,0086-18739193590,,"Building No.2, room 2410,Xinan Road ,Jiaozuo City,Henan Province,China",,China,Henan,Jiaozuo,http://www.jzhoufeng.com,https://zfjx.en.alibaba.com
"Xinchang Weilite Textile Machinery Co., Ltd.",Ms. WLT Sales,Foreign sales manager,86-575-86120599,+86-13221509188,86-575-86120919,No.210 Taitan road,312500,China,Zhejiang,Xinchang,http://www.weilitemachinery.com/cn/index.php,https://wltmachine.en.alibaba.com
"Changzhou Welldone Electronic Materials Co., Ltd.",Ms. guofeng yan,,0086-0519-88998927,,,"No.5,GouNan West road,HuTang Town,Wujin District",,China,Jiangsu,Changzhou City,,
"Wujiang Dinglong Medical Instrument Co., Ltd.",Mr. Wenjie Ling,,86-0512-63130468,,,Tongli,215216,China,Jiangsu,Suzhou,http://www.dinglongtattoo.com,https://dinglongtattoo.en.alibaba.com
"Zhaoqing Zhuoying Electronic Technology Co., Ltd.",,,,,,,,China,,,http://zhuoyingdianzi.com,https://zhuoyingntc.en.alibaba.com
"Guangdong Super Captain Technology Co., Ltd.",Ms. Apple Feng,Sales Manager,0086-020-37759303,008618144840277,,Xing Nan Road,,China,Guangdong,Guangzhou City Panyu District,http://www.supercaptainvr.com/,https://supercaptain.en.alibaba.com
"Huizhou DaHai Electronic Co., Ltd.",Mr. YK Guo,,86-752-15815351839,86 15815351839,,zhongkai,516229,China,Guangdong,hui zhou,http://dahai.com,https://dahaio.en.alibaba.com
"Guangzhou Merican Optoelectronic Technology Co., Ltd.",Ms. Jenny kwan-lan Li,Sales Director,86-020-36762655-8006,0086-13798059311,86-020-28819702-36088,"No38,Gaoming Road, Renhe Town,Baiyun District, Guangzhou, China",510470,China,Guangdong,Guangzhou,http://www.merican.com.cn/,https://cn-ss.en.alibaba.com
"Huizhou Weihua Technology Co., Ltd.",Ms. Julia Zeng,International sales manager,0086-0752-5319901,15018615778,,"Weihua Technology Industrial Park,NO.1 Xingjuxi Road,Dongjiang Hi-tech Park,Shuikou Town,Huicheng District",516005,China,Guangdong,huizhou,http://www.chinamark.com.cn/index.php/index/index/g/e.html,https://hzchinamark.en.alibaba.com
"Zhengzhou Canmax Machinery & Equipment Co., Ltd.",Mr. Elvis Cheng,Sales Director,0086-371-55361586,18538207955,0086-371-55361588,"98 Longhai Road, Guancheng District, Zhengzhou, Henan, China (Mainland)",450000,China,Henan,Zhengzhou,http://www.cn-canmax.com,https://cn-canmax.en.alibaba.com
"Beijing Yinhe Jinyuan Science&Technology Co., Ltd.",Mr. Edward Liu,Sales Manager,86-10-60240439,15810810559,,"3-1104, Aoyu Science Building, Jinxing Road, Daxing",102726,China,Beijing,Beijing,https://yinhejinyuan.en.alibaba.com,https://yinhejinyuan.en.alibaba.com
"Guangzhou Wangwei Metal Products Co., Ltd.",Ms. Shun GH,Director,86-20-34837050,,86-20-34837053,"No.15, Xinghuan Industrial Park, Xingqiao, Panyu, Guangzhou, China",511486,China,Guangdong,Guangzhou,,
"Jinan Ocean-Link Equipment Technology Co., Ltd.",Mr. ash wang,sales director,0086-531-69904300,0086-15098896071,0086-531-69904293,Jingshi Road,250799,China,Shandong,Jinan,http://www.oltcnc.com,https://oltcnc.en.alibaba.com
"Shenzhen Ruised Technology Co., Ltd.",Mr. Dennis Hong,,85-0755-82774332,15999696312,,"Block A 10E, Huaqiang Building, Huaqiang Road,Futian District",518031,China,Guangdong,Shezhen,http://ruised.en.alibaba.com,https://ruised.en.alibaba.com
"Nanjing Huadong Electronics Group Medical Equipment Co., Ltd.",Mr. David Huang,manger,86-25-85323239,,86-25-85309548,"NO.19 HENGTONG AVENUE ECONOMIC DEVELOPMENT ZONE,NANJING",,China,Jiangsu,nanjing,https://hdmedical.en.alibaba.com/,https://hdmedical.en.alibaba.com
"Wuxi Kenuo Environmental Protection Equipement Co., Ltd.",Mr. Henry Zh,Manager,86-0510-83569858,008615888178040,,Luoshe Town Yangshi New industry,214154,China,Jiangsu,wuxi,http://www.kenuotechnologies.com,https://jskenuo.en.alibaba.com
"Shenzhen Haixuanwei Packing Co., Ltd.",Mr. John Zhang,Manager,86-755-89936304,13712173974,86-755-89939147,"Rm 501,No.405 Jinbi Road, Biling Community,Pingshan New District",518118,China,Guangdong,Shenzhen,http://www.hxwpack.com/,https://hxwpacking.en.alibaba.com
"Shenzhen Zeuya Industry Co., Ltd.",Mr. Alan Lee,,86-0769-13794916040,,,"Yongsheng Industrial Park, Qishi Town, Dongguan City, China.",,China,Guangdong,Dongguan,http://www.zeuya.com,https://zeuya2.en.alibaba.com
"Zhenfu Knitting Machine Co., Ltd. Shishi",Ms. lynn zheng,,86-595-83955566,0086-13959873022,86-595-88505988,"Zhenfu Building , Beihuan Xinxing road,shishi city, Fujian, China",362700,China,Fujian,Shishi,http://www.china-hanma.com,https://hanma.en.alibaba.com
"Chongqing Longyin Sealing Technology Co., Ltd.",Mr. Jun Zhao,,0086-023-65656454,008615923236922,,Xinkai Temple Residency in Geleshan Town,,China,Chongqing,"Shapingba District, Chongqing",,
"Guangzhou Wandai Technology Co., Ltd.",Gong Christy,,,,,,,China,,,http://www.babycareu.com,https://gamemachinewd.en.alibaba.com
"Wenzhou Jim Electronic Technology Co., Ltd.",,,,,,,,China,,,http://wzjim.en.alibaba.com,https://wzjim.en.alibaba.com
"Nanchang Huatuo Industrial Co., Ltd.",Ms. Crystal Xia,sales manager,86-0791-15179138751,15179138751,,Qing Shanhu Street,330000,China,Jiangxi,nanchang,http://www.nchuatuo.com.cn,https://huatuo.en.alibaba.com
"Cixi Dayi Village Electronic Technology Co., Ltd.",,,,,,,,China,,,,
"Shenzhen Minghui Electronics Co., Ltd.",Ms. Linda wang,business manager,86-0755-8764280,13066947364,,sanweixixiang,518000,China,Guangxi,shenzhen,http://i.spm=a2700.7724838.scGlobalHomeHeader.342.435936bcAGdpVa&tracelog=hd_ma,https://i11tws.en.alibaba.com
"Dongguan Yuanfeng Adult Products Industry Co., Ltd.",Ms. xiuzhen wang,Boss,86-0769-87985683,13929401499,86-0769-87985683,"Room 101, Building 3, No. 7, Jianye 2nd Road, Tangxia town",523717,China,Guangdong,Dongguan,http://www.ds69sex.com,https://lovedoll.en.alibaba.com
"Chongqing Cardweb Electronics Co., Ltd.",Ms. Amy Zhao,,0086-023-86629600,13452001578,0086-023-86629119,"NO.60, Kecheng Road,",400000,China,Chongqing,Chongqing,http://cqaccess.com,https://cardweb.en.alibaba.com
Shenzhen Selection Hardware-Tech Limited,Ms. Alice Yan,CEO,0086-0755-83727350,13530024325,,Gongming,,China,Guangdong,Shenzhen,http://www.selectionsz.com,https://selection.en.alibaba.com
"Shenzhen Juste Technology Co., Ltd.",Mr. Alan Cao,Sales Manager,86-0755-36950265,8618688921191,,"YueHua Industrial Park , YanChuan,SongGang",518109,China,Guangdong,ShenZhen,http://juste.en.alibaba.com,https://juste.en.alibaba.com
"Linyi Yilibao Household Products Co., Ltd.",Ms. Andy Li,General manager,00-86-13791552506,13791552506,00-86-13791552506,Lanshan District,276000,China,Shandong,LinYi,http://sdyilibao.en.alibaba.com,https://sdyilibao.en.alibaba.com
"Hanway Metal Products Co., Ltd. (FS)",Ms. Jane Zhang,manager,"86-20-83826468,83826498",13924109788,86-20-83826658,"6 Malian Rd,Ganglian Industry Zone Lishui Town, Nanhai District",528244,China,Guangdong,Foshan city,http://www.hanway.com.cn,https://hanway.en.alibaba.com
Shenzhen Topbest Industrial Limited,Mr. Henry Zhao,Sales manager,86-0755 -81440558,86 13600401089,86-0755 -27308327,"18# Lingbei 5th Road,The first industrial park,Fenghuang,Fuyong Street,Bao'an District ,Shenzhen 518103, China",518103,China,Guangdong,Shenzhen,http://www.smtsite.com,https://chinatopbest.en.alibaba.com
"Hengshui Yatai Especial Rubber Products Co., Ltd.",Ms. Amy Cui,manager,86-0318-2850118,15603181870,86-0318-2850118,"NO.888 Qingliangdian IZ,Hengshui City,China",053411,China,Hebei,hengshui,http://www.chnhose.com,https://cnrubberhose.en.alibaba.com
Shenzhen BFQ Hi-Tech Electronics Ltd.,Mr. Jacky Wu,Sales Manager,86-755-83316888,18927485838,,"Rm. 5112, East Of Floor 5, Bldg. C, Shenfang Mansion, Zhenhua Road, Huaqiang North St., Futian Dist.,",518031,China,Guangdong,Shenzhen,https://bfq-electronics.en.alibaba.com,https://bfq-electronics.en.alibaba.com
"Zhenfu Knitting Machine Co., Ltd. Shishi",Ms. lynn zheng,,86-595-83955566,0086-13959873022,86-595-88505988,"Zhenfu Building , Beihuan Xinxing road,shishi city, Fujian, China",362700,China,Fujian,Shishi,http://www.china-hanma.com,https://hanma.en.alibaba.com
"Chongqing Longyin Sealing Technology Co., Ltd.",Mr. Jun Zhao,,0086-023-65656454,008615923236922,,Xinkai Temple Residency in Geleshan Town,,China,Chongqing,"Shapingba District, Chongqing",,
"Guangzhou Wandai Technology Co., Ltd.",Gong Christy,,,,,,,China,,,http://www.babycareu.com,https://gamemachinewd.en.alibaba.com
"Wenzhou Jim Electronic Technology Co., Ltd.",,,,,,,,China,,,http://wzjim.en.alibaba.com,https://wzjim.en.alibaba.com
"Nanchang Huatuo Industrial Co., Ltd.",Ms. Crystal Xia,sales manager,86-0791-15179138751,15179138751,,Qing Shanhu Street,330000,China,Jiangxi,nanchang,http://www.nchuatuo.com.cn,https://huatuo.en.alibaba.com
"Cixi Dayi Village Electronic Technology Co., Ltd.",,,,,,,,China,,,,
"Shenzhen Minghui Electronics Co., Ltd.",Ms. Linda wang,business manager,86-0755-8764280,13066947364,,sanweixixiang,518000,China,Guangxi,shenzhen,http://i.spm=a2700.7724838.scGlobalHomeHeader.342.435936bcAGdpVa&tracelog=hd_ma,https://i11tws.en.alibaba.com
"Dongguan Yuanfeng Adult Products Industry Co., Ltd.",Ms. xiuzhen wang,Boss,86-0769-87985683,13929401499,86-0769-87985683,"Room 101, Building 3, No. 7, Jianye 2nd Road, Tangxia town",523717,China,Guangdong,Dongguan,http://www.ds69sex.com,https://lovedoll.en.alibaba.com
"Chongqing Cardweb Electronics Co., Ltd.",Ms. Amy Zhao,,0086-023-86629600,13452001578,0086-023-86629119,"NO.60, Kecheng Road,",400000,China,Chongqing,Chongqing,http://cqaccess.com,https://cardweb.en.alibaba.com
Shenzhen Selection Hardware-Tech Limited,Ms. Alice Yan,CEO,0086-0755-83727350,13530024325,,Gongming,,China,Guangdong,Shenzhen,http://www.selectionsz.com,https://selection.en.alibaba.com
"Shenzhen Juste Technology Co., Ltd.",Mr. Alan Cao,Sales Manager,86-0755-36950265,8618688921191,,"YueHua Industrial Park , YanChuan,SongGang",518109,China,Guangdong,ShenZhen,http://juste.en.alibaba.com,https://juste.en.alibaba.com
"Linyi Yilibao Household Products Co., Ltd.",Ms. Andy Li,General manager,00-86-13791552506,13791552506,00-86-13791552506,Lanshan District,276000,China,Shandong,LinYi,http://sdyilibao.en.alibaba.com,https://sdyilibao.en.alibaba.com
"Hanway Metal Products Co., Ltd. (FS)",Ms. Jane Zhang,manager,"86-20-83826468,83826498",13924109788,86-20-83826658,"6 Malian Rd,Ganglian Industry Zone Lishui Town, Nanhai District",528244,China,Guangdong,Foshan city,http://www.hanway.com.cn,https://hanway.en.alibaba.com
Shenzhen Topbest Industrial Limited,Mr. Henry Zhao,Sales manager,86-0755 -81440558,86 13600401089,86-0755 -27308327,"18# Lingbei 5th Road,The first industrial park,Fenghuang,Fuyong Street,Bao'an District ,Shenzhen 518103, China",518103,China,Guangdong,Shenzhen,http://www.smtsite.com,https://chinatopbest.en.alibaba.com
"Hengshui Yatai Especial Rubber Products Co., Ltd.",Ms. Amy Cui,manager,86-0318-2850118,15603181870,86-0318-2850118,"NO.888 Qingliangdian IZ,Hengshui City,China",053411,China,Hebei,hengshui,http://www.chnhose.com,https://cnrubberhose.en.alibaba.com
Shenzhen BFQ Hi-Tech Electronics Ltd.,Mr. Jacky Wu,Sales Manager,86-755-83316888,18927485838,,"Rm. 5112, East Of Floor 5, Bldg. C, Shenfang Mansion, Zhenhua Road, Huaqiang North St., Futian Dist.,",518031,China,Guangdong,Shenzhen,https://bfq-electronics.en.alibaba.com,https://bfq-electronics.en.alibaba.com
"Boyee (Shenzhen) Industrial Technology Co., Ltd.",Ms. Connie Liu,trade manager,86-0755-81766074,008613825244855,86-0755-81766082,"Building 7, Xiaweishui Industrial Zone, Hongqiaotou Community, Yanluo Subdistrict, Bao'an District",518105,China,Guangdong,Shenzhen,http://www.byjxw.com,https://byjxw.en.alibaba.com
"Dalian Ruici Industry Co., Ltd.",Mr. Joe guan,Manager,86-411-84519689,86-13998677701,86-411-84519689,"Rm1413,No.28 Baishan Road,Shahekou District",116021,China,Liaoning,Dalian,http://www.ruiciindustry.com,https://ruiciindustry.en.alibaba.com
Hengshui Qinghe Import And Export Trade Co. Ltd,Mr. Yupin Ding,General Manager,86-318-8919281,,,Jizhou,,China,Hebei,Hengshui,,
"Guangzhou Situote Electronic Technology Co., Ltd.",Mr. Winson Li,manager,86-20-34248297,0086-13719233077,86-20-31032326,Xi Di Er malu Liwan District.,510130,China,Guangdong,Guangzhou,http://www.site68.com.cn,https://mysite.en.alibaba.com
"Guangzhou Fude Electronic Technology Co., Ltd.",Ms. Angel Zhang,GM,86-020-13682207662,008615220000680,86-020-36907671,"198 Forde Electronic Technology Co., Ltd., South of Sandeast Avenue, Huadu District",510800,China,Guangdong,guangzhou,http://www.ftmotor.com.cn/EN/Index.html,https://gzfude.en.alibaba.com
"Shenzhen Xuhongxiang Electronic Co., Ltd.",Ms. Yori Yang,WhatsAPP / Skype:+8613527309428,0086-518105-13527309428,8613527309428,0086-0755-27797610,"2nd floor, building B, guangxing industrial park, no. 18 jingshan road, songgang town, yanluo street, baoan district",518105,China,Guangdong,SHENZHEN,http://szxuhongxiangdz.cn,https://szxuhongxiang.en.alibaba.com
"Dongguan Wen Jie Electronics Technology Co., Ltd.",Ms. Amy Sue,,86-769-13662755214,13662755214,,"No.210 Zhenan West Road, Shangjiao, Changan",523878,China,Guangdong,Dongguan,http://dgmirage.en.alibaba.com,https://dgmirage.en.alibaba.com
