company_name,contact_name,position,tel,mobile,fax,address,zip_code,country,province,city,website,ali_website
"Xi'an Reliable Bio-Engineering Co., Ltd.",Ms. Alice Xie,,86-029-15229321728,15229321728,,high technology zone,,China,,Xi'an,http://www.xianreliablebio.com,http://xianreliablebio.en.alibaba.com/contactinfo.html
"Wenzhou Scico Medical Corporation Co., Ltd.",Ms. Lily Ye,,0086-577-64706888,008618968923800,,"No.11 bldg,Shuguang Industrial Park Phase 2,Shiji rd,Longgang,Cangnan",325802,China,Zhejiang,Wenzhou,http://www.scico.cn,http://scico.en.alibaba.com/contactinfo.html
"Hangzhou Yeastar Biotech Co., Ltd.",Mr. Luby Chen,Sales Manager,0086-571-28289777,18626882551,0086-571-56287782,"624, Bldg Leo, Singapore and Hangzhou Sicence Park",310018,China,Zhejiang,Hangzhou,http://hz-focus.com,http://hzyeastar.en.alibaba.com/contactinfo.html
"Shaanxi Phoenix Tree Biotech Co., Ltd.",Ms. Galya Deng,International Department Manager,86-029-68963828,18802959339,,"No. 11, Tangyan South Road, Zhangba Subdistrict, High-Tech Zone",710065,China,Shaanxi,Xi'an,,http://phoenixtreebiotech.en.alibaba.com/contactinfo.html
"Heze Remed Polymer Material Co., Ltd.",Ms. Bonnie Zhao,General Manager,86-530-5902818,008613583002124,,"No.7777 Zhonghua Road,Mudan District",274000,China,Shandong,Heze City,http://www.remed.en.alibaba.com,http://remed.en.alibaba.com/contactinfo.html
"Shanghai Stiscen Biotech Co., Ltd.",Mr. Jason Chen,,86-021-18605126349,18605126349,,Songjiang dst,,China,Shanghai,Shanghai,,http://cn1529220047poum.en.alibaba.com/contactinfo.html
"Xi'an Keolie Biotech Co., Ltd.",Mr. Tony zhang,Manager,86-29-63064438,+8618700976396,,No.11 Tangyan south Road High tech zone,710065,China,Shaanxi,xi'an,http://www.keolie.com,http://keolie.en.alibaba.com/contactinfo.html
"Shenzhen YKD Technology Co., Ltd.",Mr. Alex Nie,,86-0755-61186229,0086 13028882929,,"longhua ,dalang",518109,China,Guangdong,shenzhen,http://www.ykdmed.com/,http://ykdmed.en.alibaba.com/contactinfo.html
"Wuhan W&Z Biotech Co., Ltd.",Ms. Mia Wu,,86-27-87250747,13317165342,,Zhongnan Road,430000,China,Hubei,wuhan,,http://wzbiotechnology.en.alibaba.com/contactinfo.html
"Jiaxing Renze Import & Export Co., Ltd",Mr. Albert Yang,Sales Manager,86-573-83915769,008618667320677,86-573-83915769,"Room 631 Building A The landmark, jiaxing",314031,China,Zhejiang,jiaxing,http://www.food-navigator.cn,http://jxrenze.en.alibaba.com/contactinfo.html
"Carestone Medical & Protective Products Co., Ltd.",Mr. ROBERT YAN,,86-556-5290168,,,306 YINGBIN ROAD,,China,Anhui,ANQING,,http://ahcarestone.en.alibaba.com/contactinfo.html
"Xinxiang Hexie Animal Pharmaceutical Co., Ltd.",Ms. April Wong,Manager,86-373-4090265,86-13523526587,,"Jicheng 3rd Village,Sunxing town",453131,China,Henan,Xinxiang,http://www.hexiepharmacy.com,http://hexiepharmacy.en.alibaba.com/contactinfo.html
"Hefei GSK Trade Co., Ltd.",Mr. Miss Li,,86-551-61728335,18095651518,,3105 building 4 Golden SycamoreShengli Road YaoHai district,,China,Anhui,HEFEI,http://www.gsk-china.cn,http://gskchina.en.alibaba.com/contactinfo.html
"Shenzhen Pray-med Technology Co.,LTD",Mr. Evan Lee,sales engineer,86-0755-23247478,8618948200444,86-23247478,"308,Building 4,NO.8 LanZhu East Road,Big Industrial Zone, Pingshan District,",518000,China,Guangdong,shenzhen,http://www.pray-med.com/,http://praymed.en.alibaba.com/contactinfo.html
"Jiangxi Bolai Pharmacy Co., Ltd.",Mr. bolai group,sales manager,0086-0792-8193501,13501718564,,jiujiang county shacheng industry park,332000,China,Jiangxi,jiujiang,,http://jjbldyc.en.alibaba.com/contactinfo.html
"Shanghai Mekon Medical Devices Co., Ltd.",Mr. Jack Qu,Business manager,86-021-39557965,13916581865,86-021-39555265,"526 No. 697-3 Lingshi Road Shanghai,China",200072,China,Shanghai,Shanghai,http://mekonneedle.en.alibaba.com/,http://mekonneedle.en.alibaba.com/contactinfo.html
"Guangzhou Longfine Biotechnology Co., Limited",Mr. Taylor Wong,Sales Manager,86-20-29848075,18819360577,86-20-29848035,"Block E, No.346, Panyu Avenue North, Nancun Town, Panyu District, Guangzhou",511442,China,Guangdong,Guangzhou,http://www.longfinebio.com,http://longfinebio.en.alibaba.com/contactinfo.html
"Xi An Sost Biotech Co., Ltd.",Ms. Sost Biotech,Sales Manager,86-29-89381749,86-13165723260,86-29-68853028,"Building B2,Jinye Century Business Center, Jinye Road",710075,China,Shaanxi,Xi'an,http://www.sostherb.com,http://sost.en.alibaba.com/contactinfo.html
"Guangzhou Becon Bio Technology Co., Ltd.",Candy Tong,,86-020-62991738,13794425650,,,,China,,,http://www.gzbecon.com.cn,http://gzbeconbio.en.alibaba.com/contactinfo.html
"Hebei Kexing Pharmaceutical Co., Ltd.",Mr. kenneth Yang,Manager,86-311-80677112,0086-18618225717,86-311-80677113,NO.114 high and new technology industrial development zone luquan hebei,050200,China,Hebei,shijiazhuang,http://www.kexingpharma.com,http://kexingyaoye.en.alibaba.com/contactinfo.html
"Wuhan Golden Wing Industry & Trade Co., Ltd.",Ms. Susan Liu,Sales Manager,86-27-82611835,,,"Room 1101, Building 2-2, Dajiang Yuan (North Garden), Jiangda Road",430015,China,,Wuhan,http://www.golden-wing.com.cn,http://goldenwing.en.alibaba.com/contactinfo.html
"Henan Joysjoin Industrial Co., Ltd.",Ms. Judy Ren,,86-0371-53378337,,,zhengbian road,450000,China,Henan,Zhengzhou,,http://joysjoin.en.alibaba.com/contactinfo.html
"Chengdu Healthlife Biotechnology Co., Ltd.",Mr. Eric Pu,Sales Manager,0086-21-69008178,13923605068,,"7-10Floor,Area B,Building 4,No.200,Tianfu Fifth Street,Gaoxing District,Chengdu",610200,China,Sichuan,Chengdu,http://www.find-nutra.com,http://cdtn.en.alibaba.com/contactinfo.html
"Xi'an ZB Biotech Co., Ltd.",Ms. Jessica H.,Sales manager,86-029-86333380,17749038393,,duhui,710065,China,Shaanxi,Xi'an,http://www.xazbbio.com,http://xazbbio.en.alibaba.com/contactinfo.html
"Ruzhou Wonderful Medical Instruments Co., Ltd.",Charles Qi,,86-375-6727256,13569573176,86-375-6727226,,,China,,,http://www.wdfmed.com,http://cn1520635477ymfj.en.alibaba.com/contactinfo.html
"Hebei Weierli Animal Pharmaceutical Group Co., Ltd.",Ms. Renee Liu,Sales manager,0086-311-89265710,008615511607217,,380# ZhongHua Road,050000,China,Hebei,Shijiazhuang,http://www.victorypharm.com,http://victorypharm.en.alibaba.com/contactinfo.html
"Huaian Ruanke Trade Co., Ltd.",Ms. kiki zhang,manager,86-0311-88891611,,,qinghe district,223001,China,Jiangsu,huaian,http://ruanke.en.alibaba.com,http://ruanke.en.alibaba.com/contactinfo.html
Wuxi Ek Colorlife Healthcare Company Limited,Ms. kelly wang,General Manager,86-0510-85298529,15861420370,86-0510-85298529,Tianshan Road,214028,China,Jiangsu,Wuxi,http://www.ekcolorlife.com,http://ekcolorlife.en.alibaba.com/contactinfo.html
"Xi'an Harmonious Natural Bio-Technology Co., Ltd.",Ms. Vicky Liu,Sales Director,0086-29-86712509,18792884656,86-86712509,"Tai He RD., Hui Lin Hua Cheng No 10, 2104",710032,China,Shaanxi,Xi'an,http://www.xahnb.com,http://xahnb01.en.alibaba.com/contactinfo.html
"Shaanxi Hizer Biotech Co., Ltd.",Ms. Sandy Chao,Sales Manager,86-177-82892653,,,"Zhongchuang Square,385Middle Space Road,National Civil Aerospace Industrial Base",,China,Shaanxi,Xi'an City,http://hizer.en.alibaba.com,http://hizer.en.alibaba.com/contactinfo.html
"Cangzhou Shengfeng Plastic Product Co., Ltd.",Mr. Ron Liu,Manager,0086-0317-4916818,0086 15531706718,,Jinding,061001,China,Hebei,Cangzhou,http://www.shengfengpack.com,http://chinasfsj.en.alibaba.com/contactinfo.html
"Weifang Taurus Trade Co., Ltd.",FRANK CAO,,,,,,,China,,,http://www.weifangtaurus.com,http://weifangtaurus.en.alibaba.com/contactinfo.html
"Hefei Joye Import & Export Co., Ltd.",Ms. Mia Yang,Manager,86-551-65573716,86-15256900602,86-551-65865820,"xihuan plaza, huangshan road",230031,China,Anhui,hefei,http://www.ahjoye.cn,http://ahjoye.en.alibaba.com/contactinfo.html
"Jiangsu Allwell Medical Products Co., Ltd.",Mr. Yajun Tang,Manager,"86-523-89598066, 89659166",,86-523-86896939,"C22-10, Hengjing Int'l Garden, Hailing Dist",225300,China,Jiangsu,Taizhou,http://www.allwellmed.com,http://allwellmedical.en.alibaba.com/contactinfo.html
"Yurui (Shanghai) Chemical Co., Ltd.",Ms. Mary Chen,Sales Manager,0086-21-50790053,0086 13917993008,86-21-60853441,"Floor 5, Building H2, No.3188 Xiupu Rd, Pudong",201315,China,Shanghai,Shanghai,http://www.riyngroup.com,http://riyn.en.alibaba.com/contactinfo.html
"Anhui CFG Chemical Co., Ltd.",Ms. Andrea Guo,Marketing Manager,86-551-63693291,13739295979,,"No.265,intersection of Guang Xi Road and Wan Quan Road, Binhu District, Hefei City",230601,China,Anhui,Hefei,http://www.chinafoodpharm.com,http://chinafoodpharm.en.alibaba.com/contactinfo.html
"Shenzhen Taijia Electronics Co., Ltd.",Ms. Judy Du,Sales manager,86-755-81795737,13538189967,86-755-81795638,"5th FL,Bldg 20,5 Zone Baiwangxin Industrial Songbai Rd,Nanshan Shenzhen,Guangdong 518055 China",518055,China,Guangdong,Shenzhen,http://www.taijia.com/en/,http://taijia-medical.en.alibaba.com/contactinfo.html
"Xi'an Bpanda Biological Technology Co., Ltd.",Ms. Talia Li,,86-29-81315970,,,Weiyang strict,710016,China,Shaanxi,Xian,http://www.bpandabio.com,http://bpanda.en.alibaba.com/contactinfo.html
"Nohe (Wuhan) Import and Export Co.,Ltd.",Mr. Nohe xia,,86-027-88865060,18071525127,86-88865060,zhongnan,430000,China,Hubei,wuhan,http://whnohe.alibaba.com,http://nohe.en.alibaba.com/contactinfo.html
"Shenzhen Emslife Technology Co., Ltd.",Ms. Oudaisi Wang,Manager,86-755-27374826,15914020048,,"Fuyong town,Xintang road,Bailichun building,1101",518103,China,Guangdong,Shenzhen,http://www.emslife.cn,http://emslife.en.alibaba.com/contactinfo.html
"Guangzhou Pengquanhua Biotechnology Co., Ltd.",,,,,,,,China,,,,http://pengquanhua.en.alibaba.com/contactinfo.html
Guangzhou Medcan Pharmatech Ltd.,Mr. Ray Zhang,,86-20-61302895,13512779067,,"Building J1,Jiantashan Rd,GuangZhou Science City",,China,Guangdong,GuangZhou,http://www.gzmedcan.com,http://medcan.en.alibaba.com/contactinfo.html
"Jiangsu Senweer Group Co., Ltd.",Mr. Jungo Woo,Sales Manager,0086-25-86228086,18652073336,0086-25-86225810,"Rm401, 158 Lushan Road, #2 Jiaye International Town",210019,China,Jiangsu,Nanjing,http://www.senbor.com,http://senbor-intl.en.alibaba.com/contactinfo.html
"Weifang Kangdate Medicine Industry Co., Ltd.",Mr. Scott Ding,,86-536-3801098,15063056381,86-536-3801123,"No.1298 Yineng Street, Qingzhou Economic Development Zone",262500,China,Shandong,Qingzhou City,http://www.kdtyy.com,http://kangdt.en.alibaba.com/contactinfo.html
"Wuhan Ruisiqi Biotechnology Co., Ltd.",Mr. Mr Tom,,027-8466-4886,,,hanyang,430000,China,,wuhan,,http://whrsq.en.alibaba.com/contactinfo.html
"Hangzhou Gspmed Medical Appliances Co., Ltd.",Mr. Yedone Ye,,86-0571-63223510,18072950229,,"ROOM 910,9TH Floor Zhuoxin Building.NO.3820 of Nanhuan Road.Binjiang District",310051,China,Zhejiang,HANGZHOU,http://www.gspmed.com,http://gspmed1.en.alibaba.com/contactinfo.html
"Xi'an Harmonious Natural Bio-Technology Co., Ltd.",Mr. Gary Lau,Sales Manager,86-029-86712509,86-15202961574,86-029-86712509,"No.8 Gang Wu Avenue, International Logistics Park, Xi'an,China",710000,China,Shaanxi,Xi'an,http://www.xahnb.com,http://xahnb.en.alibaba.com/contactinfo.html
"Miraclean Technology Co., Ltd.",Ms. Miraclean Technology,Export Sales Manager,86-755-89616773,,86-755-89616775,"No.18, Rongshuxia Industrial Zone, Tongle Community, Longgang District, Shenzhen, China",518116,China,Guangdong,Shenzhen,http://www.mrctek.com,http://mrctek.en.alibaba.com/contactinfo.html
"Xi'an Jmlai Bio-Tech Co., Ltd.",Ms. Kathy Lee,,0086-133-25489179,13325489179,,Baqiao Street,710038,China,Shaanxi,Xi'an,http://www.biojmlai.en.alibaba.com,http://biojmlai.en.alibaba.com/contactinfo.html
"Henan Rhonda Imp.& Exp. Trading Co., Ltd.",Ms. Kitty Kang,CEO,0086-0371-60305100,86-13523043735,0086-0371-60306600,"Rm.1501,Unit 2 ,No.27Building,Shangwu neihuan Road, Zhengdong District,ZhengZhou,China",450018,China,Henan,ZhengZhou,http://rhonda.en.alibaba.com,http://rhonda.en.alibaba.com/contactinfo.html
"Weihai Yingmu Medical Materials Co., Ltd.",,,,,,,,China,,,http://whyingmu.com/,http://whyingmu.en.alibaba.com/contactinfo.html
"Xi'an Tian Guangyuan Biotech Co., Ltd.",Ms. Rebecca Lee,Manager,86-029-86333380,,,"I-City unit 3, South of Tangyan Road, Hi-Tech Industrial Zone, Xi'an City, Shaanxi Province, China",,China,Shaanxi,Xi'an,http://www.tgybio.com,http://tgybio6.en.alibaba.com/contactinfo.html
"Ningbo Newcare Import & Export Co., Ltd.",Mr. David Chen,Sales manager,86-574-87716339,,86-574-87717339,"ROOM 1605,AUX CENTRAL BUILDING, NO. 757, RILI MIDDLE ROAD, YINZHOU, NINGBO, CHINA",315100,China,Zhejiang,Ningbo,http://www.elasticbandage.com,http://elasticbandage.en.alibaba.com/contactinfo.html
"Hebei Chisure Biotechnology Co., Ltd.",Ms. lisa lee,sales,86-0311-66567340,8613292893190,,"No. 66, Yuhua West Road, Qiaoxi District, Shijiazhuang, Hebei, China (Mainland)",050000,China,Hebei,shijiazhuang,http://www.SpeedGainpharma.com,http://speedgain.en.alibaba.com/contactinfo.html
Afine Chemicals Limited,Ms. Lanny Cao,Manager,0086-571-85134551,,0086-571-85134895,"No.206 Zhen Hua Road, Sandun",310014,China,Zhejiang,Hangzhou,http://www.afinechem.com,http://afinechem.en.alibaba.com/contactinfo.html
"Shenzhen Amydi-Med Electronics Tech Co., Ltd.",Ms. Susie zhong,,0086-0755-23422883,13510859466,0086-0755-23408663,"3F,3 Building ,Hongfa Hi-Tech Park ,Genyu Rd,TianLiao ,Gongming, Guangming New district ,Shenzhen ,China",518132,China,Guangdong,shenzhen,http://www.amydi-med.com,http://amydi-med.en.alibaba.com/contactinfo.html
"Shandong Unovet Pharmaceutical Co., Ltd.",Ms. Stefanie Wei,CEO,0086-533-18560382227,008618560382227,0086-533-6122933,"NO.17,Changsheng Road ,Zhangdian District,Zibo Ctiy",255064,China,Shandong,ZIBO,http://www.cnunovet.com,http://unovet.en.alibaba.com/contactinfo.html
"Shenyang Comeboard Technology Co., Ltd.",Ms. Barbara Sun,,86-024-83650536,,,"1308, block A1, CITIC Pacific Plaza, No. 11, tawan street, Huanggu District",110036,China,Liaoning,Shenyang,https://giantdid.com/,http://zhengjinde.en.alibaba.com/contactinfo.html
"Qingdao Xinte Packaging Co., Ltd.",Mr. jack song,,86-532-15376879982,15376879982,,changjiang middle road,266520,China,Shandong,qingdao,http://www.xtpackaging.com,http://xintepack.en.alibaba.com/contactinfo.html
"Xi'an Lyphar Biotech Co., Ltd.",Ms. Cathy Ju,Sales Manager,0086-29-89198311,18629295218,0086-29-88891941,"No. 11, South of Tangyan Road, Hi-Tech Industrial Zone",710075,China,Shaanxi,Xian,http://www.lyphar.com,http://lyphar02.en.alibaba.com/contactinfo.html
"Shaanxi Bloom Tech Co., Ltd.",Mr. Alex Vivi,CEO,0086-029-17791833715,17791833715,,"Hanlinxinyuan 22603,Wuyi road No.65,West ring street,Lianhu distract,Xi'an,Shaanxi province,China",710003,China,Shaanxi,Xi'an,http://www.bloomtechz.com,http://bloomtechz.en.alibaba.com/contactinfo.html
"Shenzhen Best Electronics Co., Ltd.",Ms. Tina Deng,Sales Manager,86-0755-27192975,86-13510606572,86-0755-27192975,6F No 29Tiansheng Road Tianliao Village Gongming Town Guangming New District,518132,China,Guangdong,shenzhen,http://www.bestspo2.com,http://bestspo2.en.alibaba.com/contactinfo.html
"Xi'an Archangle Biotech Co., Ltd.",Ms. Karen Lee,Marketing Coordinator,0086-029-13572593543,0086 13572593543,,"Room 30401, Building 3, No. 39, Wannian Road, Xincheng Dist.",710032,China,Shaanxi,Xi'an,,http://archanglebiotech.en.alibaba.com/contactinfo.html
"MK (Wuhan) Biotechnology Co., Ltd.",Ms. Sherley L,sales manager,86-027-50247191,17612744474,,"1801,Block B, Wanli Plaza,Friendship Avenue, WuChang District, WuHan,China",,China,Hubei,wuhan,http://mkbio.en.alibaba.com,http://mkbio.en.alibaba.com/contactinfo.html
"Hunan Beyond Medical Technology Co., Ltd.",Mr. Beyond Medical,Business manager,86-731-82564299,17375745136,86-731,"High Tech Park, Hanpu Town, Yuelu District",410208,China,Hunan,Changsha,http://www.csbeyond.com,http://csbeyond.en.alibaba.com/contactinfo.html
"Xi'an Henrikang Biotech Co., Ltd.",Ms. Zora Feng,,0086-029-68627679,18691801918,,"Tower C Haijing International , E&T Developing Zone",710016,China,Shaanxi,Xi'an,http://www.henrikang.com,http://henrikang1.en.alibaba.com/contactinfo.html
"Zhengzhou Spirit Import And Export Co., Ltd.",Ms. Sarah Lee,,0086-0371-15617691037,,,Dianchang Road,45000,China,Henan,zhengzhou,,http://zzspirit.en.alibaba.com/contactinfo.html
"Tianjin Grand Paper Industry Co., Ltd.",Ms. Wei Wei,Director,86-22-26952719,13022299257,86-22-26954798,"Hongguang Farm, Beichen District,",300401,China,Tianjin,Tianjin,http://www.gdecg.com,http://gdecg.en.alibaba.com/contactinfo.html
"Wuhan Hengheda Pharm Co., Ltd.",Ms. Nancy Chuang,Market Director,86-27-84888681,13419582772,86-27-84888682,"Wuhan Private Science and Technology Park, Wuhan, China",,China,Hubei,Wuhan,http://www.hhdpharm.com,http://hhdpharm.en.alibaba.com/contactinfo.html
"Shanghai Sunwise Chemical Co., Ltd.",Ms. Alice Ma,,86-21-60906580,,86-21-60906590,"Room 2108-2110, South Tower, Fortune 108 Plaza, No. 1839 Qixin Road, Shanghai, P.R. China",201101,China,Shanghai,Shanghai,http://www.sunwisechem.com,http://sunwisechem.en.alibaba.com/contactinfo.html
"Xiantao Topmed Nonwoven Protective Products Co., Ltd.",Ms. Vivian Zhu,General Manager,0086-27-87861070,,0086-27-87861011,"Yindong Xiaoqu, Shazui Office",433000,China,Hubei,Xiantao,http://www.topmeddisposable.com,http://topmed.en.alibaba.com/contactinfo.html
"Shijiazhuang Duronma Trade Co., Ltd.",Ms. Alvaro Ken,CEO,86-0311-13231199039,13231199039,,"GaoXinDistrict,ChangJiangRoad,ChunLongBuilding 1008",050000,China,Hebei,ShiJiaZhuang,,http://duronma.en.alibaba.com/contactinfo.html
"Xi'an Fengzu Biotechnology Co., Ltd.",Ms. ALEX Xue,Director,86-029-89181410,18709106130,86-029-89189705,"Tangfengguoji 21F,No,18fenghuinanlu",710065,China,Shaanxi,Xian,http://www.fzbiotech.com/,http://fengzusw.en.alibaba.com/contactinfo.html
"Shenzhen Setolink Electronics Co., Ltd.",Ms. Linda Yang,GM,86-755-86330963,15302740831,86-755-86330961,"6F,Building 10,Hongtianmao Industrial Zone,Shangcun,Gongming,Shenzhen",518106,China,Guangdong,shenzhen,http://www.setolink.com,http://setolink.en.alibaba.com/contactinfo.html
"Xi'an Sky Biological Technology Co., Ltd.",Mr. Lee Li,CEO,86-0000-15137152021,15137152021,,weiyang,00000,China,Shaanxi,xi'an,https://biosky.en.alibaba.com/,http://biosky.en.alibaba.com/contactinfo.html
Xi'an Salus Nutra Bio-Tech Inc.,Mr. Jack Zhang,Mgr,86-29-63372090,13759953739,,"Room 7-1306,Shine City Building",710077,China,Shaanxi,XI AN,http://www.salusnutra.com,http://salusbio.en.alibaba.com/contactinfo.html
"Shenzhen Lontek Electronic Technology Co., Ltd.",Mr. fenquan wu,Manager,86-755-28071221,13724302529,86-755-29008442,"501, Building A2, Mingjun Industrial Park, Xinshi community, Dalang street, Longhua District, Shenzhen, Guangdong, China",518109,China,Guangdong,Shenzhen,http://www.szlontek.com,http://szlontek.en.alibaba.com/contactinfo.html
"Xi'an Baiqing Biotech Co., Ltd.",Mr. Anna LI,,86-029-81136322,,,tangyannalu,710000,China,Shaanxi,xi'an,,http://xabaiqing.en.alibaba.com/contactinfo.html
"Nanjing Yuansen Thai Biological Technology Co., Ltd.",Ms. Amy Liu,,86-25-84299993,8618551729373,,"Jianye District Huangshan Road No.8,Room 701",210019,China,Jiangsu,Nanjing,,http://njyanst.en.alibaba.com/contactinfo.html
"Nanjing Lotus International Trading Co., Ltd.",Mr. Chevy Han,General Manager,86-25-83326558,86-13951879586,"86-25-83321838,83352598","Room 505. No. 47, Pailou Lane, Star-Moon Mansion",210029,China,Jiangsu,Nanjing,http://www.chevymedical.com,http://chevy-medical.en.alibaba.com/contactinfo.html
"Nanjing Top Pharma Imp. & Exp. Co., Ltd.",Mr. Yan Xia,General Manager,86-025-86189316,18602529213,,"#2-611, Xincheng Center, No.126 Mid. Tianyuan Road",211100,China,Jiangsu,Nanjing,http://www.toppharma.cn,http://njtumu.en.alibaba.com/contactinfo.html
"Baowei Technology Qinhuangdao Co., Ltd.",Mr. Eric Wang,Senior Business Manager,0086-35-3576530,15369745310,,Oky Bay 4-2402,066000,China,Hebei,Qinhuangdao,http://www.baoweitech.com,http://baoweitech.en.alibaba.com/contactinfo.html
"Shenzhen Medke Technology Co., Ltd.",Ms. Sunny Li,,86-755-23463462,13686802071,,"RM.A,4/F,Bldg.A1,Anle Ind. Zone,Hangcheng RD.,Baoan Dist.",518126,China,Guangdong,Shenzhen,http://www.medke.com,http://medke.en.alibaba.com/contactinfo.html
"Chengdu Rosun Disinfection Pharmaceutical Co., Ltd.",Ms. Sonya Yu,Director of International Dept.,86-28-65988030,86 13228111566,86-28-65988023,"No.139 East 5th Rd. of Auto Center, Eco&Tech. Development Zone",610100,China,Sichuan,Chengdu,http://rosun.en.alibaba.com,http://rosun.en.alibaba.com/contactinfo.html
"Shanghai Tochance Chemicals Co., Ltd.",Ms. Vera Luo,Sales Manager,86-21-61005170,86-13524931708,86-21-61005171,"Room 2212,NO.1088 New JinQiao Road,PuDong",201206,China,Shanghai,Shanghai,http://www.tochance.com.cn,http://tochance.en.alibaba.com/contactinfo.html
"Changzhou Yuekang Medical Appliance Co., Ltd.",Mr. Jesy Ming,Sales Director,0086-158-95077070,15895077070,,"Meijia No2,Jiaoxi,Zhenglu Town,Tianning",213116,China,Jiangsu,Chagnzhou,http://www.yuekang.en.alibaba.com,http://yuekang.en.alibaba.com/contactinfo.html
"Shandong Idiou Pharmaceutical Co., Ltd.",Ms. li sa,Foreign trade manager,86-0538-18653841507,18653841507,,"Room 221, Mine Equipment Incubation Base, West Section of Nantianmen Street, Daiyue District",271000,China,Shandong,Tai'an City,,http://sdidiou.en.alibaba.com/contactinfo.html
"Tianjin Cartonic Imp. & Exp. Trading Co., Ltd.",Ms. Jane Shi,Sales Manager,86-22-60866168,86-18722265106,86-22-87932966,"1-C-806,Xinmaojunminyuan,Huayuan Industrial Zone, Tianjin, China",300384,China,Tianjin,Tianjin,http://www.disposable-items.com,http://cartonic.en.alibaba.com/contactinfo.html
"Nantong Healthcome Medical Products Co., Ltd.",Mr. Leon Wu,General Manager,0086-513-81052080,13776918750,0086-513-81052480,"3-814 Sunny city,No.1 Hongxing RD",226006,China,Jiangsu,Nantong,https://healthcome.en.alibaba.com/,http://healthcome.en.alibaba.com/contactinfo.html
"Shandong Retouch Wash And Sterilize Technology Co., Ltd.",Ms. adira sun,manager,86-0534-2714988,15853438631,,"East of National Road NO.105,Huangheya Industrial Park,Decheng District,Dezhou City Shandong province China.",,China,Shandong,Dezhou,http://sdruitaiqi.com,http://retouch.en.alibaba.com/contactinfo.html
"Xian Yingmai Trading Co., Ltd.",Mr. Mark Wang,COO,86-029-88264933,13484552959,,"No.46 Fenghe Road, Lianhu District",710000,China,Shaanxi,Xi'an,http://www.eveplant.com,http://auto365.en.alibaba.com/contactinfo.html
Xi'an Salus Nutra Bio-Tech Inc.,Mr. Jackie Zhang,Sales Manager,86-29-63699260,13759953739,86-29-88317874,"Rm. 3-2-802, No. 86, Jinye 2nd Road, High-Tech Zone",,China,Shaanxi,Xi'an,http://www.salusnutra.com,http://salusnutra.en.alibaba.com/contactinfo.html
"Xi'an Tongze Biotech Co., Ltd.",Mr. Vic Wang,,86-029-86745556,15619075519,86-29-86470966,"27F-A1, Floor 27, Bldg. A, Saigao Bldg., No. 16, Middle Of Weiyang Road, Economic Technological Development Zone",,China,Shaanxi,Xi'an,http://tzbio.en.alibaba.com,http://tzbio.en.alibaba.com/contactinfo.html
"Ningbo Dericsson Smart Technology Co., Ltd.",Mr. Deric Dai,GM,0086-0574-81857396,13819813528,,"No 456, Xinging Road, Yinzhou Dist,",315040,China,Zhejiang,Ningbo,,http://houseuses.en.alibaba.com/contactinfo.html
"Hunan Insen Biotech Co., Ltd.",Ms. Yilia Chen,Sales Director,86-029-81020913,17791963579,,"Health Road, Ecomonics Development Park, Liuyang County",410000,China,Hunan,Changsha,http://insen.en.alibaba.com,http://insen.en.alibaba.com/contactinfo.html
"Zhengzhou Famous Imp. & Exp. Co., Ltd.",Ms. Bella Zhang,Manager,86-0371-56836301,15903671602,86-0371-56836301,hanghai,450000,China,Henan,zhengzhou,,http://zzfamous.en.alibaba.com/contactinfo.html
"Xi'an Faithful Biotech Co., Ltd.",Ms. Ada Lv,,86-029-55348862,13137770562,,"Room 503,Unit 2,Building 3,TianLangDaXingJun,Daxing East Road,Lianhu District",710000,China,Shaanxi,xi'an,http://faithfulbio1.en.alibaba.com,http://faithfulbio1.en.alibaba.com/contactinfo.html
"Zhengzhou Yuanli Biological Technology Co., Ltd.",Ms. Yuanli Technology,Salesman,86-371-67897895,008613683821561,86-371-63507895,"No.8 Sanquan Road ,Jinshui District, Zhengzhou, Henan province, China",450000,China,Henan,Zhengzhou,http://www.sigmachem.cn,http://sigmachem.en.alibaba.com/contactinfo.html
"MoFoLo Medical Technology (Changzhou) Co., Ltd.",Ms. Jingle Wang,Manager,0086-519-88671120,0086 17712779393,,xinbei district Shimao Plaza,213115,China,,changzhou,http://WWW.MOFOLOMED.COM,http://almakflower.en.alibaba.com/contactinfo.html
"Shaanxi Hongbaiyi Biotech Co., Ltd.",Ms. Hongbaiyi Shaanxi,,86-29-86101461,15389010042,,115 Weiyang Road,,China,Shaanxi,Xi'an,,http://hongby.en.alibaba.com/contactinfo.html
"Hebei Linlv Trade Co., Ltd.",Ms. Maggie Zhang,Manager,86-311-82125012,15533603955,,Niujiaqiao,054000,China,Hebei,Xingtai,https://hblinlv.en.alibaba.com/?spm=a2700.7756200.0.0.6b8271d23yeyED,http://hblinlv.en.alibaba.com/contactinfo.html
"Nanjing Hoshin Medical Instrument Co., Ltd.",Ms. Stacy Wu,,0086-519-83384768,,,Tongjiang Middle Road,213022,China,Jiangsu,changzhou,http://www.hoshinmed.com,http://hoshinmedica.en.alibaba.com/contactinfo.html
"Xi'an Shouherb Biotech Co., Ltd.",,,,,,,,China,,,,http://shbio.en.alibaba.com/contactinfo.html
"Xi'an Sonwu Biotech Co., Ltd.",Mr. Frank Luo,manager,86-29-68740251,862913402965742,,I Du Hui Building NO.11 Tang Yan Road Xi'an High-tech Zone,,China,Shaanxi,Xi'an,http://www.sonwu.com,http://sonwu2.en.alibaba.com/contactinfo.html
"Anhui Tiankang Medical Technology Co., Ltd.",Mr. Yang Li,Director,86-550-7308717,13955078382,86-550-7308901,No. 20 South Renhe Road,239300,China,Anhui,Tianchang City,http://www.tkmedical.com,http://tkmedical.en.alibaba.com/contactinfo.html
"Chengdu Sino Science & Technology Co., Ltd.",Ms. Jenny Yang,sale manager,0086-028-68731056,008615208103145,0086-028-68731056,Tian fu avenue,610041,China,Sichuan,chengdu,http://www.cnherbfun.cn,http://cnherbfun.en.alibaba.com/contactinfo.html
"Xi'an Kerui Biotechnology Co., Ltd.",Mr. Lon Lee,,0086-029-61895230,13324521371,,,,China,,,http://WWW.KERUISW.COM,http://cnkrsw.en.alibaba.com/contactinfo.html
