company_name,contact_name,position,tel,mobile,fax,address,zip_code,country,province,city,website,ali_website
Dezhou Tongda Incubation Equipment Factory,Ms. Kylie Cheng,manager,0086-0534-2356752,008615315898356,,tianqu district,253000,China,Shandong,dezhou city,http://tongda-livestock.en.alibaba.com,http://tongda-livestock.en.alibaba.com/contactinfo.html
"Hebei Chunno Trading Co., Ltd.",Mr. Tim Hou,,0086-159-32013770,,,Hongqi Street,050000,China,Hebei,Shijiazhuang,http://chunno.en.alibaba.com,http://chunno.en.alibaba.com/contactinfo.html
"Shijiazhuang Dongmei Brush Co., Ltd.",Ms. Dong Mei,MANAGER,86-311-87775361,13503296601,,you yi street,,China,Hebei,SHIJIAZHUANG,http://www.make-up-brush.com,http://cndongmei.en.alibaba.com/contactinfo.html
"Beijing Hongrunda Sci-Tech Development Co., Ltd.",Ms. CATHY CHEN,Export Director,86-010-68233313,86-13601351633,86-010-68233313,"room 802 of building 1, WAN DI MING YUAN, No. 39 of XI SI HUAN ZHONG LU, Haidian District, Beijing, China",100039,China,Beijing,beijing,http://www.bjhongrunda.com.cn,http://bjhrd.en.alibaba.com/contactinfo.html
"Fuzhou Hedao Trade Co., Ltd.",Ms. josie wu,sales manager,0086-591-88280227,+86 13395087998,86-591-88280227,"Unit 406.2# Building of Wu Yi Lv Zhou, FuGuang South Rd, Taijiang District, Fuzhou, China.350011",350011,China,Fujian,Fuzhou,http://www.hedao-supply.com,http://fjhedao.en.alibaba.com/contactinfo.html
"Shenzhen Hostweigh Electronic Technology Co., Ltd.",Mr. Jerry Zhao,sales manager,86-755-36693768,13510750569,86-755-36693768,"2ND. BUILDING, XINYONGSHENG INDUSTRIAL PARK,SONGGANG,BAO'AN DISTRICT,SHENZHEN,518105 CHINA",518105,China,Guangdong,shenzhen,http://www.hostweigh.com,http://hostweigh.en.alibaba.com/contactinfo.html
"Shenyang Canta Medical Tech. Co., Ltd.",Ms. Canta Medical,Sales Manager,86-24-86728299-8024,15840505051,86-24-86728298,"No,76-39 Shenbei Road",110136,China,Liaoning,Shenyang,http://www.canta.com.cn,http://canta.en.alibaba.com/contactinfo.html
"Tianjin Lingchuang International Trade Co., Ltd.",Ms. yufeng tian,,022-86-13323366395,13323366395,,"No. 65,Huikang Road,Zhongbei Town,Xiqing District,Tianjin.",300000,China,Tianjin,Tianjin,,http://tjlingchuang.en.alibaba.com/contactinfo.html
"Qingdao Ocean Import And Export Co., Ltd.",Mr. JACK ZANG,,86-532-17096085155,,,NO3 XIANGGANG ROAD SHINAN QINGDAO,266000,China,Shandong,QINGDAO,http://qdocean.en.alibaba.com,http://qdocean.en.alibaba.com/contactinfo.html
"Quanzhou Jungle Wolf Technology Co., Ltd.",Ms. Emmy Huang,Manager,86-595-22186808,13799478267,86-595-22335517,"(Huaheng) No. 30, Huanqing Road, Huanqing Industry Area, Qingyuan Subdistrict, Fengze District, Quanzhou, Fujian, China (Mainland)",362000,China,Fujian,Quanzhou,https://rfidwristband.en.alibaba.com/,http://rfidwristband.en.alibaba.com/contactinfo.html
"Shenzhen Toptag Technology Co., Ltd.",Mr. Chrisitan Lv,General Manager,86-755-84320826,13600188484,,"Room 206A, GuiGuDongLi, LongGang Road 10",518116,China,Guangdong,Shenzhen,http://www.top-tag.com,http://top-tag.en.alibaba.com/contactinfo.html
"Xinxiang City Voyage Teaching Equipment Co., Ltd.",Mr. Yongchao Ma,,86-0373-5796859,86 18625951525,,hongqiqu,,China,Henan,xinxiang,http://www.xxyuanhang.cn,http://xxyuanhang.en.alibaba.com/contactinfo.html
"Hebei Enge Biotech Co., Ltd.",Ms. Vivian Xu,General Manager,0086-311-83079307,008613933032315,,Huai'an Road,050000,China,Hebei,Shijiazhuang,http://www.engebiotech.com,http://enge.en.alibaba.com/contactinfo.html
"Cangzhou Biocon Biotechnology Co., Ltd.",Ms. Jessica Han,sales manager,0086-317-4950777,13930749248,0086-317-4953888,Yihe building 913,061000,China,Hebei,Cangzhou,http://www.kdlfeed.com,http://bioconfeed.en.alibaba.com/contactinfo.html
"Shenzhen Creative Technology Co., Limited",Mr. Paul Pan,Sales,86-755-00000000,15019264137,,"1st Road of Donghuan, Longhua New district, Shenzhen, China.",518131,China,Guangdong,Shenzhen,,http://pmglobal.en.alibaba.com/contactinfo.html
Xi'an Horlden Bio Industries Inc,Mr. Jason Zhang,Sales Manager,86-029-86190047,86-15502982665,,"Unit 1,Building 1,Tangyan Rd NO 35,High-Tech Zone,Xi'an,China",71000,China,Shaanxi,Xi'an,http://www.horlden.com,http://wharton-biotech.en.alibaba.com/contactinfo.html
"Xi'an Pino Biotech Co., Ltd.",Ms. Michelle Lee,Purchasing manager,0086-029-62716126,008613299022017,0086-029-62716126,"Fengcheng No.1,Fengcheng 1 Rd,E&T Zone,Xi'an,China, Xi'an, Shaanxi, China (Mainland)",710016,China,Shaanxi,Xi'an,http://www.pinobiotech.cn,http://cn1519810064jeup.en.alibaba.com/contactinfo.html
"Shandong Yabin Medical Technology Co., Ltd.",Ms. Kathy Zhang,Manager,86-533-7508088,+8615550336875,86-533-7508088,"Linzi,Qilu Chemical Park, No.203",255414,China,Shandong,zibo,http://www.yabinmedical.com,http://yabinmedical.en.alibaba.com/contactinfo.html
"Yangzhou Shenkang Medical Devices Co., Ltd.",Ms. Zhu hong,Marketing director,,,,,,China,,,,http://yzskyl.en.alibaba.com/contactinfo.html
"Shenzhen Grand Electric Appliance Co., Ltd.",Mr. Kelvin Liu,,86-755-27696428,13316332698,86-755-27957402,"No.204,6th Building,Shiwaitaoyuan Taoyuanju,Baoan,Shenzhen,China",518126,China,Guangdong,Shenzhen,http://www.gdgrand.com,http://gdgrand.en.alibaba.com/contactinfo.html
"Harbin Haiousi Business Co., Ltd.",Ms. HOS HOS,,86-451-88996772,,,South 7th Street,150000,China,Heilongjiang,HARBIN,http://www.cn-hos.com/,http://cn-hos.en.alibaba.com/contactinfo.html
"Shenzhen Kindle Medical Devices Co., Ltd.",Mr. Gerrard zhang,,86-0755-27512545,0086-13537819090,,"4F.Building 2 The Hongzhengang Industrial Park, Gushu,Xixiang, Bao an District, Shenzhen, China",,China,Guangdong,SHEN ZHEN,http://www.kindlemedical.com,http://kindlemedical.en.alibaba.com/contactinfo.html
"Gemc Technology (Zhengzhou) Co., Ltd.",Mr. Charly Song,"G,M",86-371-60997506,15838280034,86-371-60997506,"No.20, Bosong Rd",450001,China,Henan,zhengzhou,http://www.gv-medic.com,http://gv-medic.en.alibaba.com/contactinfo.html
"Zhengzhou Olive Electronic Technology Co., Limited",Ms. Selina qu,Sales Director,86-371-86097307-2,0086 15981814377,,No.79 Zhenghua Road,450000,China,Henan,Zhengzhou city,http://www.zzolive.com,http://zzolive.en.alibaba.com/contactinfo.html
"Locosc Ningbo Precision Technology Co., Ltd.",Mr. Terry Liu,Sales manager,86-574-87673975,86-15658317616,86-574-87630707,"Hedong Village, Yongjiang, Jiangbei District",315021,China,Zhejiang,Ningbo,http://www.locosc.com,http://locosc.en.alibaba.com/contactinfo.html
"Qingdao Ocean Import And Export Co., Ltd.",Mr. Jack Zhang,Manager,0086-532-87666000,,,Shinaqu,266000,China,Shandong,Qingdao,http://tianeptinesodium.en.alibaba.com,http://tianeptinesodium.en.alibaba.com/contactinfo.html
"Guangzhou Benray Medical Equipment Co., Ltd.",Ms. Vivian Chai,,86-20-81716912,00 8615818790524,,huahai street liwan distict,510000,China,Guangdong,guangzhou city,http://www.gzbenray.en.alibaba.com,http://benraymed.en.alibaba.com/contactinfo.html
"Fuzhou Engrace Technology Co., Limited",Mr. Ivan Lee,Sales Manager,86-0591-87599927,18650096447,86-0591-87599927,"7F QianSui Bldg., No. 216 North LiuYi Road",350013,China,Fujian,Fuzhou,http://www.egrfid.com,http://egrfid.en.alibaba.com/contactinfo.html
"Yiwu Sanan Pet Products Co., Ltd.",Ms. Rachel ding,Sales Director,86-0579-85853039,13989426539,86-0579-85853039,"NO.287 ,Qunying Road , Yiwu City, Zhejiang. China",322000,China,Zhejiang,Yiwu,http://www.sananpetproducts.com,http://sananpetproducts.en.alibaba.com/contactinfo.html
"Wuhan Kangzheng Science And Technology Co., Ltd.",Mr. Joe Wang,market department,86-027-84410680,0086 13317109906,86-027-84410680,"ROOM 1203,/12f,2 Block, No.139 Hanyang Avenue , Hanyang District ,",430050,China,Hubei,Wuhan,http://www.whkzkj.cn,http://kzkj.en.alibaba.com/contactinfo.html
"Chengdu Blueworth Plastic Products Co., Ltd.",Mr. junior xiong,Sales Manager,0086-028-87984298-807,18381672207,0086-028-87984298-808,"No.4208,Xiyuan Road, Southern Area, Chengdu Modern Industrial Port, Sichuan Province",611730,China,Sichuan,Chengdu,http://www.blueworth.com.cn,http://blueworth.en.alibaba.com/contactinfo.html
"Shanghai Yomi Industrial Co., Ltd.",Ms. Bebe Chen,International Sales Manager,86-021-37576729,15000570289,,"Room 1022, Building 10, 1999 Guangtai Road, Fengxian District, Shanghai",,China,Shanghai,Shanghai,,http://yomichina.en.alibaba.com/contactinfo.html
"Shanghai EBSA International Trading Co., Ltd.",Ms. Elaine Zhu,,0086-21-56882918,008615021715922,,"Room315,Haibo Building, No.3615, Gonghexin Road,Zhabei District",200435,China,Shanghai,shanghai,http://www.Ebsa-pharma.en.alibaba.com,http://ebsa.en.alibaba.com/contactinfo.html
"Shijiazhuang Tu Hong Biotech Co., Ltd.",Mr. Dyson Ma,CEO,86-0311-80979556,17733833309,86-0311-80979556,"Hanging Garden, Zhaiying St",05000,China,Hebei,Shijiazhuang,http://www.chelateddha.com,http://tuhong.en.alibaba.com/contactinfo.html
"Jiangxi Fenglin Medical Appliances Co., Ltd.",Ms. Alvie Wu,Manager,86-795-6875998,13037235212,86-795-7076111,"Fulin Road, Fuzhou City, Jiangxi Province",344100,China,Jiangxi,Fuzhou,http://www.flin.cn,http://flin.en.alibaba.com/contactinfo.html
Shenzhen Vetplus Veterinary Instruments Manufacturer,Ms. Sabrina Law,,86-138-28495269,,,BAO'AN,,China,Guangdong,SHENZHEN,http://www.vetplus.com.cn,http://vetplus.en.alibaba.com/contactinfo.html
"Xi'an Cabin Kitchen Wares Co., Ltd.",Mr. Ernest zhu,Sales Manager,86-029-85419080,8615202989642,86-29-85419080,"Changfengyuan,Yanta District",710065,China,Shaanxi,Xi'an,http://www.cabinkitchenwares.com,http://cabinkitchenwares.en.alibaba.com/contactinfo.html
"Hebei Guangren Pharmaceutical Technology Co., Ltd.",Ms. Evan Liang,General Manager,86-311-80894911,13933828095,86-0311-80894911,"No. 419, Binhe Street, Qiaoxi Dist.",050091,China,Hebei,Shijiazhuang,http://WWW.GRDR.CN,http://grd.en.alibaba.com/contactinfo.html
"Xi'an Sgonek Biological Technology Co., Ltd.",Ms. Linda liu,Sales Manager,0086-029-61856331,0086-18602905487,,"Room 2501 building No.1,DingZhengDaDu Cheng Plot,FengCheng 8th road,Economic Technological And Development Zone,Xi'an City",,China,Shaanxi,xi'an,http://www.sgonekbio.com,http://sgonekbio.en.alibaba.com/contactinfo.html
"Shanghai Minhua Medical Apparatus Supplies Co., Ltd.",Mr. Peter Wang,Marketing director,86-21-59840221-8014,8615921276284,86-021-59841086,"No. 1591 Zhulu West Road, Xujing Town, Qingpu District Shanghai,China",201702,China,Shanghai,Shanghai,http://www.mhmedical.com.cn,http://minhuayiliao.en.alibaba.com/contactinfo.html
"Wuxi Biomedical Technology Co., Ltd.",Ms. HeLeN Bo,,86-510-85572789,13382885910,86-510-85572789,"Room No.408, No. 801 Hongqiao Road",214072,China,Jiangsu,Wuxi,http://www.portable-ultrasound-scanner.com,http://biomedical.en.alibaba.com/contactinfo.html
"Hubei Boshi Medical Instrument Co., Ltd.",Ms. jin e zhao,General manager,86-27-81737255,18062769399,,"NO.58, Optic Valley Ave.",430070,China,Hubei,Wuhan,https://boshihealthcare.com,http://hbboshi.en.alibaba.com/contactinfo.html
"Wuhu Ruijin Medical Instrument And Device Co., Ltd.",Ms. Amy Xi,Sales manager,86-0553-2672510,13675533452,86-0553-2672511,"33rd wanchun road,Wuhu economic technology developement zone",241000,China,Anhui,wuhu,http://www.ruijinmedical.com,http://medical-devices.en.alibaba.com/contactinfo.html
"Sinothinker Technology Co., Limited",Mr. Harry cheng,General Manager,86-755-86238653,13510306153,86-755-26037863,"RM 405,Nanshang building , Zhuguang Blvd, Nanshan District ,shenzhen",China,China,Guangdong,Shenzhen,http://www.sxk8.com,http://sxk8.en.alibaba.com/contactinfo.html
"Nantong Diagnos Biotechnology Co., Ltd.",Mr. Genos Dai,International Sales Manager,86-0513-80116067,13962910709,86-0513-85355050,"Building 6, Electronic Information Industry Park, 2 Haiyang South Road, Chengnan Subdistrict",226016,China,Jiangsu,Rugao,http://www.diagnosbio.com,http://diagnos.en.alibaba.com/contactinfo.html
"Shanghai Flower Medical Equipment Co., Ltd.",Mr. David Kong,General manager,86-021-55382728,13671906567,86-021-55382728-8018,"NO.235,Changyang Road, Hongkou,Shanghai, China",200082,China,Shanghai,Shanghai,http://www.shpfwyl.com,http://flower-med.en.alibaba.com/contactinfo.html
"NVK Weighing Instrument(Suzhou) Co., Ltd",Mr. James Pei,,86-0512-68183682,13862424890,,"Room 201 Venture Buliding 2 No.625 Binhe Road High-tech District, Suhzou City, Jiangsu Province, China",215010,China,Jiangsu,Suzhou,http://www.sznvk.com,http://suzhounarik2019.en.alibaba.com/contactinfo.html
"Shenzhen Dajing Chemical Co., Limited",Mr. Kevin Chan,sales manager,86-0755-23468056,19866728500,,Futian Street,518016,China,Guangdong,Shenzhen,,http://dajinchem.en.alibaba.com/contactinfo.html
"Henan Forever Medical Co., Ltd.",Mr. Jones Wang,,86-0371-61315851,,,Wanda Center,,China,Henan,Zhengzhou,http://www.yongjiumed.com,http://yongjiumed.en.alibaba.com/contactinfo.html
"Shanghai Cmrfid Information Technology Co., Ltd.",Mr. javier Cao,GM,86-021-62088910,18601658083,,"Room 501,NO.B building,Yuandong International Square,NO.317 Xianxia Road, Changning District",200051,China,Shanghai,Shanghai,http://www.cmrfid.org,http://cmrfid.en.alibaba.com/contactinfo.html
"Zunhua Lebei Pet Products Co., Ltd.",,,,,,,,China,,,,http://tslebei.en.alibaba.com/contactinfo.html
"Shandong Sukahan Bio-Technology Co., Ltd.",Ms. Sukahan Han,Marketing Manager,86-536-2225033,86 13355360729,86-536-2227077,"No.2237, East Wolong Street, High &New Technology Industrial District, Weifang, Shandong, P.R. China",261061,China,Shandong,Weifang,http://sukahan.com,http://sukahan.en.alibaba.com/contactinfo.html
Hunan Puqi Geologic Exploration Equipment Institute (Common Partnership),Mr. PQWT Manufacturer,Sales Manager,86-0731-82237112,18817121520,86-0731-84066916 - 812,"Room 301, Building A16, Jiahai Industrial Park, No. 1318 Zhongqing Road, Kaifu District",410000,China,Hunan,Changsha,http://www.pqwtdetector.com,http://pqwtcs.en.alibaba.com/contactinfo.html
"Weifang Fubang Pharmaceutical Co., Ltd.",Ms. Tina Wang,Sales Manager,86-0536-8257285,86 186 54866799,86-0536-8257285,"No.288,East of Lijiabu Village,Dawen River Tourism Development Zone",262100,China,Shandong,Anqiu City,http://www.fubangyaoye.com,http://pharm-fubang.en.alibaba.com/contactinfo.html
"Wellgreen Technology Co., Ltd.",Mr. Jacky Liu,Sale Manager,86-29-88453375,13572186576,86-29-89388326,"605 Building B, Oak Block, No.36 Fenghui Nan Road, Xi'an, China 710065",710065,China,Shaanxi,Xi'an,http://www.wellgreenxa.com,http://naturalfeed.en.alibaba.com/contactinfo.html
"Shenzhen Plinma Technology Co., Ltd.",Ms. Emily Cheung,,86-755-28097345,18923704003,,"3F, Building 14-2, Jixiang Road, Kengzi Jiedao, Pingshan New District",518000,China,Guangdong,Shenzhen,http://www.plinma.com,http://plinma.en.alibaba.com/contactinfo.html
"Guangzhou Maya Medical Equipment Co., Ltd.",Mr. Lyon Lau,,86-20-39160381,,,No. 773 Xingnan Avenue,,China,Guangdong,Guangzhou,http://www.gzmayamed.com,http://mayamed2.en.alibaba.com/contactinfo.html
"Changsha GOMECY Electronics Co., Ltd.",Mr. Mary WONG,CEO,0086-731-88616132,0086 18911130599,,"Rm. 1913, Bldg. A, Aokesi Plaza, No. 57, Yuelu Dist.",,China,Hunan,Changsha,http://www.gomecy.com,http://gomecy.en.alibaba.com/contactinfo.html
"Zhejiang Tiansong Medical Instrument Co., Ltd.",Mr. Eric Shentu,Manager,0086-0571-64241388,0086 13675854523,0086-0571-64241818,"NO.168 jianduan Road,Tonglu Economic&Technical Development Zone, Hangzhou, Zhejiang, China",311501,China,Zhejiang,Hangzhou,http://www.tiansong-endoscope.com,http://tiansong-instruments.en.alibaba.com/contactinfo.html
"MDK Industry Co., Ltd.",Mr. admin Mr,,86-431-81976357,17390904691,,Gaoxin District Weishan Road No4399 Xin Xing Hong Qi Jia YuanA-4 507room,130000,China,Jilin,changchun,http://www.jlmdk.com,http://ccmdk.en.alibaba.com/contactinfo.html
"Shenzhen Urion Technology Co., Ltd.",Malik Zhu,,86-0755-23457651,13714706365,,,,China,,,http://www.urion.com.cn/,http://urionsz.en.alibaba.com/contactinfo.html
"Beijing KellyMed Co., Ltd.",Ms. Beijing KellyMed,Export Manager,0086-10-82490385,18210565691,0086-10-65587908,"6R International Metro Center, No. 3 Shilipu, Chaoyang District, Beijing, 100025, China",100025,China,Beijing,Beijing,http://www.kelly-med.com,http://kelly-med.en.alibaba.com/contactinfo.html
"Shenzhen Quan & Heng Weighing Scale Co., Ltd.",Mr. Alvin Liang,Sales Manager,86-755-84571467,18138858442,86-755-84571467,"3F, Building 3, Jiuxiangling Industrial Area, Xili Town,",518055,China,Guangdong,Shenzhen,http://www.szqhhq.com,http://szqhhq.en.alibaba.com/contactinfo.html
"Wuhan CR Neutral Chemical Co., Ltd.",Ms. Jenny Zhang,Trade manager,0086-27-69114712,17786489370,0086-27-69114712,"Shuimo Tsinghua Community,Bldg 2,1404,HanYang District",43000,China,Hubei,WuHan,http://www.crneutralchem.cn,http://crneutralchem.en.alibaba.com/contactinfo.html
"Shanghai Ro-Chain Medical Co., Ltd.",Mr. Seven Yon,Sales Director,0086-21-58055329,0086-13585971607,0086-21-59055330,"Room 1605C, Zhongguancun Technology Building,No.2911 North Zhongshan road, Putuo district, Shanghai, China",200063,China,Shanghai,Shanghai,http://www.ro-chainmed.com,http://rochain.en.alibaba.com/contactinfo.html
"Shenzhen Manruta Technology Co., Ltd.",Ms. anny liu,manager,86-755-29684342,008613418988974,86-755-27475370,"room 2011,zhong xin ming zuo building, zhongxin road, shajing town, bao'an district",518104,China,Guangdong,shenzhen,http://www.manruta.en.aliaba.com,http://manruta.en.alibaba.com/contactinfo.html
"Dongguan Jihong Artwork Co., Ltd.",Ms. Sylvia Liang,Manager,0086-0769-82134448,86 13712421082,0086-0769-82134448,"4Floor 4 Building, Hecheng Industrial Feng huang gang Road Tangxia District,DongGuan City,Guangdong province China",518110,China,Guangdong,Dongguan,,http://jihonggift.en.alibaba.com/contactinfo.html
"Shenzhen Haoyingjia Technology Co., Ltd.",Ms. Clio ouyang,Manager,86-755-86024716,86-18927457513,,"2/F, Building A, Tongyi Industrial Park, 351 Jihua Road, Buji Town,Long Gang District, Shenzhen, Guangdong, P.R. of China",518112,China,Guangdong,Shenzhen,https://haoyinjia.en.alibaba.com,http://haoyinjia.en.alibaba.com/contactinfo.html
"Hebei Addtie Biological Technology Co., Ltd.",Mr. John li,manager,0086-0311-13032648458,18131163296,0086-0311-82062017,"China (Mainland) Hebei shijiazhuang No.66 Yuhua Road Qiaoxi District, Shijiazhuang City, Hebei Province",050000,China,Hebei,shijiazhuang,http://hebeiaddtie.en.alibaba.com,http://hebeiaidite.en.alibaba.com/contactinfo.html
"Xiamen Sunglan Imp. & Exp. Co., Ltd.",Mr. Jason Chk,Sales Manager,86-592-6533601,18850168532,86-592-5638725,"501,No.171,South of Songyu First Road,Haicang District",361026,China,Fujian,Xiamen,http://www.sunglan.com,http://xmsshenlang.en.alibaba.com/contactinfo.html
"Xinxiang Red Forest Edu. Instrument Co., Ltd.",Ms. Lily zhao,,0086-0373-3370168,008615225901071,3866282,Jianshe Road No.350,453000,China,Henan,Xinxiang city,http://www.hongshulinedu.com/,http://forestedu.en.alibaba.com/contactinfo.html
"Eto Industry (Shenzhen) Co., Ltd.",Ms. Eva Yan,,86-755-15994786890,15994786890,,"Xinxiu Road 30, Luohu District",,China,Guangdong,Shenzhen,,http://etopets.en.alibaba.com/contactinfo.html
"Jiaozuo Huisell Import&Export Co., Ltd.",Mr. Kevin Niu,General Manager,86-391-15517765060,15517765060,,Dongfang Garden,454000,China,Henan,Jiaozuo,http://www.huisellex.com,http://huisell.en.alibaba.com/contactinfo.html
"Henan Boyajiuhua Animal Husbandry Co., Ltd.",Ms. Bill Li,sales manager,86-371-86612058,86 15838215075,86-371-86612058,"21401 Shamen Community, Guoji Road",450045,China,Henan,Zhengzhou,http://www.boya588-eqpt.com,http://boya588-eqpt.en.alibaba.com/contactinfo.html
"Dongguan Koffiae Househould Products Co., Ltd.",Ms. Sasha xia,Manager,86-769-81188636,86 13694989002,,Bihualu No. 9 Songbaitang Industrial Zone Changping Town,,China,Guangdong,Dongguan,http://koffiae.en.alibaba.com/,http://koffiae.en.alibaba.com/contactinfo.html
"Henan Senyuan Biological Technology Co., Ltd.",Ms. Amy Li,Sales,86-0371-55683809,17737783195,,"Jinyin sun city ,GuoJi Road,JinShui District",,China,Henan,zhengzhou,http://www.senyuanco.com,http://senyuanco.en.alibaba.com/contactinfo.html
"Shanghai Solve Care Co., Ltd.",Ms. Crystal Zhang,Overseas Manager,86-21--31138663,,86-21--51685695,"Room 334-28, Chuangsha Road No 530, Pudong New District, Shanghai 201209, China",201209,China,Shanghai,Shanghai,http://solvecare.en.alibaba.com,http://solvecare.en.alibaba.com/contactinfo.html
"State (beijing) Medical Technology Co., Ltd.",Ms. Mandy Zhang,Manager,86-10-61271038,15117987933,86-10-61271038,"D312, Kaichi Building, No. 2A, Jinfu Road, Da Xing Economic Development Zone, Beijing. China (Mainland)",102600,China,Beijing,Beijing,http://en.statemedbj.com/,http://statemedbj.en.alibaba.com/contactinfo.html
"Shenzhen Sinoriko Technology Co., Limited",Mr. Sales Manager,Sales Manager,86-755-27850945,,,"A702, Zhihui Innovation Center",518000,China,Guangdong,518001,http://www.sinoriko.com,http://sinoriko.en.alibaba.com/contactinfo.html
"Dongguan IMDK Medical Technology Co., Ltd.",Ms. Coco Fan,Sales Manager,86-769-89793715,0086-13925831574,,"Zone C, Floor 8, No. 1, Binnong 3rd Road, Meitang Community, Huangjiang Town",,China,Guangdong,Dongguan,,http://dgimdk.en.alibaba.com/contactinfo.html
"Guangzhou Bisen Medical Co., Limited",Ms. Amanda Shi,Sales Manager,86-20-22090206,0086 18627186708,,"Room 711, Peace Business Center, No.898, Guangzhou Avenue South, Haizhu District",510277,China,Guangdong,Guangzhou,http://www.bisenmedical.com,http://bisenmedical.en.alibaba.com/contactinfo.html
"Changchun Wancheng Bio-Electron Co., Ltd.",Ms. Yanru Zhang,In't Manager,0086-431-84859877,0086-13844803003,,"The Third Floor, No. 3 building, No.789 Shunda Road, Changchun, Jilin Province, China",130000,China,Jilin,ChangChun,http://www.ccwancheng.com,http://jlwancheng.en.alibaba.com/contactinfo.html
"Shandong Dolphinmed Technology Co., Ltd.",Wong Mike,,,,,,,China,,,http://www.dolphinmed.com,http://dolphinmed.en.alibaba.com/contactinfo.html
"Moorange Electronics Mfg (Shanghai) Co., Ltd.",Ms. Eileen Xu,Director,86-21-64989018,18916600623,,"No.335, Group2 Haishen, Haiqiao Rd, Huinan, Pudong District",201301,China,Shanghai,Shanghai,http://www.hiweigh.com,http://moorange.en.alibaba.com/contactinfo.html
"Shaanxi Julin Biotech Co., Ltd.",Ms. Tina Qiu,,86-29-86217573,15389227837,,"Wenjing Plaza, Fengcheng 11th Road",710016,China,Shaanxi,Xi'an,https://shop39706b4116g86.1688.com,http://sxjulingbiotech.en.alibaba.com/contactinfo.html
"Shanghai Je-See Intl Industry Co., Ltd.",Ms. Mia Yang,,86-21-59178729,008615921357946,,shanghai,200083,China,Shanghai,shangahi,,http://jesee.en.alibaba.com/contactinfo.html
"Shenzhen Z-Fine Smart Card Co., Ltd.",,,,,,,,China,,,http://www.smartcard-inlay.com,http://zfrfid.en.alibaba.com/contactinfo.html
Jiangsu Rice Microelectronics Inc.,Mr. Forrest Peng,,86-514-85775116,15190386455,,9 Mintai Road,,China,Jiangsu,Yizheng,http://www.daoyuanmicro.com,http://ricemicro.en.alibaba.com/contactinfo.html
"Hangzhou Supernanny Import&Export Co., Ltd.",Mr. Arcess Chen,Gerneral Manager,86-571-82734763,18058141282,,garment market commercial zone,,China,Zhejiang,hangzhou,http://supernanny.en.alibaba.com,http://supernanny.en.alibaba.com/contactinfo.html
"World Of Health Biotech Co., Ltd.",Mr. Kai Cui,Sales manager,86-10-66179934,,86-10-66503718,"216#No.66 Qianbanbijie,Xinjiekou,Xicheng,Beijing.China",100035,China,Beijing,Beijing,http://www.healthbiotech.net,http://healthbiotech.en.alibaba.com/contactinfo.html
"Chongqing Fangtong Animal Pharmaceutical Co., Ltd.",Mr. Jin Fu,manager,0086-28-87768389,15108367686,0086-23-46761200,"Banqiao Industrial Park, Rongchong, Chongqing, China // Room 906 Lijing Garden, No 59 Shiye Street, Chengdu, China",402460,China,Chongqing,Rongchang,http://www.fangtongpharm.com,http://veterinary.en.alibaba.com/contactinfo.html
"Xi'an DN Biology Co., Ltd.",Ms. Sophy zhang,sales manager,86-29-87322976,18992871335,86-29-87332667,"Room 311, Lianhu Road,Lianhu District, Xi'an ,710003 China",710003,China,Shaanxi,Xi'an,http://www.dnbiology.com,http://dnbiology.en.alibaba.com/contactinfo.html
"K-MED Co., Ltd.",Mr. karl zhang,Boss,0086-0514-85597669,17712283233,86-0514-87952542,"International Trade Building or Cetra Building, Yangzhou, Jiangsu",225000,China,Jiangsu,yangzhou,https://k-med.en.alibaba.com/,http://k-med.en.alibaba.com/contactinfo.html
"Hangzhou Panzhuo Technology Co., Ltd.",Ms. Shallen Shi,Foreign Trade Manager,86-571-89172927,008615858950848,,"Room 304,Building 8th,No. 181,Wuchang Road,Yuhang District,Hangzhou,China",310021,China,Zhejiang,Hangzhou,http://www.hzpanzhuo.com/,http://panjietrade.en.alibaba.com/contactinfo.html
"Shanghai Sunbright Industrial Co., Ltd.",Ms. Jane Song,,86-21-51880686,18616107538,86-21-37567558,"No. 588 Mingcheng Road, Fengxian Dristrict",,China,Shanghai,Shanghai,http://www.cnsunbright.com,http://cnsunbright.en.alibaba.com/contactinfo.html
"Guangzhou Berrcom Medical Device Co., Ltd.",Ms. Cathy Zhou,,0086-020-34803118,13600037008,,Panyu shiqiao,511400,China,Guangdong,Guangzhou,https://berrcom.en.alibaba.com,http://berrcom.en.alibaba.com/contactinfo.html
"Changchun Wancheng Bio-Electron Co., Ltd.",Ms. Yanru Zhang,In't Manager,0086-431-84859877,0086-13844803003,,"The Third Floor, No. 3 building, No.789 Shunda Road, Changchun, Jilin Province, China",130000,China,Jilin,ChangChun,http://www.ccwancheng.com,http://jlwancheng.en.alibaba.com/contactinfo.html
"Shandong Dolphinmed Technology Co., Ltd.",Wong Mike,,,,,,,China,,,http://www.dolphinmed.com,http://dolphinmed.en.alibaba.com/contactinfo.html
"Moorange Electronics Mfg (Shanghai) Co., Ltd.",Ms. Eileen Xu,Director,86-21-64989018,18916600623,,"No.335, Group2 Haishen, Haiqiao Rd, Huinan, Pudong District",201301,China,Shanghai,Shanghai,http://www.hiweigh.com,http://moorange.en.alibaba.com/contactinfo.html
"Wuhan Cozing Medical Devices Co., Ltd.",Ms. Lancy Wu,Sales manager,0086-27-59261771,008615997406605,,"Building 6 No.8 Optical Valley , East Lake New Technology Development Area",430074,China,Hubei,Wuhan,http://www.cozingmedical.com,http://cozingmedical.en.alibaba.com/contactinfo.html
