company_name,contact_name,position,tel,mobile,fax,address,zip_code,country,province,city,website,ali_website
"Guangzhou Leyte Medical Equipment Co., Limited",Ms. Locy Huang,Manager,86-020-39145290,15013342766,,"Room 322 .Daxin Business Plaza.Shangjiao Dashi town, Panyu Area",511430,China,Guangdong,Guangzhou,http://www.leytemedica.com,http://leytemed.en.alibaba.com/contactinfo.html
"Guangzhou Ballya Bio-Med Co., Ltd.",Mr. Jon Wu,Sales manager,86-20-39479163,86-137 6076 3792,86-20-80671833,"5F. B Bldg, No.241 Shangye Rd, Huadu",510800,China,Guangdong,Guangzhou,http://www.ballyabio.com,http://ballya.en.alibaba.com/contactinfo.html
"Beijing Read Eagle Technology Co., Ltd.",Mr. Villie Zhao,Marketing Director,86-10-60804521,13922301199,86-10-60805205,"No.5 Mei`an Rd, Shilong Industrial Zone, Mentougou Dist.",102308,China,Beijing,Beijing,http://www.readeagle.com.cn,http://readeagle.en.alibaba.com/contactinfo.html
"Shenzhen Osen Technology Co., Ltd.",Ms. Maple You,Sales Director,86-755-61828870,86-15012852057,86-755-61587308,"4th Floor, Block B ,Fusen Industrial Zone , Hangcheng Road ,Bao'an District ,Shenzhen City ,GuangDong P.R .China",518126,China,Guangdong,SHEN ZHEN,http://www.szosen.com,http://szosen.en.alibaba.com/contactinfo.html
"Dezhou Jifeng CNC Equipment Co., Ltd.",Ms. Jack Zhang,Sales Manager,86-0534-2316385,008615315860731,,"No 19, Xuanhui Road",253000,China,Shandong,Dezhou city,,http://dzjifeng.en.alibaba.com/contactinfo.html
"Beijing Eaven Medical Instrument Co., Ltd.",Mr. EAVEN MEDICAL,,86-010-52103363,8613910380904,,"Building 9, Zone A, Seoul Sweet City, Yanjiao Town, Sanhe, Hebei, China",,China,Hebei,SanHe,http://www.eavenmed.com,http://eavenmed.en.alibaba.com/contactinfo.html
"Sainty International Group Jiangsu Yangzhou Sumex Imp. and Exp. Co., Ltd.",Mr. Dongfang Yin,Export manager,86-514-87018668,13511744429,86-514-85168445,"room 307,united plaza mansion, 479 hangjiang middle road,yangzhou CHINA",225009,China,Jiangsu,Yangzhou,http://www.medentalab.com,http://yzsmksyd.en.alibaba.com/contactinfo.html
"Qinhuangdao Senwo Trading Co., Ltd.",Mr. Kevin An,CEO,86-335-8582800,13582457128,86-335-8582800,"Room 408, Building 5,Xinglongshangfu(2 area Qingxin), E&T Development Zone, Qinhuangdao",066004,China,Hebei,Qinhuangdao,http://www.sanwinmed.com,http://sanwinmed.en.alibaba.com/contactinfo.html
"Jingdezhen Huiju Technologies Co., Ltd.",Mr. Bill Zou,Salesmanager,0086-798-6811976,0086 13879896948,,Kaixuan Huafu 19-102,333300,China,Jiangxi,Leping,,http://jdzhuiju.en.alibaba.com/contactinfo.html
"Shanghai Prema International Trade Co., Ltd.",Mr. nian he,Vice General Manager,86-21-65473191,8613311772832,86-21-65954562,"RM.208,553#,GAO YANG ROAD",200086,China,Shanghai,Shanghai,http://www.shprema.com,http://shprema.en.alibaba.com/contactinfo.html
Shanghai Deepbuy Trade Ltd.,Ms. Catharine Wang,Export manager,0086-21-13817318887,,,"Rm A405, Lvliang Technological & Innovation Area,No 828 Fengzhen Rd,Shanghai PRC",200434,China,Shanghai,Shanghai,http://www.shdeepbuy.com,http://deepbuy.en.alibaba.com/contactinfo.html
"Sichuan Gene Haven Animal Husbandry Technology Co., Ltd.",Mr. Andy Lou,,86-028-86111690,,,"No.53,Wansheng Road,Wuhou Area",,China,Sichuan,Chendu,http://www.sichuanjinhaifeng.com/,http://genehaven.en.alibaba.com/contactinfo.html
Yiwu Sinn E-Business Firm,Ms. Sinn Wang,,0086-579-13957937557,,,Beiyuan Street,,China,Zhejiang,Yiwu,http://sensotv.en.alibaba.com/,http://sensotv.en.alibaba.com/contactinfo.html
"Taizhou Kobold Sprayer Co., Ltd.",Mr. Bob Chen,,86-574-88082185,,86-574-88082098,": A-1701 JiuWu Building,Gaoxin",315000,China,Zhejiang,Ningbo,http://ww.agrico.cn,http://agrico.en.alibaba.com/contactinfo.html
Lumsail Industrial Inc.,Ms. Caroline Wei,Sales Manager,86-21-62528275-801,13162985000,86-21-62528275-802,"4F, No.9 YI, Lane 2 Suide Road, Putuo District, Shanghai City, P.R.China",200331,China,Shanghai,Shanghai,http://www.lumsail.com,http://lumsail.en.alibaba.com/contactinfo.html
"Shenyang Roundfin Trade Co., Ltd.",Ms. Snow Zhang,,0086-24-8656 5256,008613840454593,,1-14-3 No.96 Huanghe North Street,,China,Liaoning,Shenyang,http://www.syroundfin.com,http://syroundfin.en.alibaba.com/contactinfo.html
"Wuhan Gigaa Optronics Technology Co., Ltd.",Mr. Bruce Zhang,sales,86-27-67848871,,86-27-67848873,"B8-A5, Wuhan Hi-tech medical devices park,#818 Gaoxin Road",430074,China,Hubei,wuhan,https://www.gigaalaser.com,http://gigaalaser.en.alibaba.com/contactinfo.html
"Shanghai Bolan Optical-Electric Co., Ltd.",Mr. Johnny Hu,Manager,86-21-69225166,13641690009,86-21-69225266,"No. 29, Jiuyuan Road, Qingpu District",201707,China,Shanghai,Shanghai,http://www.sh-bolan.com,http://bl-slitlamp.en.alibaba.com/contactinfo.html
"Shenzhen Kaguwi Imp & Exp Co., Ltd.",Mr. charlie kong,general manager,86-531-89006948,0086-18753120642,86-531-89006648,"C-1123,NO.1,jiahui global plaza,548,beiyuan road,tianqiao district ,jinan ,shandong province ,china",548,China,Shandong,jinan,http://www.kaguwi.com,http://kaguwi.en.alibaba.com/contactinfo.html
"Guangdong ABLinox Sanitaryware Co., Ltd.",Ms. Shinely Liao,Sales manager,86-757-85916221,18927259562,,"Guangdong ABLinox Sanitaryware CO.,LTD,Wen De six street,Long Hu Road,Ying Bin Da Dao West,Zhao Qing High-tech area",526238,China,Guangdong,Zhaoqing,http://www.greenabl.com,http://gdablinox.en.alibaba.com/contactinfo.html
"Guangdong ABLinox Sanitaryware Co., Ltd.",Ms. Shinely Liao,Sales manager,86-757-85916221,18927259562,,"Guangdong ABLinox Sanitaryware CO.,LTD,Wen De six street,Long Hu Road,Ying Bin Da Dao West,Zhao Qing High-tech area",526238,China,Guangdong,Zhaoqing,http://www.greenabl.com,http://gdablinox.en.alibaba.com/contactinfo.html
"Qingdao Hiprove Medical Technologies Co., Ltd.",Mr. George Liu,General Manager,86-532-82812277,18653208877,,"ROOM2001,ZHONGHAI INTERNATIONAL PLAZA, NO237 WANNIANQUAN ROAD",266199,China,Shandong,Qingdao,http://www.hiprove.com,http://hiprovecorp.en.alibaba.com/contactinfo.html
"Shenzhen Sinpure Technology Co., Ltd.",Ms. Joan Huang,Sales manager,0755-2740-7036,18927479794,,"403 Building C, SiJiXingCheng, 161 Guangming Zhenming Rd, GongMing Street,Guangming New District, Shenzhen, China 518106",518106,China,Guangdong,Shenzhen,http://www.oem-sinpure.com,http://sinpure.en.alibaba.com/contactinfo.html
"Taizhou City Florid Powder Coating Co., Ltd.",Ms. Betty Han,Sales Manager,86-523-88686808,13775795436,86-523-88582696,East of city industrial park,225400,China,Jiangsu,JiangYan City,http://www.jsfuruida.com,http://florid2004.en.alibaba.com/contactinfo.html
"G & W World Trading Co., Ltd.",Ms. Elen Wang,Exporting Manager,86-21-61159512,13611700093,86-21-61159513,"Room142,D Area,1/F,Building 4,No. 2,Shengli RD,Qingpu District,Shanghai",201107,China,Shanghai,Shanghai,http://www.go-wininternational.com,http://gandw.en.alibaba.com/contactinfo.html
"Shanghai Intrag Medical Tech Co., Ltd.",Mr. Ling Xf,General Manager,86--139-55092612,008613955092612,86-550-2382166,"Room D29,Building No.2,619 Longchang Road,Yangpu District",200433,China,Shanghai,Shanghai,http://www.medintrag.com,http://medintrag.en.alibaba.com/contactinfo.html
"Shanghai Xuerui Imp. & Exp. Co., Ltd.",Ms. Sharon Liu,Managing Director,86-21-63569800,1390 199 6129,86-21-63250899,"Rm.06, 10/F, Block B,Silvabay Tower, 269 Haining Road, Shanghai 200080, China",200080,China,Shanghai,Shanghai,http://www.xuerui-sh.com,http://xuerui-sh.en.alibaba.com/contactinfo.html
"Qingdao Dacon Trading Co., Ltd.",Mr. Weishun Yang,Manager,86-532-80865298,,86-532-80865289,"Yosemite Bld 1-101,No. 28,Yinchuan Xi Road,Qingdao,China",266000,China,Shandong,Qingdao,http://www.dacon-china.com,http://dacon.en.alibaba.com/contactinfo.html
"Henan Baiyun Mugang Biotechnology Co., Ltd.",Mr. Eric Yu,Manager,0086-371-85967918,008615037192052,0086-371-65695576,"11TH FLOOR, BUILDING C, NO.8, YANGJIN ROAD, JINSHUI DISTRICT,",450000,China,Henan,Zhengzhou,http://www.mg-vet.com/,http://mugreen.en.alibaba.com/contactinfo.html
"Guangzhou Feya Trading Co., Limited",Ms. Marissa Jiang,Sales Manager,0086-20-29176026,0086-18565173995,0086-20-22278111,"1902, Huaxing Commercial Building, No. 150, Dabei Road, Shiqiao Street, Panyu District, Guangzhou, Guangdong, China (Mainland)",510000,China,Guangdong,Guangzhou,http://feyamedical.en.alibaba.com,http://feyamedical.en.alibaba.com/contactinfo.html
"Shaoxing Wanjia Appliance Co., Ltd.",Mr. Zhiming Ding,General Manager,86-575-85788798,0086-13777331602,86-575-85785789,"Industrial Zone, Wangtan Town, Shaoxing County, Zhejiang Province. China",312055,China,Zhejiang,Shaoxing,http://www.cnsxwj.net/,http://sxwj.en.alibaba.com/contactinfo.html
"Guangzhou Leyte Medical Equipment Co., Limited",Ms. Locy Huang,Manager,86-020-39145290,15013342766,,"Room 322 .Daxin Business Plaza.Shangjiao Dashi town, Panyu Area",511430,China,Guangdong,Guangzhou,http://www.leytemedica.com,http://leytemedica.en.alibaba.com/contactinfo.html
"Nanjing Pioway Medical Lab Equipment Co., Ltd.",Ms. Angela Meng,Export Manager,86-25-84677741,,86-25-84677742,"Deying International Plaza, No. 222 Changhong Road",210012,China,Jiangsu,Nanjing,http://www.pioway.com,http://pioway-medical.en.alibaba.com/contactinfo.html
"Hebei Depond Animal Health Care Science And Technology Co., Ltd.",Ms. Jane Chou,,86-311-89682366,,86-311-86215532,"NO.8, SHUANGTONG ROAD, MENGTONG INDUSTRIAL AREA, LUQUAN, SHIJIAZHUANG CITY, HEBEI PROVINCE, CHINA",,China,Hebei,Shijiazhuang,http://www.depondcn.com,http://depond.en.alibaba.com/contactinfo.html
"Xinxiang Jinxin Import And Export Machinery Co., Ltd.",Mr. Jason Lee,,86-373-5871333,15516625686,86-373-5871999,Gongyuanguoji,453000,China,Henan,Xinxiang,http://www.jxcryo.com,http://jinxingroup.en.alibaba.com/contactinfo.html
"Beijing Jin Xin Si Sheng Yuan Science And Technology Co., Ltd.",Mr. Kevin Chen,Manager,0086-10-83818945,008618611101478,,"Beidadisanli,No16Yard, Building 32, Room 211",100071,China,Beijing,"Beijing,Fengtai District",http://www.jinxinmed.com/en,http://jinxinmed.en.alibaba.com/contactinfo.html
"Jiangsu Kangbao Medical Equipment Co., Ltd.",Mr. Jimmy Xie,Export Manager,86-514-88223540,18921918507,86-514-88232089,"No.78,North Su Zhong Road",225800,China,Jiangsu,Baoying,http://www.medkb.cn,http://medkb.en.alibaba.com/contactinfo.html
"Wenzhou Longwan Foreign Trade Co., Ltd.",Mr. esther pan,,86-0577-56769290,15858531154,,"No.999,airport road,longwan",,China,Zhejiang,wenzhou,,http://losca.en.alibaba.com/contactinfo.html
"Wuhan J.H. Bio-Tech Co., Ltd.",Ms. Serena Liu,Manager,86-27-87537029,15927344520,86-27-87537029,"6/F, Bldg. 7-5, Guandong Industrial Park, East Lake Hi-Tech Development Zone",430074,China,Hubei,Wuhan,http://jhwanfangtang.cn.alibaba.com,http://wanfangtang.en.alibaba.com/contactinfo.html
"Dezhou Weiqian Import&Export Co., Ltd.",Mr. Rongyong Yue,General Manager,0086-534-2300835,008615853472322,0086-534-2300835,"No.19,Xuanhui Road,Tianqu Industrail zone,Decheng district,Dezhou city",253000,China,Shandong,Dezhou city,http://www.weiqian-poultry.en.alibaba.com,http://weiqian-poultry.en.alibaba.com/contactinfo.html
"Zhengzhou Sihai Breeding Equipment Co., Ltd.",Ms. Lucy Chen,Salesman,86-0-55906668,008618337157058,86-0-55906668,"No.056,Chengou Village,Guangwu Town,Xingyang",450100,China,Henan,Zhengzhou City,http://www.feederforpig.com,http://zzshyz.en.alibaba.com/contactinfo.html
Guangzhou Cancare Medical Trading Company Ltd.,Mr. Joseph Zhou,Sales Manager,0086-020-29814094,13926480041,,"DaXin Building 2203C room,DeZheng North Road No.538,YueXiu District",,China,Guangdong,Guangzhou,http://www.chinacaremedical.com,http://cancare.en.alibaba.com/contactinfo.html
"Qingdao Joyjun Medical Products Co., Ltd.",Ms. Megan Sun,,86-532-82812277,,,"No. 237, Wannianquan Road",,China,Shandong,Qingdao,http://joyjun.com,http://joyjun.en.alibaba.com/contactinfo.html
"Zhangjiagang Edinbor Medical Instrument Co., Ltd.",Mr. Lin Huang,Sales Manager,0086-512-56799108,008618018119699,,"Yangshe Town, Zhangjiagang, Jiangsu, China (Mainland)",215600,China,Jiangsu,zhangjiagang,http://www.edinbor.com,http://edinbor.en.alibaba.com/contactinfo.html
"Qingdao Noterd Technology Co., Ltd.",Mr. owen zhang,General manager,86-532-85973726,86-18905426866,86-532-85976888,"no 51 taiping road,shinan district",266000,China,Shandong,qingdao,http://www.noterd.en.alibaba.com,http://noterd.en.alibaba.com/contactinfo.html
"Sainty International Group Jiangsu Yangzhou Sumex Import & Export Co., Ltd.",,,,,,,,China,,,http://medentalab.com,http://yzsumexmedical.en.alibaba.com/contactinfo.html
"Wuhan W&Z Biotech Co., Ltd.",Ms. Cindy Kong,,86-027-87250747,13317165342,,Wuluo Road,,China,Hubei,Wuhan,http://wzbiotech.en.alibaba.com,http://wzbiotech.en.alibaba.com/contactinfo.html
"Shenzhen Baoke Medical Appliance Co., Ltd.",Mr. Andrew Chou,,86-0755-89642080,008613714531486,,Longgang,518110,China,Guangdong,Shenzhen,http://www.baokemedical.com,http://baokemedical.en.alibaba.com/contactinfo.html
"Luohe Huahui Daily Articles Co., Ltd.",Mr. Robert Hu,Manager,86-395-2611778,13939508781,86-395-2662190,"NO.28 HUALIAN ROAD ,LUOHE CITY ,HENAN CHINA",,China,Henan,LUOHE,http://www.loofah.com.cn,http://loofah.en.alibaba.com/contactinfo.html
"Jiangsu Micsafe Medical Technology Co., Ltd.",,,,,,,,China,,,http://www.micsafe.com,http://micsafe.en.alibaba.com/contactinfo.html
"Ningbo Suncity Package Co., Ltd.",,,,,,,,China,,,http://www.china-vials.com,http://shengshide.en.alibaba.com/contactinfo.html
"Yiwu Kaiding E-Commerce Co., Ltd.",Mr. Herman Guo,Manager,0086-186-10218984,18610218984,,Xinggang Dist.,322000,China,Zhejiang,City of Yiwu,,http://kaiding2.en.alibaba.com/contactinfo.html
"Guangzhou Yonggao Farming Machinery Technology Co., Ltd.",Ms. May Xiong,,0086-020-37089891,008613828013538,,,,China,,,http://www.yonggaofarming.com,http://yonggaofarming.en.alibaba.com/contactinfo.html
Yangzhou Goldenwell Medical Devices Factory,Mr. Jacky Wang,Manager,86-514-86889666,86 18652531234,86-514-87210448,"No.16 Tengfei Road , Dinggou Industrial Park of Jiangdu District , Yangzhou City, Jiangsu Province, P.R.China",225235,China,Jiangsu,Jiangdu,http://chinagoldenwell.en.alibaba.com,http://golden-well.en.alibaba.com/contactinfo.html
"Ningbo Healsunny Technology Co., Ltd.",Ms. Sunny Yang,,86-0574-88353159,8618069153089,,"No. 1333,XiaYing Section Of Yinzhou Avenue, Yinzhou",,China,Zhejiang,Ningbo,https://healsunny.en.alibaba.com,http://healsunny.en.alibaba.com/contactinfo.html
"Dezhou Holead Imp & Exp Co., Ltd.",Mr. Leon Zhao,CEO,86-0534-2328791,008615288897123,,Guoyuan Lu Lingxiu Tianqu Area D Zone 7#,,China,Shandong,Dezhou,http://www.xch86.com,http://xch86.en.alibaba.com/contactinfo.html
"New Best Hygiene Co., Ltd.",,,,,,,,China,,,,http://nbhygiene.en.alibaba.com/contactinfo.html
"Xiamen Nicest Paper Products Co., Ltd.",Mr. Ken Huang,Sales Manager,86-592-13959235815,13959235815,86-592-13959235815,"No.100 Huli Industrial Zone, Meixi Road, Xike Street, Tongan District",361100,China,Fujian,Xiamen,http://www.nicest-packaging.com,http://xmnicest.en.alibaba.com/contactinfo.html
"Sichuan Shuiwangzi Environment Technology Co., Ltd.",Ms. Sonya Yu,Manager,86-28-65988030,,,"No. 18, Section 2,Middle Road of Biological City, Shuangliu District,Chengdu",,China,Sichuan,Chengdu,,http://ecowatertech.en.alibaba.com/contactinfo.html
"Shanxi Yameijia Trading Co., Ltd.",Mr. Qiang Gao,,86-0351-8720291,,,nanneihuanjie,,China,Shanxi,Taiyuan,https://gaoyuhan.en.alibaba.com/,http://gaoyuhan.en.alibaba.com/contactinfo.html
"Hubei YJT Technology Co., Ltd.",Mr. SKY LAN,Manager,86-27-51231823,13871232457,86-27-86648605,"Block 7, Guannan Fuxing Pharmaceutical Park, No. 62 Optical Valley Road, East Lake Hi-tech Development Zone, Wuhan, Hubei Province, China",430074,China,Hubei,Wuhan,http://www.chnhnc.com,http://hnc.en.alibaba.com/contactinfo.html
"Shenzhen Ninaisi Technology Co., Ltd.",Ms. Amy Wu,,86-755-28157058,,,"6th floor,ZhiFuRun Industrial Park, LuoWuWei",518109,China,Guangdong,Shenzhen,http://www.yuvnice.com,http://yuvnice.en.alibaba.com/contactinfo.html
"Shanghai Xinglu Chemical Technology Co., Ltd.",Mr. Albert Zhang,Sales Manager,86-021-20970332,86 13524231522,,"No 500 Jianyun Road, Pudong District",,China,Shanghai,Shanghai,http://www.shxlchem.com,http://xingluchemical.en.alibaba.com/contactinfo.html
"Xiamen Yizheng Anno Health Care Products Co., Ltd.",Ms. Tina Chan,Business Manager,86-592-2110633,,86-592-2110088,"1403,BE-TOP PLAZA, NO.617 SISHUI ROAD, WUYUANWAN, XIAMEN, CHINA",361000,China,Fujian,Xiamen,http://www.annochina.com,http://annochina.en.alibaba.com/contactinfo.html
"Nanjing Perlove Medical Equipment Co., Ltd.",Mr. Frank Lee,Sales Director,0086-25-87187780,0086-18606197259,0086-25-87187780,"No.168 Kaiyuan Road,Jiangning Science Park, Nanjing 211112 China",211112,China,Jiangsu,Nanjing,http://www.perlove.com.cn/,http://perlove.en.alibaba.com/contactinfo.html
"Wuxi Wemade Healthcare Products Co., Ltd.",Mr. Bruce wang,slaes department,86-510-88537033,,86-510-88530277,"Panlong Road, Area B, Dacheng Industrial Park, Anzhen, xishan dist",214105,China,Jiangsu,wuxi,http://www.wmdmedical.com/,http://wemade.en.alibaba.com/contactinfo.html
Huizhou Zhanyue Plastics Ltd.,Mr. lewis yu,Sales Manager,86-0752-2395539,13531680936,,"LianHe market,Central Village ,ShuiKou Town",516001,China,Guangdong,HuiZhou,https://hzzhanyue.en.alibaba.com/,http://hzzhanyue.en.alibaba.com/contactinfo.html
"Wellgreen Technology Co., Ltd.",Mr. Liu Gang,Manager,"86-29-88453375,13572186576",13572186576,86-29-88352329,"1107 Building No.1 Huangjinjiayuan Tuanjie South Rd,Xi'an China 710077",710077,China,Shaanxi,xi'an,http://www.wellgreenxa.com,http://wellgreenxa.en.alibaba.com/contactinfo.html
"Guangzhou Taiza Electronic Technology Co., Ltd.",Ms. Green Liao,,086-20-32222117,,086-20-32222117,"No.2 XinZhuang 5th Road, Yonghe Town,Economic and Technical Development Zone, Guangzhou",511356,China,Guangdong,Guangzhou,http://www.taizaweighing.com,http://tinybepetpro.en.alibaba.com/contactinfo.html
"Jiaxing Dawnsail Biotech Co., Ltd.",Mr. Bryan Yang,,0086-573-82726776,008618621102596,,"Building 1, 501 Changshengnang Road",,China,Zhejiang,Jiaxing,http://www.dawnsailbio.com,http://cn1511724332.en.alibaba.com/contactinfo.html
"Yangzhou Nuoya Machinery Co., Ltd.",Mr. David Shi,Manager,86-514-87667998,13813182501,86-514-87665265,"Yangshou Industry Area, Hanjiang District",225000,China,Jiangsu,YangZhou,http://www.noah-pm.com/en,http://noah-pm.en.alibaba.com/contactinfo.html
"Kernel Medical Equipment Co., Ltd.",Ms. Kernel Medical,,0086-516-87732209,15396822965,0086-516-87732210,"Kernel Medical Equipment Co.,Ltd",221004,China,Jiangsu,Xuzhou,http://www.kernelmedint.com/,http://kernellmedical.en.alibaba.com/contactinfo.html
"Hangzhou Health Shining Electronic Technology Co., Ltd.",Mr. Richard Tao,sales manager,86-571-28120342,18658896852,,"No. 190, Pingfeng Cun, Liuxia Town, Hangzhou, China",,China,Zhejiang,Hangzhou,http://www.cnhealthshining.com,http://healthshining.en.alibaba.com/contactinfo.html
"Shandong Newstart International Co., Ltd.",Mr. Kevin ZHANG,Export Manager,86-543-3357706,008613505438449,,"No 476,Huanghe 7 Road",256600,China,Shandong,Binzhou,http://www.nsagro.com.cn,http://nsagro.en.alibaba.com/contactinfo.html
"Beijing Marapole Technology Co., Ltd.",Ms. Ruby Xue,Deputy General Manager,0086-10-51146647,15011212287,0086-10-58715289,Room 1601 Building 3 Ruidu International Jiukeshu Tongzhou,101101,China,,Beijing,http://www.marapole.com,http://marapole.en.alibaba.com/contactinfo.html
"Shanghai Jaqi International Trade Co., Ltd.",Ms. Allen Wang,Sales Manger,86-21-17717059591,86 17717059591,,"No.618,Xinlin road,Fengxian Area",201499,China,Shanghai,shanghai,http://www.jaqimedical.com,http://jaqimedical.en.alibaba.com/contactinfo.html
"Zhengzhou Senmy Dental Equipment Co., Ltd.",Mr. Eric Wei,General Manager,86-371-63719519,8618937111659,,No.101 Tongbai Road,450000,China,Henan,Zhengzhou,http://www.senmydental.com,http://senmydental.en.alibaba.com/contactinfo.html
"Biobase Meihua Trading Co., Ltd.",Ms. Danae Liu,,0086-0531-68629823,008613583178809,,No. 51 South Gongye Road,250101,China,Shandong,Jinan,http://www.meihuatrade.com,http://meihuatradecn.en.alibaba.com/contactinfo.html
"Shenyang PUSM Medical Device Co., Ltd.",Ms. Kelly GU,,86-024-31098919,0086-13998124587,86-024-31098918,"34, 4TH S Jianshe Rd, Shenbei New District",110112,China,Liaoning,Shenyang,http://www.pusm-medical.com,http://pusm.en.alibaba.com/contactinfo.html
"Dezhou Sunton Import&Export Co., Ltd.",Ms. Nina Ding,Manager,86-534-2600187,15806815171,,Hubin North Road,253000,China,Shandong,Dezhou,http://www.poultry-eggincubator.com,http://dzsunton.en.alibaba.com/contactinfo.html
"Longmission Agricultural Equipments Co., Ltd.",,,,,,,,China,,,,http://longmission.en.alibaba.com/contactinfo.html
"Chengdu Cryostech Equipment Co., Ltd.",,,,,,,,China,,,http://www.cryostech.cn,http://cryostech.en.alibaba.com/contactinfo.html
"Beijing Kangpuhuiwei Technology Co., Ltd.",Ms. Grace Liu,SALES,86-10-67290010,86-13522223295,86-10-67777729,"DOUGEZHUANG TOWN,CHAOYANG DISTRICT,BEIJING,CHINA",100024,China,Beijing,Beijing,https://kphwchem.en.alibaba.com/?spm=a2700.7756200.1998619056.8.5h40OK,http://kphwchem.en.alibaba.com/contactinfo.html
"Hebei Aicrowe Biotech Co., Ltd.",Mr. fengya du,,86-0311-66855331,8615533616561,,yuhuaxilu66hao,,China,Hebei,shijiazhaung,http://www.aicrowe.cn,http://aicrowe.en.alibaba.com/contactinfo.html
"Shanghai Biochemical Co., Ltd.",Ms. Jane Chen,,86-21-33825087,86-139-1739-1617,,"Suite1117, 561# XiuChuan Rd., PuDong New area",201200,China,Shanghai,Shanghai,http://www.fermentertech.com,http://shbiochemical.en.alibaba.com/contactinfo.html
"Shenzhen Chuangxinjia Smart Technology Co., Ltd.",Ms. Betty Xu,Foreign Sales,86-0755-83497810,8613510748671,86-0755-83497842,"level 11, Datang Times Business Building ,Meilong Road, Longhua New District",518109,China,Guangdong,Shenzhen,http://www.nfctagfactory.com,http://greatcreativity.en.alibaba.com/contactinfo.html
"Guangdong Chaoqiang Electronic Technology Co., Ltd.",Ms. Nancy chen,manager,86-0769-23050998,15362050108,86-0769-27234620,"NO.53,building D,zhi fu street ,lingxia liaobu town,dongguan city",,China,Guangdong,dongguan,http://www.hecq88.com,http://metal-detector.en.alibaba.com/contactinfo.html
"Rizhao Lukang Plastic Product Co., Ltd.",Mr. Fanming Wang,Manager,86-0633-6781001,18706333999,86-0633-6780111,"Lijiaquantou village, Liuguanzhuang Town, Ju country",276500,China,Shandong,Rizhao City,http://www.rzlukang.com/,http://lukangplastic.en.alibaba.com/contactinfo.html
"Shenzhen Pacom Medical Instruments Co., Ltd.",Mr. Eric Hao,,86-0755-28266107,18926500037,,"B Area of 8/F,The 2nd Builing, No.5 Industry Five Road,Jiangbian Community,Songgan Town,BaoAn District, Shenzhen,China",518105,China,Guangdong,Shenzhen,http://www.pacomsz.com,http://pacomsz.en.alibaba.com/contactinfo.html
"Gaotang County Guoyou Machinery Equipment Co., Ltd.",Mr. water He,,86-0635-5195858,13780723366,86-0635-5195858,The Economic Development Zone Gaotang County,252800,China,Shandong,Liaocheng,http://huitongjx.cn.alibaba.com/,http://lcht.en.alibaba.com/contactinfo.html
"Henan Mertone Mechanical Equipment Co., Ltd.",Mr. Mertone Lee,Sales Manager,0086-371-68901795,008615638100917,,World Trade Center,450000,China,Henan,Zhengzhou,http://www.mertonmachinery.com,http://hnmerton.en.alibaba.com/contactinfo.html
"Shanghai Ewan Commercial And Trading Co., Ltd.",Ms. Shirley Yoo,Director,86-0-18916690526,18916690526,,songjiang,201600,China,Shanghai,shanghai,,http://ewanshanghai.en.alibaba.com/contactinfo.html
"Baoying Rafid Electronics Co., Ltd.",Ms. junlan gao,General manager,86-0514-88256268,13952700702,86-0514-88246111,"888 Jinyuan road,Baoying county,Yangzhou city,Jiangsu province,China",225800,China,Jiangsu,Yangzhou,http://www.cardrafid.com,http://cardrafid.en.alibaba.com/contactinfo.html
"Anhui Yomo Machinery Group Co., Ltd.",Mr. Yomo Machinery,Director,0086-552-6680998,0086 15240686249,0086-552-6680999,Tongling Industrail Park,,China,Anhui,Bengbu City,http://www.yomogroup.com,http://ahymjt.en.alibaba.com/contactinfo.html
"Shandong Longchang Animal Health Product Co., Ltd.",Ms. Betty Liu,Export manager,86-531-66699786,,,"Jingshi road 19288 , Lushang Square , A building 609",250062,China,Shandong,Jinan,http://www.sdlachance.com,http://lachance.en.alibaba.com/contactinfo.html
"Zhejiang Menghua Sprayer Co., Ltd.",Ms. Vian Chen,Manager,0086-576-88204565,0086-13456664134,0086-576-88204566,"West Industrial Zone, Huangyan",318020,China,Zhejiang,Taizhou,http://www.koboldsprayer.com,http://kobold.en.alibaba.com/contactinfo.html
"Ningbo Snowpart Electronic Co., Ltd",Ms. Snow Chen,Sales Manager,0086-0574-88127907,15967807125,0086-0754-88123352,"Rm 508,Yitian building,NO.850,Chengxin Road,Yinzhou.",315100,China,Zhejiang,Ningbo,http://www.snowpart.com,http://snowpart.en.alibaba.com/contactinfo.html
"Zhengzhou Yuhuo Trading Co., Ltd.",Ms. l Lucy,,86-0371-86151367,15238610918,,dongfenglutianminglu,410000,China,Hainan,zhengzhou,http://zzyh.en.alibaba.com/,http://zzyh.en.alibaba.com/contactinfo.html
"Chengdu Tongyong Xingda Electrical Cabinet Co., Ltd.",Mr. Leo Wu,International trade sales,86-28-87893548,86-13739460387,86-28-87893549,"No.360 of north harbor four road, northern district, Chengdu modern industry port, Pixian",611743,China,Sichuan,Chengdu,http://www.cdtyxd.com,http://cdtyxd.en.alibaba.com/contactinfo.html
"Shanghai Star Industry Co., Ltd.",Mr. Wallace Feng,manager,86-21-61362486,18621308769,86-21-61362422-806,"No399-488,Dushi Road,Minhang,Shanghai,China",201109,China,Shanghai,Shanghai,http://www.wstari.com,http://wstari.en.alibaba.com/contactinfo.html
"Foshan Guos Wintape Measuring Tape Co., Ltd.",Ms. Stella He,,86-20-81125848,,,"31th White Swan Building,Huangqi,Nanhai",528248,China,Guangdong,Foshan,http://www.measuringtape.org,http://measuringtape.en.alibaba.com/contactinfo.html
"Yiwu Kinghon Trading Co., Ltd.",Mr. Albert Jiang,,0086-579-85088089,,,"302,6 units,75 building, danxi 2 district, beiyuan street,",,China,Zhejiang,Yiwu,,http://yiwukinghon.en.alibaba.com/contactinfo.html
